Review,giai_tri,luu_tru,nha_hang,an_uong,di_chuyen,mua_sam
Ngắm bình minh và thành phố vào sáng sớm bao đẹp,0,0,0,0,0,0
"NÚI XUÂN VÂN QUY NHƠN..Núi Xuân Vân thuộc Phường Gành Ráng - TP Quy Nhơn - Bình Định, lên đến đỉnh nhìn TP rất đẹp..Núi Xuân Vân có độ cao 242m. Để lên được núi, bạn có thể vào khu du lịch Gành Ráng, men theo con đường dọc biển hướng sang Quy Hoà..Có tất cả 14 chặng – hơn 2.000 bậc thang, cứ mỗi chặng sẽ có một phiến đá khắc số chặng mà bạn đã đi qua. Đối với những người lần đầu trải nghiệm thì việc mệt bở hơi tai ngay ở chặng 3, chặng 4 là điều không thể tránh khỏi. Đoạn đường đi bộ từ cổng khu du lịch Gành Ráng sẽ gặp nhiều cảnh đẹp để thưởng ngoạn..Đây là điểm du lịch thích hợp cho những người thích khám phá và rèn luyện sức khỏe!.Nguyễn Thanh Phuong, PhD.,",0,0,0,0,0,0
Nơi ngắm bình minh lý tưởng ở tp. Quy Nhơn.,0,0,0,0,0,0
Leo lên núi vùa được gạp Đức Chúa vừa được ngắm toàn cảnh Quy Nhơn,0,0,0,0,0,0
"NÚI BÀ HOẢ QUY NHƠN..Núi Bà Hỏa nằm về phía Tây Bắc bản đảo Quy Nhơn. Từ trên cao nhìn xuống, núi Bà Hỏa có hình tam giác..Trước 1975, tại vị trí này có một cột sắt rất cao, trên đỉnh có ngọn đèn đỏ chớp sáng mỗi tối để báo hiệu cho máy bay từ hướng Bắc, mỗi khi đáp xuống phi trường Quy Nhơn..Thời chiến, trước 1975, núi Bà Hỏa là khu vực quân sự, quân đội Mỹ và VNCH đóng ở đó với kho đạn sát bên khu vực đèo Son và hồ Phú Hòa liền kề phía Tây..Sau 1975 đến nay đã được trồng cây gây rừng tái tạo cảnh quan môi trường, tạo lá phổi xanh cho TP Quy Nhơn..Có dự án phát triển du lịch nhưng chưa được khởi công xây dựng. Hiện nay trên núi đã xây cất miếu Bà Hoả..Nguyen Thanh Phương, PhD.,",0,0,0,0,0,0
"Ai đến đã đến Quy Nhơn mà k 1 lần đặt chân lên núi Bà Hỏa thì thật đáng tiếc bạn đã bỏ qua 1 nơi chenk in tuyệt vời ở thành phố biển. Từ độ cao 600m so với mực nước biển sẽ là 1 khung cảnh tuyệt vời thơ mộng cho các bạn trẻ muốn tìm một nơi tổ chức giã ngoại mà không cần phải đi ra ngoài thành phố. Tất nhiên với độ cao 600m như thế ta có thể nhìn xuống biển và toàn thành phố quy nhơn và cũng ở địa điểm những đôi ""Quyên Ương"" có thể tìm đến nơi này để chụp cho mình bộ ảnh cưới thật ""xịn sò"" để lưu giữ lại cho cuộc đời thêm phần ý nghĩa!",0,0,0,0,0,0
"Cuối tuần tụi mình thực hiện chuyến picnic qua đêm trên núi Bà Hoả. Quả thực thú vị, có thể ngắm Quy Nhơn về đêm cực thích mắt, khá lặng gió và ỷen tĩnh. Sáng sớm thì có rất nhiều ng leo núi nên tụi mình cũng dậy khá sớm. À còn cái là đêm đoits lửa trại chơi chò chơi và hát hò cầm theo cây ghita nữa thì tuyệt thật sự mn ạ",0,0,0,0,0,0
"Ngọn núi quen thuộc, danh lam thắng cảnh tại Quy Nhơn...",0,0,0,0,0,0
"Từ cầu Đôi rẻ vào khoảng 200m là tới điểm gởi xe, tôi đi lên bằng đường lớn, xuống bằng đường nhỏ, tổng thời gian tầm 2h30p..Tầm nhìn từ trên đỉnh bao quát 360° thành phố Quy Nhơn.",0,0,0,0,0,0
"Tầm nhìn bao quát hết thành phố Quy Nhơn xinh đẹp. Lối lên núi tương đối dễ kiếm nhưng đường lên núi khó chạy xe lên, dốc và đá to nhiều.",0,0,0,0,0,0
"Đường khá khó đi, nếu dám đi đêm thì được ngắm toàn cảnh thành phố rất đẹp, và mát lạnh.",0,0,0,0,0,0
"Đến Kỳ co phần lớn du khách đều sử dụng dịch vụ Ca nô chở vòng ra biển mới lên bãi Kỳ co được vì du khách không biết có 1 con đường bê tông có thể đi lên đỉnh núi để đến với Biển Kỳ Co. Đường đủ rộng để ô tô đi được, khá dốc, khoảng 10%. Trên đỉnh du khách xó thể phóng tâm mắt nhìn về Nhơn Hội, Eo gió... Cảnh thì đẹp tuyệt vời, có thể tìm bãi rộng view biển để cắm trại. Nếu du khách đi xe 2 cầu 4x4 thì có thể đánh xe thẳng xuống bãi cát, cát ở đây mịn và rất xốp(không khuyến khích cho ô tô xuống).",0,0,0,0,0,0
"Chỉ khi bạn đi xe máy và có tay lái thật vững vàng, bạn sẽ dừng lại để ngồi đó và nhìn ra biển, ngẫm là ""sao nó đẹp vậy nè"".Update 06.2019",0,0,0,0,0,0
"Một nơi đẹp, đáng đến xem. Tuy nhiên với chi phí 250k cho 1 người như vậy thì hơi cao.",0,0,0,0,0,0
"Núi Kỳ Co nằm ở thôn Hữu Giang, xã Tây Giang, huyện Nhơn Lý, tỉnh Bình Định. Chắc hẳn nhiều người không biết đến vùng nông thôn xa xôi như vậy. Nhưng nếu đến và tham quan một lần, bạn sẽ được cảm nhận được con người và cảnh vật nơi đây chân thực và gần gũi đến như thế nào...Khung cảnh nhìn từ trên đỉnh núi Kỳ Co.Cung đường cụ thể dành cho các bạn muốn đến núi Kỳ Co: nếu bạn ở các tỉnh khác (thành phố Hồ Chí Minh chẳng hạn) thì bạn có thể đặt vé xe khách Hoa Châu, Ba Đàm,… tại bến xe miền Đông để đến Bình Định. Sau đó hãy tìm cách đến cái nôi của võ thuật Bình Định là huyện Nhơn Lý, nơi có bảo tàng Quang Trung, cũng là quê hương của “Anh hùng áo vải” Nguyễn Huệ. Lúc này, bạn đang cách thôn Hữu Giang khoảng 15 km, đi men theo hữu ngạn sông Kôn là bạn có thể đến đây (vì đoạn đường đến Hữu Giang tương đối gần nên các bạn có thể hỏi người dân địa phương). Sau đó, núi Kỳ Co sẽ hiện lên trước mặt bạn, đợi chinh phục và thư giãn.",0,0,0,0,0,0
"Với vé 25k thì leo núi rất tốt cho sức khỏe. Kèm theo đó là chụp hình đẹp,gió mát và ra về",0,0,0,0,0,0
Tại đây bạn có thể ngắm nhìn toàn cảnh xung quanh. Ak mak có thể nhìn thấy vài đám mây từ biển thổi vào nữa đó,0,0,0,0,0,0
M.n nên chuẩn bị 1 chiếc xe tốt vì đường khá dốc.,0,0,0,0,0,0
