"ฤแป ฤn ฤฦฐแปฃc, phรน hแปฃp ฤn cฦกm gia ฤรฌnh, ฤรฃi khรกch"
"Quรกn cฦกm cรณ vแป trรญ tแปt, phแปฅc vแปฅ tแปt, chแบฅt lฦฐแปฃng tแปt, giรก cแบฃ tแปt."
Phแปฅc vแปฅ nhanh OK nhฦฐng giรก cao so vแปi mแบทt bแบฑng
"ฤn ngon, giรก rแบป, thรขn thiแปn. Khuyแบฟn khรญch ฤแบฟn."
Dia diem ban san pham dac trung binh dinh nay rat thoang. Nhan vien nhiet tinh. Gia ca on dinh
"Giรก hฦกฬฃp lyฬ, saฬฃch seฬ vaฬ phuฬฃc vuฬฃ khaฬch tรดฬt"
Ngon.trai nghiแปm nhiแปu lแบงn vแบซn thรญch.banhay trแบฃi nghiแปm.
Quแบงn cฦกm quรช hฦฐฦกng.kach ฤแบฟn ฤรขy ฤn cลฉng khรก lร ฤรดng ฤแบฃo.
ฤn cลฉng ngon mร nv phแปฅc vแปฅ hฦกi thiแบฟu chuyรชn nghiแปp
Nhieu mon ngon dac biet mon ga xoi mo nhung phai chแป hฦกi lรขu
Cฦกm gร chiรชn mแบฏm vร cฦกm dฦฐฦกng chรขu lร ฤแบทc sแบฃn
Mรณn ฤn Viแปt tฦฐฦกng ฤแปi bรฌnh dรขn. Giรก phแบฃi chฤng.
Giรก quรก cao so vแปi chแบฅt lฦฐแปฃng vร mแบทt bแบฑng chung.
"Mแบฅt vแป xinh , nhรขn viรชn quรก xแบฅu , ฤn mแบทt hแป hang"
"Cฦกm phแบงn giรก hแปฃp lรฝ, khรดng gian hฦกi chแบญt vร แปn."
"Hแป thแปng hรบt mรนi kรฉm, rแบฅt ngแปt ngแบกt vร รกm mรนi thแปฉc ฤn"
"Phแปฅc vแปฅ quรก chแบญm, thรกi ฤแป nhรขn viรชn khรดng tแปt!"
"Lรขu rแปi khรดng quay lแบกi, nhแปฏng cฦกm vแบซn ngon."
1 trรดng nhแปฏng nhร hรng nแปi tiแบฟng แป qui nhฦกn
"BแบพP NHร Xแปจ NแบชUฤรบng lร nแบซu thiแปt, nแบซu cแบฃ ruแปt. Bแปฏa h hay thแบฅy quแบฃng cรกo chแป nรy nรชn hรดm qua kรฉo team lรชn thแปญ, thแบฅy khu cแบฃnh cลฉng ฤแบนp, chill nรy nแป...1. ฤฦฐแปng ฤi: cuแปi ฤฦฐแปng Nam Cao (khu bรดng hแปng) chแบกy thแบณng lรชn dแปc nรบi, mแบฅy bแบกn yแบฟu tay lรกi or non gan dแป ngรฃ do dแปc hฦกi ฤแปฉng.2. Phแปฅc vแปฅ: lรชn tแปi nฦกi hฦกi hoang mang style vรฌ hok thแบฅy ai, ra sau bแบฟp thแบฅy 1 bร cรด, bร cรด kรชu nhรณm ngแปi chแป chรบt, bร xuแปng nรบi kรชu ฤแบงu bแบฟp ฤang ฤรกnh cแป แป quรกn cf bรชn dฦฐแปi ))). Tแปi ฤoแบกn nรy thแบฅy hฦกi sai sai rแปi mร vรฌ sแปm ae chฦฐa ฤรณi nรชn ok ngแปi ฤแปฃi cลฉng dc, rแบฃnh tแปฑ lแบฅy ghแบฟ ly chรฉn luรดn chแป thแบฅy bร cรด tรณc bแบกc gแบงn hแบฟt cลฉng ngแบกi gแปi setup ๐๐. Tแปi ฤoแบกn lรชn mรขm thแปt thiแบฟu bia rรณt chแปฅp hรฌnh (แบฃo lร chรญnh chแป tแปฅi mรฌnh uแปng k bao nhiรชu) chแปง quรกn thแบญt thร mang thรนng Tiger dแปก ra, hแปi cรณ thรนng nguyรชn k thรฌ bแบฃo k cรณ, sau lแบฅy xe mรกy chแบกy xuแปng nรบi mua lรชn thรนng bia cho team :))3. Mรณn ฤn: ngon, khแบฉu vแป mรฌnh hแปฃp quรกn do thรญch ฤn ngแปt, mรณn nรo cรบng cรณ vแป ngแปt ngแปt, chแบฏc ฤแบงu bแบฟp tแบงm sฦฐ trong miแปn Nam 1 thแปi gian. Thรบ vแป lร nhiแปu mรณn ฤแปฑng trong cรกi khay nhรดm, ae hay ฤรนa lร cรกi mรกng.4. Giรก: mแปi thiแบฟu sรณt cแปงa quรกn ban ฤแบงu ฤแปu mau quรชn khi bia vรo, ae chรฉm giรณ. ฤแบฟn khi tรญnh tiแปn thรฌ nรณi thแบญt, giแบญt cแบฃ mรฌnh vรฌ khรดng gian ฤรณ, mรณn ฤn ฤรณ, cรกch phแปฅc vแปฅ ฤรณ...so vs bill thรฌ k tฦฐฦกng xแปฉng. Mรฌnh up vรi mรณn cรณ chแปฅp lรบc cรฒn tแปnh kรจm bill cho mn tham khแบฃo ๐ฅฐ"
Quรกn ฤแบนp - nhฦฐng ฤแบงu bแบฟp ฤi chฦกi kg vแป - uแปng bia chฦกi thรดi -:)
"Quรกn hฦกi khรณ tรฌm lรชn dแปc hฦกi cแปฑc, view tแบงm chiแปu 5h ฤแป ฤi ฤแบนp, nhรขn viรชn nhiแปt tรฌnh dแป thฦฐฦกng, ฤแป ฤn bฦฐng ra nhanh 5-10p lร cรณ, quรกn nแบฅu vแป miแปn nam ฤแบญm ฤร vแปซa miแปng ko bแป ngแปt"
View ฤแบนp thoรกng mรกt rแปng rรฃi cรณ chแป ฤแบญu xe. ฤแป ฤn ngon nhฦฐng giรก cแบฃ chฦฐa hแปฃp lรญ. Lแบฉu cรกc loแบกi thรฌ 350k. Cรฒn chim cรบt 95k mแปt con...quรก chรกt๐ฅต๐ฅต. Quรกn nแบฑm ngoรi thรnh phแป cรฒn phแบฃi leo lรชn nรบi mร Khรดng biแบฟt quรกn phแบฃi ฤรณng tiแปn gรฌ mร ฤแบฉy giรก nรณng mแบทt quรก ae แบก๐ฅต
"Bแบฟp Nhร Xแปฉ Nแบซu lร mแปt cรกi tรชn ฤฦฐแปฃc dแบญy sรณng trong thแปi gian gแบงn ฤรขy. Chรญnh vรฌ cรกi sแปฑ mแปi lแบก cลฉng nhฦฐ phong cรกch vรด cรนng gแบงn gลฉi thรขn thuแปc nhฦฐ chรญnh cฤn bแบฟp trong ngรดi nhร cแปงa mรฌnh nรชn tแบกo ฤฦฐแปฃc sแปฑ thu hรบt, quan tรขm rแบฅt nhiแปu tแปซ cรกc thแปฑc khรกch.Khi vแปซa bฦฐแปc vรo ngรต thฦกm bแบกn sแบฝ phแบฃi ngแบกc nhiรชn vแปi sแปฑ tแป mแป trong viแปc trang trรญ, bรy trรญ bรn ฤn, khรดng gian cลฉng nhฦฐ tแปซng vแบญt dแปฅng trong nhร hรng ฤแปu tแบกo nรชn mแปt vแบป ฤแบนp vรด cรนng thรขn thiแปn, gแบงn gลฉi vแปi chรบng ta.Khรกc vแปi nhแปฏng nhร hรng khรกc, khi ฤแบฟn vแปi Bแบฟp Nhร Xแปฉ Nแบซu bแบกn sแบฝ khรดng chแป nhรฌn thแบฅy sแปฑ sang trแปng trong tแปซng mรณn ฤn, mร cรฒn lร sแปฑ chฤm chรบt ฤแบงy tรขm huyแบฟt cแปงa chแปง quรกn. Vแปi khรดng gian แบฅm cรบng, lรฃng mแบกn mแปt chรบt riรชng tฦฐ rแบฅt lรญ tฦฐแปng ฤแป tรด ฤiแปm thรชm buแปi hแบนn hรฒ cแปงa bแบกn thรชm nhiแปu mรu sแบฏc."
"mแปt ngรy mฦฐa,vรด tรฌnh tรฌm ฤฦฐแปฃc quรกn nรy,rแบฅt thรบ vแป vร แบฅn tฦฐแปฃng.Quรกn nแบฑm trong hแบปm cแปฅt,trรชn ฤแปi.Vรo quรกn mร cแปฉ ngแปก ฤang ngฦฐแปฃc thแปi gian vแป lแบกi nhร cรกch ฤรขy chแปฅc nฤm.Rแบฅt nhiแปu khรดng gian ฤแป chแปn lแปฑa thฦฐแปng thแปฉc mรณn ฤn.Mรฌnh ฤรฃ ฤn Bรฒ nฦฐแปng vแป,lแบฉu riรชu cua bแบฏp bรฒ,rแบฅt ngon,bรฒ mแปm ."
"Quรกn Bแบฟp Nhร  lร nฦกi lรฝ tฦฐแปng checkin cแบฃnh trรญ ฤแบนp nฦกi ฤn cรณ mรng rแปง rแบฅt dแป thฦฐฦกng. Gแบงn khu du lแปch Ghแปnh Rรกng.Mรณn ฤn : lแบฉu riรชu rแบฅt khรกc vแปi nhแปฏng nฦกi khรกc cรณ vแป chua thanh, ฤn rแบฅt dแป chแปu vร ngon.Gแปi nแบฟu thรชm tแบฏc sแบฏc lรกt vรo nแปฏa thรฌ cรng nice.ฤแป chiรชn hฦกi quรก lแปญa. HihiNhรฌn chung ฤแป ฤn tแบกm แปn, cแบฃnh trรญ tuyแปt.Mong sแบฝ trแป lแบกi"
Khรดng gian thoรกng ฤรฃng (ngay chรขn nรบi). Mรณn ฤn cรณ hฦฐฦกng vแป riรชng. Phแปฅc vแปฅ nhiแปt tรฌnh.
"Decor ฤแบนp mang ฤแบญm vฤn hoรก cแปงa nแบซu, nแบฑm trรชn sฦฐแปn nรบi giรณ mรกt. Nhฦฐng theo cรก nhรขn cแปงa mรฌnh cแบฃm nhแบญn: cรกch bแป trรญ vร tรฌm hiแปu vฤn hoรก theo cรกch nแปฏa vแปi. Chฦฐa sรขu sแบฏc vร ฤแบกt ฤแปnh nhฦฐ  mรฌnh mong ฤแปฃi. Cรกch phแปi hแปฃp cรกc vแบญt dแปฅng trong mแปt mรขm cฦกm chฦฐa ฤฦฐแปฃc liรชn kแบฟt chแบทt chแบฝ vแปi nhau. Mรฌnh rแบฅt thรญch chรฉn ฤฤฉa ฤฦฐแปฃc dรนng trong nhร hรng. Rแบฅt ฤแบทc trฦฐng cแปงa vฤn hoรก xแปฉ Nแบซu. Nhแปฏng ฤiแปm trแปซ แป chแป dรนng cรกi nแปi nhรดm rแบป tiแปn ฤแป ฤแปฑng cฦกm. Thay vรฌ vแบญy tแบกi sao khรดng dรนng cรกi bรกt gแปm cรนng loแบกi vแปi chรฉn ฤฤฉa ฤแป ฤแปฑng cฦกm. Nhฦฐ vแบญy sแบฝ ฤแปng nhแบฅt vร ฤฦฐแปฃc ฤiแปm cแปng nhiแปu hฦกn. Mรฌnh thรญch nhแปฏng nhร hรng theo phong cรกch vฤn hoรก nhฦฐ Bแบฟp Nhร Xแปฉ Nแบซu, ฤn ngon lร mแปt phแบงn nhฦฐng Atmosphere cลฉng quan trแปng khรดng kรฉm. Bแบฟp nhร xแปฉ nแบซu lรm mรฌnh nhแป lแบกi mแปt nhร hรng แป Luang Phrabang mร mรฌnh ฤรฃ cรณ dแปp ghรฉ. Vร kinh doanh cแปงa nhร hรng nรy rแบฅt tแปt chแปง yแบฟu lร khรกch Tรขy. Hi vแปng Bแบฟp Nhร Nแบซu sแบฝ thu hรบt nhiแปu khรกch bแบฑng nรฉt ฤแบทc trฦฐng cแปงa mรฌnh. Gรขy dแปฑng vฤn hoรก Nแบซu .Mร lรm sao ฤแป hแบกn chแบฟ muแปi cแบฏn nแปฏa. Nแบฟu khรกch mร chแปu bแป tiแปn theo giรก cแปงa nhร hรng ฤแป ฤn nhแปฏng mรณn dรขn giรฃ chแบฏc chแบฏn hแป cลฉng khรดng chแปu ฤฦฐแปฃc muแปi cแบฏn ฤรขu."
"Quรกn cรณ khรดng gian ok, phแปฅc vแปฅ tแปt, cรณ thแบฃm lรดng chรณ khi ngแปi chรฒi. Mรณn ฤn ngon tuy nhiรชn hฦกi mแบทn!"
"Quรกn dแป thฦฐฦกng, view ฤแบนp, nhรขn viรชn nhiแปt tรฌnh."
"Khung cแบฃnh tฦฐฦกng ฤแปi thรบ vแป nhฦฐng khรณ lรชn vรฌ dแปc qรบa cao.Lรบc chรบng tรดi ฤแบฟn thรฌ mรณn ฤn rแบฅt tแป vร mรจo chรณ chแบกy lanh quanh leo lรชn bรn ghแบฟ cแปงa chรบng tรดi vร xung quanh, khรดng vแป sinh. Nhรขn viรชn phแปฅc vแปฅ tฦฐฦกng ฤแปi.Chแปง quรกn cแบงn quan tรขm ฤแบฟn thแปฑc ฤฦกn ฤแป khรดng lรm mแบฅt แบฅn tฦฐแปฃng tแปt Xแปฉ Nแบซu.  Du khรกch ฤรกnh giรก khรดng hay sแบฝ แบฃnh hฦฐแปng ฤแบฟn nghรnh du lแปch xแปฉ Nแบซu."
"Nhรขn viรชn phแปฅc vแปฅ chu ฤรกo, nhiแปt tรฌnh. Khรดng gian quรกn thoรกng mรกt, buแปi tแปi khรก lร lung linh, thiแบฟt kแบฟ bแบฏt mแบฏt. Thแปฉc ฤn nรณi chung ok, giรก cแบฃ rแบฅt vแปซa phแบฃi"
"Quรกn lแบก แป cรกi tรชn vร khรดng gian nhฦฐng mรณn ฤn khรดng ngon, khรณ tรฌm, quรกn phแปฅc vแปฅ quรก tแป: goฬฃi mรณn ฤn lร 1 con gร, mang ra nแปญa con(1 miแบฟng ฤรนi, 2 cรกi chรขn, 2 cรกi cรกnh, cรฒn lแบกi lร xฦฐฦกng sแปng gร, khรดng cรณ 1 miแบฟng thแปt แปฉc nรo vร ฤฦฐแปฃc trแบฃ lแปi lร ฤo bแบฟp chแบทt thiแบฟu 1 miแบฟng thแปt ฤรนi) tรญnh tiแปn cแบฃ con. Khรดng bao giแป quay lแบกi nฦกi nรy."
"Quรกn decor bแบฏt mแบฏt. Mแปi tแปi hฦกi rรบiฤแป ฤn ngon.Vs nhแปฏng ngฦฐแปi thรญch ฤn cฦกm cho chแบฏc bแปฅng thรฌ ฤแบฟn ฤรขu kรชu cฦกm trรขng vร ฤแป ฤn cรกc loแบกi thรฌ cลฉng same same cฦกm nhร.Lแบฉu vแป hฦกi lแบก, ngai ngรกi , cรณ lแบป lร vแป local nรชn ko chรช nhฦฐng cลฉng ko thรญch."
"ฤแป ฤn ngon, tuy khรดng rแบป nhฦฐng ngon. Vแป trรญ hฦกi khรณ tรฌm."
"Khรดng cรณ bรฃi ฤแป รด tรด, muแปi nhiแปu, mรณn ฤn bรฌnh thฦฐแปng"
"Nแบฅu ฤn vร thแปฑc ฤฦกn quรก giแป vร quรก ฤแบฏt "" mแบฏc"""
"vแป trรญ lแบก, hฦกi khรณ tรฌm, ฤแป ฤn ฤฦฐแปฃc nhฦฐng hฦกi ฤแบฏt!"
Phong cแบฃnh hแปญu tรฌnh nhฦฐng dรนng bแปฏa thรฌ quรก cao.
"Nhร hรng trang trรญ ฤแบนp, ฤแป ฤn buแปn ฤa dแบกng chแบฟ biแบฟn ngon.... phแปฅc vแปฅ nhiแปt tรฌnh vui vแบป.....vแป trรญ trung tรขm thรnh phแป gแบงn biแปn"
"ฤแป ฤn rแบฅt ngon. Chแปง quรกn rแบฅt nhiแปt tรฌnh, nhรขn viรชn tฦฐ vแบฅn tแปt. Hแบฃi sแบฃn cลฉng rแบฅt tฦฐฦกi ngon"
"Ngon, giรก cแบฃ phแบฃi chฤng. Nv phแปฅc vแปฅ tแปt lแบกi cรฒn xinh nแปฏa!"
"Nhรขn viรชn ฤn nhแบญu rแบฅt แปn รo vร lรm phiแปn ngฦฐแปi khรกc ngแปง nghแป ngฦกi, giแป 00h00 la แปn รo, ฤแป nghแป giรกm ฤแปc vแป biแปn xem xรฉt lแบกi nhรฉ"
Quaฬn ko gian kiฬn ฤaฬo sang troฬฃng รขฬm cuฬng. Nhรขn viรชn chu ฤaฬo
"Nhร hรng chแบฅt lฦฐแปฃng tแปt, phแปฅc vแปฅ chuyรชn nghiแปp, sแบกch sแบฝ, ฤแป ฤn ngon, giรก hแปฃp lรฝ!"
"Ngon, tรชn phoฬng ฤแบทt theo caฬc loaฬฃi haฬi saฬn: Tรดm, cua, caฬ, hแบงu... Coฬ Boฬฃ  biรชฬn  luรดn."
"Phรฒng ฤn khรก แปn, sang trแปng, phแปฅc vแปฅ khรก chu ฤรกo tuy nhiรชn ฤแป ฤn ko quรก xuแบฅt sแบฏc."
"Phรน hแปฃp tiแบฟp khรกch. Mรณn แปn, phแปฅc vแปฅ chu ฤรกo, giรก tแปt"
"nhร hรng cรณ nhiแปu mรณn tฦฐฦกi ngon, hแบฃi sแบฃn chแบฅt lฦฐแปฃng"
"khรดng gian แบฅm cรบng, giรก khรก cao, phแปฅc vแปฅ tแปt."
"ฤn combo 1t6 แป quรกn, no nรช ngon tuyแปt vแปi โค๏ธ"
Quรกn ฤn ngon phแปฅc vแปฅ xe chแป khรกch vแป tแบญn nฦกi Free thแบญt lร tuyแปt vแปi .Luรดn แปงng hแป quรกn Hแบฃi cแบฃng๐๐ป๐๐ป๐๐ป
"View sรดng hแป ฤแบนp,Khรดng gian thoรกng mรกt, Phรฒng vip rแปng ฤแบนp, Hแบฃi sแบฃn tฦฐฦกi sแปng ngon giรก cแบฃ hแปฃp lรฝ"
Tuyแปt vแปi cแบฃ gia ฤรฌnh ฤn toรn mรณn tฦฐฦกi sแปng giรก lแบกi rแบป k thแป rแบป hฦกn luรดn แบก ๐๐
"Mรณn ฤn rแบฅt lร ngon, sแปng แบฃo vรด tฦฐ nha bร con"
"Bรกc chแปง rแบฅt nhiแปt tรฌnh, nv cg nhiแปt tรฌnh, tuy nhiรชn xung quanh mแบทt nc nhiแปu rรกc rแบฅt mแบฅt mแปน quan kรจm theo mรนi dแบงu cแปงa cรกc thuyแปn bรจ bรชn cแบกnh rแบฅt รด nhiแปm"
"ฤแป ฤn ngon giรก hแปฃp lรฝ, giรณ biแปn rแบฅt mรกt."
Giรก cแบฃ hแปฃp lรฝ & hแบฃi sแบฃn tฦฐฦกi ngon.phแปฅc vแปฅ tแปt
"Rฦฐแปฃu tรกo mรจo hฦกi cฤng, anh em nhแป mang theo rฦฐแปฃu"
"Cแบฃnh ฤแบนp, nhร hรng vแป trรญ ฤแบนp, thu hรบt du khรกch, ฤแป uแปng giรก hแปฃp lรฝ, hฦกi nรณng."
"Nhร hรng gแบงn biแปn nรชn view ฤแบนp nhฦฐng nhร hรng tiแบฟt kiแปm quรก, trแปi nรณng chang chang nhฦฐng k bแบญt quแบกt trแบงn, cรณ nhร hแป k cรณ quแบกt hฦกi nฦฐแปc hแป nhแป bแบญt cรกi quแบกt trแบงn nhฦฐng nhรขn viรชn vแบซn k bแบญt. ฤแป uแปng ra lรขu, mร cรฒn mang nhแบงm cho khรกch."
"Ngแปi chแป 30p ko cรณ ai ra hแปi, mรฌnh vรo tแบญn quแบงy oder thanh toรกn tiแปn luรดn thรฌ ฤem ra cho mแบฅy ly nhแปฑa nhฦฐ nรy, trong khi ฤรณ tแบฅt cแบฃ cรกc bรn khรกc lแบกi ly thuแปท tinh. 1 trแบฃi nghiแปm quรก tแป แป quรกn"
"Mแปt ฤiแปm ngแปi ngแบฏm cแบฃnh lรฝ tฦฐแปng, giรณ mรกt, view dแบนp"
"Nhร hรng phแปฅc vแปฅ rแบฅt tแป, lรm ฤn rแบฅt chแบญm chแบกp, rแบฅt รญt nhรขn viรชn gแบงn cแบฃ trฤm khรกch mร chแป mแปi hai bแบกn phแปฅc vแปฅ bรn. Nhรขn viรชn khรดng thรขn thiแปn, khรดng hiแปu cรณ cแบงn khรกch hรng hay khรดng nแปฏa? ฤแปa ฤiแปm du lแปch cแบงn phแบฃi cho khรกch thแบฅy sแปฑ hiแบฟu khรกch chแปฉ, ฤรขu chแป cรณ ฤแบฟn uแปng vรi ly nฦฐแปc lร xong! Very bad service!"
View ฤแบนp.Giรก hแปฃp lรฝ.Phรญ giแปฏ xe bแบฅt hแปฃp lรฝ
"Tรชn gแปi Nhร hรng Hoรng Hแบญu vแบซn nhฦฐ cลฉ. View ฤแป ngแบฏm biแปn hoรng hรดn vร trฤng lรชn thรฌ ok. Cรกch bรi trรญ ฤรฃ thay ฤแปi, phong cรกch mang hฦกi hฦฐแปng phแป thรดng, hiแปn ฤแบกi, khรกc so vแปi trฦฐแปc... Mong rแบฑng nฦกi nรy sแบฝ tiแบฟp tแปฅc ฤฦฐแปฃc ฤแบงu tฦฐ, khai thรกc vร phรกt huy ฤฦฐแปฃc lแปฃi thแบฟ cแปงa thiรชn nhiรชn ฦฐu ฤรฃi. Cแบฃnh nฦกi nรy mร hฦฐแปng ฤแบฟn lรฃng mแบกn, ฤแบณng cแบฅp sang trแปng, trang nhรฃ thรฌ tuyแปt!"
Nhร hรng mร cho mแบฅy cรกi ly nhแปฑa chรกn quรก .
"Nhร hรng Hoรng Hแบญu,khung cแบฃnh thoรกng mat,nฦฐแปc uแปng ngon,lhi nรo cรณ dแปp sแบฝ ghรฉ"
Chแป ngแบฏm cแบฃnh thรฌ ok.ฤแป uแปng tฦฐฦกng ฤแปi.phong cรกch phแปฅc vแปฅ chฦฐa chuyรชn nghiแปp.
Gแปi ly nฦฐแปc dแปฉa chแบณng thร nรณi khรดng cรณ mรฌnh gแปi ฤแป uแปng khรกc chแปฉ khi mang ra hแปi nv lร nฦฐแปc gรฌ thรฌ vรด tฦฐ trแบฃ lแปi dแปฉa non a
"Gแปi hลฉ yaourt thรฌ ฤem lรชn 2 ly yaourt, mแบฅy ฤแปฉa nhแป hฦกi khรณ ฤn. Gแปi 3 trรกi dแปซa thรฌ 2 trรกi ngแปt 1 trรกi chua, phแบฃn hแปi thรฌ nhรขn viรชn trรฌnh bรy cรกc kiแปu rแปi phรกn tแบกi anh chแป khรดng dแบทn lแบฅy dแปซa ngแปt. Hai trรกi dแปซa ngแปt lร dแปซa giร cรณ cฦกm dแปซa thรฌ khรดng cรณ muแปng, dแปซa chua lร dแปซa non thรฌ cรณ muแปng mร khรดng biแบฟt ฤแป lรm gรฌ. Nแบฃn! Mรนng 2 tแบฟt mแบฅt vui!"
"ฤn sรกng, ฤn trฦฐa vร cafe แป ฤรขy ฤแปu thแบญt tuyแปt! ฤแป ฤn vร uแปng ngon. Chแป ngแปi rแปng rรฃi thoรกng mรกt, nhรฌn xuแปng bรฃi tแบฏm vร nhรฌn sang thรnh phแป tuyแปt ฤแบนp. Phแปฅc vแปฅ nhanh vร nhiแปt tรฌnh."
"แป ฤรขy uแปng cafe ngแบฏm cแบฃnh thรฌ ok, view biแปn ฤแบนp, thoรกng, khรดng khรญ trong lรnh. Cรฒn ฤn thรฌ nรชn ฤn ngoรi cho rแบป, trong nรy tรด bรบn khoแบฃng 40k mร chแบฅt lฦฐแปฃng thรฌ cลฉng ngฦฐ 20k แป ngoรi. Lฦฐu รฝ nแปฏa lร, dรน nhร hรng nแบฑm trong khu du lแปch (cรณ bรฃi tแบฏm hoรng hรขu hay cรฒn gแปi lร bรฃi trแปฉng, khu mแป nhร thฦก Hรn Mแบทc Tแปญ) nhฦฐng ฤi vรo khรดng mแบฅt tiแปn vรฉ nha."
"Chแบฅt lฦฐแปฃng phแปฅc vแปฅ kรฉm order xong ฤem ฤแป ฤn ra lแบกi thiแบฟu, kรชu nฦฐแปc cลฉng thiแบฟu, khi kรชu mรณn Bรบn Chแบฃ Cรก Qui Nhฦกn ฤem ra nฦฐแปc lรจo toรn lร mรนi thแปt bรฒ, khรดng cรณ mรนi gรฌ lร cรกThแบญt quรก tแป"
"Nhร hรng ฤn ngon, mรกt mแบป, ฤแบนp. Mแปt trong nhแปฏng nhร hรng tiแบฟp khรกch tแปt vร khรกch tour vฤn phรฒng tแปt tแบกi Quy Nhฦกn. Giรก mแบฏc hฦกn so vแปi mแบทt bแบฑng."
"Giรก trong menu ฤรฃ ghi sฤn mร khi thanb toรกn lแบกi phแบฃ trแบฃ thรชm tiรจn chแบฟ biแบฟn vร trc ฤรณ nhรขn viรชn k hแป thรดng bรกo trc, ฤรณ k phแบฃi phong cรกch phแปฅc vแปฅ cแปงa ""nhร hรng"", ฤแป ฤn ra rแบฅt lรขu vร ฤn cลฉng bรฌnh thฦฐแปng"
"Dรน quรกn chฦฐa ฤรดng khรกch nhฦฐng vแบซn khรดng ฤแปง nhรขn viรชn phแปฅc vแปฅ, dแบซn ฤแบฟn rแบฅt nhiแปu trแบฃi nghiแปm tแป liรชn tiแบฟp xแบฃy ra: Mang nhแบงm ฤแป ฤn ฤแป uแปng, thiแบฟu dแปฅng cแปฅ ฤn uแปng, thiแบฟu gia vแป, chแป ฤแป ฤn mแบฅt ฤแบฟn 1h ฤแปng hแป."
"ฤแป ฤn ngon bแป rแบป, nhร hรng ฤแบนp lแปch sแปฑ, nhรขn viรชn nhiแปt tรฌnh"
gรณc hแบปm nรชn chแป ngoรi thoแบฃi mรกi. Giรก rแบป 10k/ly.
