"Quรกn ฤn ngon, 1 ฤแปa chแป cแปงa nhแปฏng ngฦฐแปi thรญch ฤn vแปซa ฤแบนp mแบฏt vแปซa ngon miแปng. Cรณ thรชm 2 phรฒng mรกy lแบกnh ฤแป phแปฅc vแปฅ khรกch ฤoรn ฤรดng ngฦฐแปi. Phong cรกch cแป ฤiแปn, thแปi bao cแบฅp nรชn nhiแปu khรกch hรng lแปn tuแปi tแปi ฤแป รดn lแบกi kแปท niแปm xฦฐa. Decor nhiแปu gรณc cแบกnh trรดng rแบฅt nแปi bแบญt vแปi nhแปฏng ฤแป ฤn dรกn ngฦฐแปฃc lรชn tฦฐแปng. Nฦกi chแปฅp แบฃo cho cรกc chรกu thรญch sแปng แบฃo แบฃnh x ฤแปi thแบญt.."
"Khรดng gian rแปng rรฃi, ฤแบนp, mรณn ฤn kiแปu Bแบฏc vแปซa miแปng, nhรขn viรชn phแปฅc vแปฅ แปn, giรก hแปฃp lรฝ. khoแบฃng 300k/2 ngฦฐแปi"
"ฤรดฬ ฤn ฦกฬ ฤรขy thรขฬฃt sฦฐฬฃ ฤn rรขฬt vฦฐฬa ko quaฬ mฤฬฃn, ngon, giaฬ cuฬng vฦฐฬa phaฬi, phuฬฃc vuฬฃ nhanh. Coฬ chuฬt k haฬi loฬng ฦกฬ caฬi laฬ ฤรดฬ ฤn 1 ฤiฬa hฦกi iฬt 4 ngฦฐฦกฬi ฤn gฤฬp chuฬt laฬ hรชฬt rรดฬi. Ahh coฬn caฬi baฬn gรดฬ biฬฃ bong sฦกn ฤฤฬฃt tay lรชn rรขฬt diฬnh khaฬ khoฬ chiฬฃu mong quaฬn sฦฐฬa sฦกฬm."
Quรกn vแป trรญ ฤแบนp ฤแป ฤn ngon nhแบฅt lร Hแบฃi sแบฃn. Nhร hรng sแบกch sแบฝ ฤรดng khรกch
Quรกn ฤn vแปi nhiแปu mรณn truyแปn thแปng ngon miแปng vร giรก hแปฃp lรฝ. Nhฦฐng bรชn trong quรกn phรฒng kรญn vร cรณ mรนi hรดi
"ฤแป ฤn lรm rแบฅt ngon, phแปฅc vแปฅ nhanh, giรก lแบกi rแบป. Sแบฝ quay lแบกi"
Mรณn ฤn rแบฅt ngon. ฤแบทck biแปt xuแบฅt sแบฏc! Tuy nhuรชn Quรกn dแปn mแบฏm rau ra sแบตn trรชn cรกc bรn nรชn bแป hรณng vร ruแปi rแบฅt nhiแปu. Vแปซa bฦฐแปc vรo quรกn hay thแบญm chรญ ngแปi ฤn nghe mรนi nฦฐแปc mแบฏm nแปng nแบทc. Hรดi
"Cฦกm rแบฅt ngon,  hแปฃp khแบฉu vแป. Khรดng gian แบฅm cรบng, ฤแบนp. Gia ฤรฌnh ฤi du lแปch nรชn vรo ฤรขy ฤn แบก. Cรกc mรณn ฤa dแบกng dแป lแปฑa chแปn, giรก ghi rแบฅt rรต rรng vร hแปฃp lรฝ. Nhรขn viรชn ra ฤรณn khรกch niแปm nแป, chu ฤรกo.ฤฦฐแปng ฤi rแบฅt dแป tรฌm nแบฟu bแบกn nรo แป quanh quแบฃng trฦฐแปng. Tuyแปt vแปi!"
"Quรกn cฦกm Nhร 1989 tuyแปt vแปi, mรณn ฤn mแบทn mร, thแบฅm thรญa, trang tri bรชn ngoรi khรดng แบฅn tฦฐแปฃng nhฦฐng khi vรo bรชn trong thรฌ แบฅm รกp, dแป thฦฐฦกng, mรณn rau muแปng xรo tแปi , lแบฅy nฦฐแปc lรm canh, canh khแป qua nแบฅu tรดm, cรก chiรชn, ฤแบทc biแปt thแปt heo nแบฅu kho ruแปc."
"Khรดng ฤแบทt trฦฐแปc nhร hรng bแบฃo khรดng cรณ mรณn, phแปฅc vแปฅ yแบฟu kรฉm"
"Nแบฅu ฤn ngon, giรก hแปฃp lรฝ, nhรขn viรชn lแปch sแปฑ lแป phรฉp. Quรกn khรก ฤรดng. Nรณi chung nรชn ghรฉ ฤรขy khi du lแปch. Chรขn bรn lร chรขn mรกy may cลฉ, vรi mรณn ฤแป cลฉ nhฦฐ lon ghi gรด... nhรฌn cลฉng ok."
"ฤฦฐแปฃc mแปi cรกi khรดng gian rแปng rรฃi, ฤแป ฤn tแบกm ฤฦฐแปฃc. Mรกt mแบป"
"ฤแป ฤn rแบฅt ngon, giรก rแบป so vแปi chแบฅt lฦฐแปฃng (thแปฉc ฤn, mแบทt bแบฑng, decor,...), nhรขn viรชn nhiแปt tรฌnh nhanh nhแบนn. Nแบฟu ฤi du lแปch Quy Nhฦกn dรi ngรy mร thรจm cฦกm nhร mแบน nแบฅu thรฌ แป ฤรขy rแบฅt lรฝ tฦฐแปng."
"Nhร hรng cรณ khรดng gian ฤแบนp, rแปng rรฃi, sแบกch sแบฝ. ฤแป ฤn ngon, ฤแบทc biแปt nhแปฏng mรณn dรขn dรฃ vแปi chi phรญ khรก hแปฃp lรฝ vร ฤแป ฤn lรชn rแบฅt nhanh. Review mแปt bรn ฤn cho 5 ngฦฐแปi, 5 mรณn chรญnh vแปi giรก chแป hฦกn 400k."
"แป Tp Qui Nhฦกn ฤรขy lร ฤแปa ฤiแปm tแปt nhแบฅt ฤแป ฤn uแปng nhแบฅt lร ฤoรn ฤรดng ngฦฐแปi , ฤoรn mรฌnh 9 ngฦฐแปi ฤn hแบฟt cรณ 1tr1 ฤn nhรฒe khรดng hแบฟt. ฤแป ฤn แป ฤรขy cรกc mรณn hแบงu hแบฟt dฦฐแปi 100k, 78-89k/ tรด, ฤฤฉa. ฤn cแปฑc ngon, cแปญa hรng phong cรกch cแป ฤiแปn ฤแบนp"
"Khรก thแบฅt vแปng vแป trแบฃi nghiแปm tแบกi quรกn cฦกm 1989- ฤแป ฤn: แปn, nhฦฐng khรดng quรก ngon- Thรกi ฤแป nhรขn viรชn: hแปi hแปฃt, khรดng nhiแปt tรฌnh- Giรก: ฤแบฏt, cฦกm 20k/ tรด chแปฉ khรดng miแปn phรญ nhฦฐ nhแปฏng nhร hรng khรกc.- Mแปt sแป ฤiแปm cแบงn lฦฐu รฝ nแบฟu bแบกn muแปn thแปญ ฤn แป ฤรขy:*Quรกn tแปฑ mang lรชn hai tรด trong khi gia ฤรฌnh mรฌnh khรดng hแป gแปi. Tรด cฦกm to nรชn ฤn dฦฐ rแบฅt nhiแปu. Gรณp รฝ: Nhรขn viรชn nรชn tฦฐ vแบฅn cho khรกch vร hแปi trฦฐแปc khi lรชn cฦกm.*Nรชn kiแปm tra lแบกi hoรก ฤฦกn. Trong trฦฐแปng hแปฃp cแปงa mรฌnh nhร hรng ฤรฃ tรญnh sai tiแปn dรน nhร hรng ฤรฃ xuแบฅt lแบกi hรณa ฤฦกn nhฦฐng mรฌnh khรดng hแป nhแบญn ฤฦฐแปฃc lแปi xin lแปi nรo tแปซ nhรขn viรชn."
"Quรกn cฦกm nแบฑm แป trung tรขm TP Quy Nhฦกn theo phong cรกch nhแปฏng nฤm cลฉ vแปi bรn ฤn ฤฦฐแปฃc chแบฟ lแบกi tแปซ nhแปฏng chiแบฟc mรกy may cลฉ. Khรดng gian quรกn rแปng rรฃi, sแบกch ฤแบนp, decor แบฅn tฦฐแปฃng. Nhรขn viรชn phแปฅc vแปฅ nhiแปt tรฌnh, hoร nhรฃ. Cรกc mรณn ฤn ฤแปu lร nhแปฏng mรณn Viแปt quen thuแปc nhฦฐ: Canh cua, cร muแปi, rau lang luแปc chแบฅm mแบฏm cua... ฤแป ฤn mรฌnh ฤรกnh giรก trรฒn vแป, khรก ngon. Giรก cแบฃ แป mแปฉc trung bรฌnh vแปi cรกc mรณn rau dao ฤแปng tแปซ 39k ฤแบฟn 69k, cรกc mรณn mแบทn tแปซ 89k, mรณn canh tแปซ 59k trแป lรชn. Bแปฏa ฤn nhฦฐ trong hรฌnh mรฌnh gแปi hแบฟt 224k. Hai ngฦฐแปi vแปi sแปฉc ฤn vแปซa phแบฃi cรณ thแป ฤn no."
"Cฦกm khรก ngon, giรก cแบฃ hแปฃp lรฝ rแบฅt phรน hแปฃp cho nhรณm bแบกn hแปp mแบทt hay gia ฤรฌnh gแบทp mแบทt"
"Mรณn ฤn ngon ,ฤa dแบกng ,hแปฃp khแบฉu vแป, giรก cแบฃ thรฌ ko biแบฟt nhฦฐ thแบฟ nรo, vรฌ mรฌnh ฤi tour."
Quรกn rแปng rรฃi mรณn ฤn ngon lแบกi cรณ cแบฃ chแป chฦกi cho cรกc bรฉ rแบฅt phรน hแปฃp vแปi cรกc gia ฤรฌnh cรณ em bรฉ
"ฤแป ฤn ngon, khรดng gian rแปng rรฃi, sแบกch sแบฝ, mรกt mแบป, nhรขn viรชn phแปฅc vแปฅ tแปt"
Khรดng gian quรกn ฤn rแปng rรฃi thoแบฃi mรกi phแปฅc vแปฅ nhanh chรณng mรณn ฤn nรณng sแปt hแปฃp khแบฉu vแป
"ฤแป ฤn ngon, nguyรชn liแปu nแบฅu tฦฐฦกi. Khรดng gian cลฉng rแบฅt okie.Nhรขn viรชn phแปฅc vแปฅ nhanh"
"Cรกc mรณn ฤn thรขn quen ฤฦฐแปฃc chแบฟ biแบฟn ngon miแปng, nhร hรng sแบกch sแบฝ giรก hแปฃp lรฝ"
"Rแปng rรฃi thoรกng mรกt, nhรขn viรชn rแบฅt ok, thแปฑc ฤฦกn phong phรบ, mรณn ฤn ngon , giรก cแบฃ hแปฃp lรฝ."
"Quรกn bรi trรญ ฤแบทc sแบฏc kiแปu xฦฐa, cรณ ฤiแปu hoร mรกy mแบป. Ngay trung tรขm thuแบญn tiแปn ฤi lแบกi. Mรณn ฤn khรก ngon, ฤแบทc biแปt lร cรก mรณn vแป cรก. Hiแปn tแบกi quรกn rแบฅt ฤรดng vร แปn รo vรo giแป cao ฤiแปm, phแบฃi chแป khรก lรขu nแบฟu khรดng ฤแบทt trฦฐแปc. Mรฌnh ฤรฃ phแบฃi huแปท 1 mรณn vรฌ khรดng chแป lรขu hฦกn ฤฦฐแปฃc."
"Thแปฉc ฤn ngonKhรดng gian trang nhรฃ,  แบฅm cรบng kiแปu gia ฤรฌnhGiรก cแบฃ phแบฃi chฤng๐๐Sแบฝ quay trแป lแบกi"
"ฤแบงy ฤแปง cรกc mรณn ฤn viแปt nam, tuy nhiรชn ko nhiแปu ฤแบทc sแบฃn bรฌnh ฤแปnh, ฤn nhฦฐ cฦกm แป nhร"
"Nแบฅu ฤn ngon, giรก hแปฃp lรฝ, nhรขn viรชn lแปch sแปฑ lแป phรฉp. Quรกn khรก ฤรดng. Nรณi chung nรชn ghรฉ ฤรขy khi du lแปch. Chรขn bรn lร chรขn mรกy may cลฉ, vรi mรณn ฤแป cลฉ nhฦฐ lon ghi gรด... nhรฌn cลฉng ok."
"Thแปฉc ฤn vแปซa miแปng,giรก cแบฃ phแบฃi chฤng.ฤแบฟn Quy Nhฦกn nรชn thแปญ !โบ๏ธ"
"Quรกn ฤn ngon sแบกch sแบฝ, nhร vแป sinh chฦฐa tรกch biแปt nรชn hฦกi bแบฉn"
"Cฦกm nแบฅu vแปซa vแป, ฤแป ฤn tฦฐฦกi, giรก trung bรฌnh khรก vร phแปฅc vแปฅ hฦกi chแบญm."
"ฤแป แบตn ngon, giรก cแบฃ chแบฅp nhแบญn ฤฦฐแปฃc, phแปฅc vแปฅ tแปt, ฤแบทc biแปt trang trรญ rแบฅt แบฅn tฦฐแปฃng vแปi lon guigoz vร chรฉn ฤแบฅt."
Cฦกm ngon! Quรกn ฤn แบฅm cรบng!Rแบฅt thรญch hแปฃp cho gia ฤรฌnh hoac nhom ban ฤi du lแปch!
"Minh thแบญt sแปฑ thแบฅt vแปng khi ฤแบฟn nhร hรng, mรฌnh gแปi tแปng 5 mรณn, trong ฤรณ mรณn sฦฐแปn non xรo chua ngแปn lรm ko ฤแบกt vแป khรดng ngแบฅm ฤฦฐแปฃc vรo sฦฐแปn, mรณn cรก lรณc kho tแป thรฌ sฦก chแบฟ cรก khรดng sแบกch nรชn kho rแปi vแบซn cรฒn vแป tanh vร vแป bรนn, rau lang thรฌ bแป giร ฤn phแบฃi nhแบฃ sฦก, canh tรดm rong biแปn thรฌ tแบกm ฤฦฐแปฃc, cรฒn mรณn ba chแป rang vร nฦฐแปc รฉp แปi thi ok. Giรก cแบฃ thรฌ rแบป. ฤแปa ฤiแปm nรy mรฌnh sแบฝ khรดng quay lแบกi."
"Quรกn rแปng rรฃi mรกt mแบป, ฤรดng khรกch, ฤแป ฤn OK"
"Quรกn ngon, thแปฉc ฤn vแปซa miแปng quan trแปng giรก rแบฅt bรฌnh dรขn. ฤแบฟn quy nhฦกn chแบฏc chแบฏn sแบฝ quay lแบกi"
ฤn ฤc. Giรก trung bรฌnh khรก. ฤi chฦกi cรณ kinh phรญ thรฌ vรด ฤn.
Nhร hรng trong khu du lแปch mร phแปฅc vแปฅ 21h nghแป thรฌ chแปu
"Hoรi cแป, ฤแบญm chแบฅt xฦฐa. Cฦกm nhร 1989 lรm rแบฅt ngon, nhanh vร bรy trรญ ฤแบนp mแบฏt. Cรกc mรณn nแบฅu rแบฅt hแปฃp khแบฉu vแป, cho dรน khรกch ฤแบฟn tแปซ ฤรขu. Mแปi thแปฉ แป ฤรขy ฤแปu cho ngฦฐแปi ฤn cแบฃm giรกc xฦฐa, nhแปฏng nฤm cรฒn thiแบฟu thแปn, nhแบน nhรng nhฦฐng rแบฅt tinh tแบฟ"
"Mรณn ฤn cฦกm ngon, nhฦฐng mร nhรขn viรชn รญt zui qรก"
"ฤแบฟn Quy Nhฦกn ฤn Hแบฃi sแบฃn nhiแปu cลฉng chรกn, tรฌm ฤฦฐแปฃc thรดng tin vแป Cฦกm Nhร 1989 nรชn ฤแบฟn ฤn, thแปฉc ฤn khรก ngon vร hแปฃp khแบฉu vแป cแปงa ngฦฐแปi miแปn Bแบฏc tแปฅi mรฌnh. Giรก lแบกi rแบฅt rแบฅt hแปฃp lรฝ nแบฟu khรดng muแปn nรณi lร rแบป. 6 ngฦฐแปi ฤn no mร vแบซn cรฒn thแปซa chรบt thแปฉc ฤn. Bแบกn nรo mร tแปซ miแปn Bแบฏc ฤi du lแปch vรo chรกn Hแบฃi sแบฃn thรฌ nรชn tแปi ฤรขy nhรฉ."
"Khรดng gian แบฅn tฦฐแปฃng, thแปฉc ฤn ngon vร bรฌnh dรขn, phแปฅc vแปฅ tแปt!๐๐๐"
"ฤแบฟn Qui Nhฦกn nแบฟu ฤรฃ ฤn chรกn hแบฃi sแบฃn vร cแบงn mแปt bแปฏa cฦกm ngon thรฌ ฤรขy lร mแปt ฤiแปm ฤแบฟn cแบงn phแบฃi ฤแบฟn. ฤแป ฤn ngon ,giรก cแบฃ hแปฃp lรฝ vร khรดng gian rแบฅt ฤแบนp."
"View ฤแบนp, thแปฉc ฤn ngon, ฤรฃ dแบกng, phแปฅc vแปฅ nhanh"
"Nแบฅu ฤn ngon vแปซa miแปng, riรชng mรณn canh chua thรฌ nรชn lรm chua hฦกn 1 chรบt sแบฝ ngon hฦกn. Quรกn nhรฌn lแปch sแปฑ, phแปฅc vแปฅ ok. Lรชn mรณn nhanh"
"Quรกn ฤn lแปch sแปฑ, khรดng gian แบฅm cรบng mang phong cรกch ngฦฐแปi Viแปt xฦฐa. Giรก cแบฃ bรฌnh dรขn hแปฃp lรฝ. Ai tแปi Quy Nhฦกn nรชn ฤแบฟn thฦฐแปng thแปฉc"
"Thแปฉc ฤn khแบฉu vแป rแบฅt ngon, giรก thแบญt mแปm. Quรกn rแปng rแบฃi vร thoรกng."
"ฤรขy lร mแปt trong nhแปฏng ฤแปa ฤiแปm ฤn uแปng nรชn ฤแบฟn khi ฤแบฟn Quy Nhฦกn, แป ฤรขy vแปi khung cแบฃnh hoรi cแป tแบกo cแบฃm giรกc แบฅm รกp, cรกc vแบญt dแปฅng ฤแปu lแบฅy cแบฃm hแปฉng hoรi cแป vร nhฦฐ nhแปฏng nฤm 90 cแปงa thแบฟ kแปท trฦฐแปc cho ta cแบฃm giรกc quay lแบกi chแปn quรช xฦฐa, cรกc mรณn ฤn phong phรบ, giรก cแบฃ phรน hแปฃp, ngon"
"ฤแป ฤn cลฉng tแบกm nhฦฐng quรกn bรกn khรกch tour, luรดn rแบฅt ฤรดng khรกch"
"Ngon , trang trรญ kiแปu thแปi bao cแบฅp tแปซ chiแบฟc ฤลฉa ฤแบฟn cรกi bรกt."
"Lรm mรณn ฤn nhanh , nhรขn viรชn nhiแปt tรฌnhโฆ sแบฝ quay lแบกi"
"Cฦกm ngon, nhรขn viรชn thรขn thiแปn khรดng gian ฤแบนp"
"Quรกn rแบฅt ฤแบนp, nแบฅu rแบฅt ngon, lรขu lแบฏm mรฌnh mแปi thแบฅy cรณ 1 quรกn cฦกm ngon nhฦฐ thแบฟ, khรกch rแบฅt ฤรดng nรชn nแบฟu khรดng ฤแบทt trฦฐแปc phรฒng thรฌ khรณ mร cรณ bรn"
"Nhร hรng sang trแปng, mรณn ฤn ngon. Giรก bรฌnh dรขn"
Cรกc mรณn ฤn tแบกm ฤฦฐแปฃc. ฤแปi vแปi mรฌnh chฦฐa cรณ nรฉt ฤแบทc sแบฏc cแปงa vรนng miแปn
Bแปฏa cฦกm ฤแบญm vแป nhร thแบญt . Nhiแปu mรณn thฦฐฦกng ngรy nhฦฐng ngon vร ฤฦฐแปฃc phแปฅc vแปฅ tแบกi nhร hรng. Cรณ trร thแบฃo mแปc  thฦกm ngon.
Ngon mร rแบป cรกc bแบกn nรชn ฤแบฟn ฤiแปm nรy phแปฅc vแปฅ rแบฅt ok
ฤแป ฤn ngon nhฦฐng ฤiแปu hรฒa yแบฟu vร quรกn แปn รo
"Nแบฑm giแปฏa trung tรขm thรnh phแป Quy Nhฦกn, Cฦกm Nhร 1989 cรณ vแบป ngoรi khรดng cรณ gรฌ khรกc biแปt so vแปi nhแปฏng ngรดi nhร xung quanh, nhฦฐng khi bฦฐแปc vรo bรชn trong lร mแปt khung cแบฃnh thรขn quen mang ฤแบญm nรฉt xฦฐa cแปงa gia ฤรฌnh Viแปt. Tแปซ bแป bรn ghแบฟ gแป nhuแปm mรu thแปi gian, ฤแบฟn nhแปฏng แปng ฤลฉa, nhแปฏng chiแบฟc dฤฉa, chรฉn ฤแบฅt ngรy xฦฐa ฤฦฐแปฃc Nhร sแปญ dแปฅng ฤแป phแปฅc vแปฅ khรกch hay nhแปฏng chiแบฟc lแปng bรn, chai thuแปท tinh mang ฤแบทc trฦฐng xฦฐa cลฉ... tแบฅt cแบฃ nhฦฐ ฤang tรกi hiแปn lแบกi mแปt khung cแบฃnh khรดng gian xฦฐa cลฉ giแบฃn dแป, mแปc mแบกc nhฦฐng rแบฅt tแปฑ nhiรชn, แบฅm cรบng."
"Phแปฅc vแปฅ chแบญm chแบกp, ko ฤรกp แปฉng dc yรชu cแบงu cแปงa ฤoรn!"
"Cฦกm rแบฅt ngon, mรณn ฤn ฤa dแบกng vร thuแบงn tuรฝ Viแปt. Phแปฅc vแปฅ chu ฤรกo, khรดng gian แบฅm cรบng, trang trรญ kiแปu lรng quรช Viแปt, giรก hแปฃp lรฝ."
Thฦฐฬc ฤn ngon nhรขn viรชn phuฬฃc vuฬฃ tรขฬฃn tiฬnh chu ฤaฬo
"Quรกn trang trรญ bรi bแบฃn, cรดng phu, cรณ phong cรกch riรชng"
"Khรดng gian rแปng, ฤแบนp. ฤรบng kiแปu cฦกm nhร lรm, giรก cแบฃ phแบฃi chฤng ."
Cฦกm ngon!Cรกc mรณn ฤแบญm vแป cay hฦกn ฤแปi vแปi ngฦฐแปi Bแบฏc!
Khรดng hแป trแปฃ khรกch ฤoรn. Xuแบฅt hรณa ฤฦกn mร cลฉng khรดng support cho khรกch hรng. Kรฉm
"Quรกn mแปi, sแบกch ฤแบนp. Bแป trรญ khรก bแบฏt mแบฏt. Cฦกm ฤฦฐแปฃc, giรก cแบฃ hแปฃp lรญ."
"Khรดng gian sang trแปng, lแปch sแปฑ, mรณn ฤn nแบฅu tฦฐฦกng ฤแปi ngon, giรก rแบป so vแปi dแปch vแปฅ"
"Quรกn khรก ฤแบนp, giรก rแบป nhฦฐng ฤแป ฤn hฦกi mแบทn"
"Khaฬ thuฬ viฬฃ.  Caฬch baฬi triฬ nhฦฐ 1 ngรดi nhaฬ Viรชฬฃt nฤm 80.  Moฬn ฤn thuรขฬn viรชฬฃt , nhรขn viรชn phuฬฃc vuฬฃ nhanh."
"Nhรขn viรชn dแป thฦฐฦกng, tฦฐ vแบฅn nhiแปt tรฌnh, thแปง tแปฅc nhanh gแปn ๐"
"Quรกn ฤแบนp, cฦกm bรฌnh thฦฐแปng, phแปฅc vแปฅ rแบฅt tแป"
"Cรกch phแปฅ vแปฅ khรดng dc tแปt , cแบฃi vแปi khรกch hรng"
"Nghe tiแบฟng nรชn ghรฉ ฤn thแปญ, dc nhร hรng cho leo cรขy luรดn.Vรo bรn ngแปi 5p ko thแบฅy nhรขn viรชn order, phแบฃi gแปi 1 nhรขn viรชn hแปi thแปญ xem order tแบกi quแบงy hay tแบกi bรn thรฌ bแบฃo lร order tแบกi bรn -> quแบฟ tแบญp 1Gแปi mรณn xong ฤแปฃi nแปญa tiแบฟng ko thแบฅy mang lรชn, hแปi tiแบฟp thรฌ bแบฃo hแบฟt mรณn. Nghฤฉ chแปฉ, nแบฟu mร ko hแปi chแบฏc cho nhแปn luรดnTแป hแบฟt sแปฉc tแป"
"Rแบฅt ngon vร sแบกch sแบฝ, mรฌnh ngฦฐแปi Bแบฏc nรชn cรณ lแบฝ khรดng hแปฃp ฤn vแป cay nhiแปu tแปซ canh ฤแบฟn ฤแป ฤn mแบทn. Nhรขn viรชn nhiแปt tรฌnh chu ฤรกo."
ฤแป ฤn ngon . Phแปฅc vแปฅ okies . Khรดng gian rแปng rรฃi ..
"ฤแป ฤn ngon, giรก cแบฃ hแปฃp lรฝ mแปi tแปi quรกn ฤรดng nรชn phแปฅc vแปฅ chฦฐa tแปt lแบฏm"
"Quรกn cฦกm tรm tแบกm, phแปฅc vแปฅ ko dc chu ฤรกo, lรขu, quรชn mรณn, nรณi chung kem. Thแปฑc ฤฦกn tuy nhiแปn mรณn nhฦฐng nรชm nแบฟm gia vแป ko dc ngon miแบฟng. ฤn tแบกm dc. Quan ฤiแปm cแปงa mรฌnh chแป trung bรฌnh. Cแบฃm ฦกn !"
"ฤแป ฤn ngon. Nhร hรng ฤแบนp, sแบกch sแบฝ. Khu vแป sinh"
"Cฦกm ngon, thoแบฃ mรฃn khแบฉu vแป cแบฃ ฤแบกi gia ฤรฌnh mรฌnh tแปซ bรฉ 7 tuแปi ฤแบฟn cแปฅ 70 tuแปi. Highly recommend."
ฤแป ฤn ngon. Nhรขn viรชn nhiแปt tรฌnh. Phแปฅc vแปฅ tแปt. Cรณ cแบฃ miแบฟng che nแบฏng cho xe oto ฤแบญu ngoรi trแปi nแปฏa. Giรก cแบฃ quรก ok
"5 April 2018. Quรกn lแปch sแปฑ, sang trแปng, trang trรญ cรณ phong cรกch riรชng biแปt, vรญ dแปฅ nhฦฐ dรนng mแบทt bรn mรกy may cแป lรm bรn ฤn, trรชn bรn cรณ ฤแป lแปng bรn kiแปu xฦฐa, chai nฦฐแปc ฤun sรดi ฤแป nguแปi.Nhรขn viรชn phแปฅc vแปฅ chu ฤรกo, nhiแปt tรฌnh.Cรกc mรณn ฤn tฦฐฦกng ฤแปi แปn, mรณn cรก chim chiรชn dรฒn cรนng vแปi xoรi cแบฏt sแปฃi ngon.แป vรนng nรy ngฦฐแปi ta gแปi cรกi muแปng ฤn cฦกm nhแป lร cรกi xรฌa."
"Nhร hรng nแบฅu ฤn ngon, nhรขn viรชn phแปฅc vแปฅ rแบฅt nhiแปt tรฌnh vร nhanh lแบน. Mรณn canh chua cรก thu sแปt cร, mแปฅc nฦฐแปng rแบฅt ngon."
"Cฦกm ngon, khรดng gian tแปt, phแปฅc vแปฅ rแบฅt nhiแปt tรฌnh chu ฤรกo.Rแบฅt ฤรกng ฤแป tแปi ฤn cฦกm nhฦฐ cฦกm nhร"
ฤแป ฤn rแบฅt ngon mร giรก thรฌ rแบฅt แปn. Vแป hฦกi ฤแบญm so vแปi khแบฉu vแป cรก nhรขn vรฌ cรณ thรชฬ ฤรขy lร miแปn biแปn nรชn ngฦฐฦกฬi dรขn แป ฤรขy ฤn mแบทn hฦกn vรนng khรกc. Mรณn ฤแบทc sแบฏc nhแบฅt lร chแบฃ ram tรดm ฤแบฅt.
"ฤแป ฤn ngon vร giรก cแบฃ hแปฃp lรฝ. ฤiแปm trแปซ: Quรกn hฦกi nรณng, hแบฟt mแปt sแป ฤแป ฤn lรบc 8 rฦฐแปกi tแปi vร nhรขn viรชn phแปฅc vแปฅ hฦกi khรดng thรขn thiแปn."
