"Nhร hรng ven sรดng, bแป trรญ nhรฌn chuyรชn nghiแปp, phแปฅc vแปฅ cลฉng tแบกm ฤฦฐแปฃc. Thแบญt ra khรดng thแป yรชu cแบงu giแปng nhฦฐ trong SG ฤฦฐแปฃc.Nhฦฐng do vแป trรญ ven sรดng, cรณ mรนi nฦฐแปc  sรดng thum thแปงm do Thแปงy triแปu xuแปng, muแปn ngแปi ven sรดng cho mรกt cลฉng khรณ."
"Rแปng rรฃi, nhiแปu chแป ฤแบญu xe, ฤแป ฤn ngon, nรชn chแปn view bแป sรดng"
Nhร hรng nรy theo mรฌnh thรฌ...- ฤแบนp- mรกt- thoรกng- sแบกch- rแบป- ngon... NHแบคT แป QUY NHฦN
Ngon giรก cแบฃ hแปฃp lรฝ nhiแปu mรณn ngon.Phแปฅc vแปฅ nhanh chu ฤรกo Niแปm nแป
"Nhร hรng ฤแบนp, lแปng giรณ, mรกt mแบป vร ฤn thรฌ tuyแปt vแปi.:)"
"Nhร hรng ฤฦฐแปฃc ฤแบงu tฦฐ xรขy dแปฑng lแบกi. View ฤแบนp, ngay cแบงu HรThanh. Cรกc mรณn ฤn ok. Phแปฅc vแปฅ nhanh nhแบนn, thรขn thiแปn."
"ฤแป ฤn cลฉng khรก ngon , thรกi ฤแป phแปฅc vแปฅ nhรขn viรชn rแบฅt nhiแปt tรฌnh chu ฤรกo ."
"nhร hรng ฤแบนp vแปi nhแปฏng mรณn ฤn ฤแบทc sแบฃn cแปงa Quy Nhฦกn, ฤแปa ฤiแปm bรชn dรฒng sรดng hแบฅp dแบซn"
"Nhร hรng sแบกch sแบฝ, ฤแบนp. ฤแป ฤn ngon, mแปฉc giรก phรน hแปฃp cho khรกch du lแปch"
"Nhร hรng rแปng, thoรกng mรกt, sแปฉc chแปฉa 1000 thแปฑc khรกch, cรณ nฦกi ฤแป รด tรด thoแบฃi mรกi."
"ฤแป ฤn ngon,khรดng gian ฤแบนp vร rแปng rรฃi,sแบกch sแบฝ"
"Mแบทt bแบฑng ฤแบนp, thoรกng, thรญch hแปฃp khรกch du lแปch theo ฤoรn. Giรก bรฌnh dรขn."
"Chแบฅt lฦฐแปฃng khรดng tแปt, khu vแปฑc ฤang thi cรดng cแบงu vฦฐแปฃt nรชn khรณ ฤi lแบกi."
khung cแบฃnh tแบกm ฤc nhฦฐng ฤแป ฤn ko ngon lแบฏm
"Quรกn rแบฅt ฤรดng khรกch, view biแปn ฤแบนp, nhรขn viรชn thรขn thiแปn nhanh nhแบนn"
"Khรกch hรng rแบฅt ฤรดng, nhรขn viรชn phแปฅc vแปฅ nhanh nhแบนn, nhiแปt tรฌnh , gia vแป trong cรกc mรณn ฤn vแปซa miแปng , hแปฃp khแบฉu vแป , hแบฃi sแบฃn biแปn  nhฦฐng giรก cแบฃ phแบฃi chฤng ,hแปฃp lรฝ. View nhรฌn  thแบณng ra biแปn  nรชn rแบฅt  mรกt ,  vร rแบฅt ฤแบนp  ."
"Mรณn tรดm mลฉ ni ngon xuแบฅt sแบฏc, ngแปi trรชn tแบงng 2 view ฤแบนp, mรกt lแบฏm. ฤแปฃi hฦกi lรขu chรบt"
"Quรกn nรy khรก ok, nรชn thแปญ ฤแบทc sแบฃn bแป biแปn, hแบฃi sแบฃn tฦฐฦกi ngon, giรก cลฉng แปn"
Lร khรกch du lแปch nรชn khรก thแบฅt vแปng khi ghรฉ quรกn. Phแปฅc vแปฅ chแบญm mแบทc dรน khรกch ko quรก ฤรดng vร dแปn dแบญp. Nแบฟu cรณ dแปp quay lแบกi Quy Nhฦกn cรณ lแบฝ sแบฝ khรดng quay lแบกi
"Khรดng gian rแปng rรฃi thoแบฃi mรกi, view biแปn ฤแบนp mรกt mแบป, thแปฉc ฤn ngon miแปng, giรก cแบฃ hแปฃp lรฝ thรญch hแปฃp giao lฦฐu vแปi bแบกn bรจ"
"ฤแป ฤn tฦฐฦกi ngon, phแปฅc vแปฅ nhanh, giรก rแบฅt hแปฃp lรฝ."
"ฤแป ฤn ngon , nhรขn viรชn nhiแปt tรฌnh , giรก bรฌnh dรขn view biแปn"
"Ngon, bแป, rแบป, mรกt mแบป.Cรก mรบ hแบฅp hay chiรชn giรฒn ฤแปu ngon, hแบฃi sแบฃn cรกc loแบกi ฤa dแบกng."
ฤแป ฤn tแบกm ฤฦฐแปฃc. ฤn xong 1 mรณn chแป 15 phรบt mแปi cรณ mรณn tiแบฟp theo ฤแป ฤn
"ฤแป ฤn tฦฐฦกi ngon, giรก cแบฃ hแปฃp lรฝ, nhรขn viรชn phแปฅc vแปฅ nhanh vร chu ฤรกo, nhร hรng ngay dแปc ฤฦฐแปng biแปn nรชn view ฤแบนp. Chแป cรณ ฤiแปu lร nhร hรng ฤแป mแบฅy ngฦฐแปi bรกn hรng rong vรo bรกn hรng nรชn ngแปi ฤn uแปng ko thoแบฃi mรกi"
22g nhร bแบฟp ฤรฃ ko nhแบญn ฤฦกn hรng. Hฦกi sแปm cho khรกch du lแปch muแปn hฦฐแปng khรดng khรญ mรกt dแปu sฦฐฦกng ฤรชm vร giรณ biแปn
"Giรก quรก cao, ฤแป ฤn thรฌ lแบกi dแป.Phแปฅc vแปฅ nรณi chuyแปn cแปc lรณc"
"Mรฌnh vแปi cรดng ty vแปซa du lแปch t7 Quy Nhแปn vร cรณ ฤn 1 bแปฏa hแบฃi sแบฃn แป ฤรขy. ฤรกnh ra chung lร quรกn cรณ rแบฅt nhiแปu hแบฃi sแบฃn tฦฐฦกi sแปng, giรก cแบฃ khรก hแปฃp lรฝ, ฤแบงu bแบฟp chแบฟt biแบฟn rแบฅt ngon. Nhรขn viรชn nhiแปt tรฌnh, mแปi yรชu cแบงu cแปงa thแปฑc khรกch ฤแปu dc thแปฑc hiแปn chu ฤรกo. Nแบฟu cรณ dแปp quay lแบกi mรฌnh sแบฝ vรo thฦฐแปng thแปฉc 1 lแบงn nแปฏa"
"View biแปn ฤแบนp, quรกn nhแบญu lรฝ tฦฐแปng ngแบฏm cแบฃnh biแปn. Hแบฃi sแบฃn ngon vร tฦฐฦกi, cรณ phแปฅc vแปฅ cฦกm trฦฐa"
"Ngon, quรกn trฦฐแปc mแบทt biแปn nรชn ngแปi trรชn lแบงu mรกt"
"Hแบฃi sแบฃn tฦฐฦกi, nhร hรng thoรกng, giรก hแปฃp lรฝ(rแบป) so vแปi mแบทt bแบฑng du lแปch chung cแบฃ nฦฐแปc"
"Mรณn ฤn ngon, tฦฐฦกi sแปng, view nhรฌn thแบณng ra biแปn, thฦฐแปng tiแบฟp cรกc ฤฦกn vแป  cฦก quan ฤoรn thแป!"
"ฤแป ฤn sรกng, nhanh rแบฅt ngon. Hฦฐฦกng vแป tuyแปt vแปi"
"Quan cแบฃnh ฤแบนp , hแบฃi sแบฃn ngon , giรก tฦฐฦกng ฤแปi cao"
Tฦฐฦกng lai tแปซ giแป nhฦฐ bแปฉc tranh em quรชn tรด mรu
"Khรกc vแปi lแบงn ฤแบงu tแปi, cรกc lแบงn sau mรฌnh ฤแปu phแบฃi ฤแบทt trฦฐแปc ฤแป cรณ chแป vร ฤฦฐแปฃc chuแบฉn bแป.ฤรขy lร nhร hรng hแบฃi sแบฃn tฦฐฦกi sแปng, chแบฅt lฦฐแปฃng mร giรก bรฌnh dรขn cรณ uy tรญn sแป 1 cแปงa Quy nhฦกn.Giai thoแบกi vแป chแปง quรกn tแปฑ chแปn tแปซng con hแบฃi sแบฃn do chแปง lร dรขn gแปc ฤi biแปn nรชn hแป cรณ mแปi sแบตn vแปi ngฦฐแปi ฤi biแปn.ฤแบทc biแปt hแป khรดng chแบฅp nhแบญn viแปc dแบซn khรกch, ฤn hoa hแปng cแปงa cรกc nhรณm du lแปch, tรi xแบฟ ฤแป giแบฃm ฤแป cแปงa khรกch. Nรชn phแบงn lแปn khรกch แป ฤรขy ฤแบฟn mแปt lแบงn lร lฦฐu lแบกi."
Giรก cแบฃ phแบฃi chฤng. ฤแป ฤn ngon. Nhรขn viรชn rแบฅt dแป thฦฐฦกng vร nhiแปt tรฌnh
"ฤแป ฤn tฦฐฦกi nhฦฐng chแบฟ biแบฟn chฦฐa chuแบฉn lแบฏm, nhรขn viรชn phแปฅc vแปฅ cรฒn phแบฃi nhแบฏc nhiแปu"
"Thแปฉc ฤn ngon, giรก hแปฃp lรฝ, vแป trรญ ฤแบนp, chแป ngแปi sแบกch sแบฝ."
"Hแบฃi sแบฃn tฦฐฦกi, ...khแบฉu vแป chแบฏc tรนy...mแปi ngฦฐแปi ๐"
"Phแปฅc vแปฅ nhanh, lแปch sแปฑ.ฤแป ฤn ngon, hแบฃi sแบฃn tฦฐฦกi. Cรณ phรฒng riรชng cho tแปซng nhรณm. View biแปn, thoรกng mรกt."
ฤแป ฤn khรดng ngon. Nhฦฐng nhรขn viรชn rแบฅt thรขn thiแปn
ฤแป ฤn ngon ฤแบทc biแปt lร hรu vร lแบฉu sแปฉa. Nhฦฐng mรฌnh ฤแบทt phรฒng riรชng thรฌ bรญ lแบฏm vร mรนi nฦฐแปc mแบฏm รกm trong phรฒng
Quรกn cรณ view hฦฐฦกฬng ra biแปnn thoรกng mรกt. Khu vแปฑc cรณ thแป ฤแบญu xe รดtรด 2 bรชn ฤฦฐแปng mร khรดng bแป phแบกt.
"ฤแป ฤn ngon, giรก hแปฃp lรฝ nhฦฐng nhรขn viรชn chฦฐa chuyรชn nghiแปp nรชn phแปฅc vแปฅ cรฒn chแบญm"
"Quรกn nรy hแบฃi sแบฃn ngon, ฤa dแบกng, giรก cแบฃ thรฌ cลฉng ฤuแปฃc, khรดng quรก ฤแบฏt, mรณn lแบฉu sแปฉa แป ฤรขy ngon ah, gแปi cรก mai cลฉng hแบฅp dแบซn vร bแบฏt miแปng, ngay trung tรขm thรnh phแป thรฌ quรกn nhฦฐ vแบญy lร ok"
"Ngแปi chแป 2 tiแบฟng mรณn duy nhแบฅt ฤc ฤn lร rau luแปc, mรฌ xรo . Giรก ฤแบฏt phแบงn lแบฉu thรขp cแบฉm hฦกn 300k ฤc vรi miแบฟng thแปt"
"Nhร hรng ven bแป biแปn, hแบฃi sแบฃn ฤang bฦกi tฦฐฦกi ngon, phแปฅc vแปฅ chu ฤรกo, giรก cแบฃ phรน hแปฃp so vแปi mแบทt bแบฑng cแปงa quy nhฦกn"
"Giรก tฦฐฦกng ฤฦฐฦกng hcm, nhฦฐng แปn vแปi tแบงm giรก cรกc quรกn chung quanh, nรชn thแปญ"
"ฤแป ฤn ngon. Chแป ngแปi cแบกnh bรฃi biแปn,  rแบฅt hแปฃp ฤแป ฤรฃi khรกch hoแบทc ฤi theo nhรณm"
"ฤแป ฤn tฦฐฦกi ngon, phแปฅc vแปฅ tแบญn tรฌnh, nhanh chรณng"
"Hแบฃi sแบฃn cแปงa nhร hรng rแบฅt tฦฐฦกi ngon, giรก cรกc loแบกi hแบฃi  sแบฃn แป ฤรขy khรก rแบป so vแปi cรกc thรnh phแป biแปn khรกc แป khu vแปฑc miแปn trung."
ฤแป hแบฃi sแบฃn tฦฐฦกi chแบฟ biแบฟn mรณn ฤn ngon sแบกch sแบฝ giรก hแปฃp lรฝ
"Giรก cแบฃ hฦกi cao, chแบฅt lฦฐแปฃng tแบกm แปn. Cรณ nhiแปu lแปฑa chแปn thรบ vแป hฦกn nhiแปu"
"Mรณn ngon, lแบก miแปng vร vแปซa khแบฉu vแป cho khรกch du lแปch"
"Giรก khรก mแบฏc so vแปi chแบฅt lฦฐแปฃng thแปฑc phแบฉm, chแบฟ biแบฟn chฦฐa แปn, phแปฅc vแปฅ แป mแปฉc trung bรฌnh gแปi mรณn chแป khรก lรขu"
Cua Hoรng ฤแบฟ ฤn xong vแป ฤau cแบฃ khแปp. Rแบฅt ngon
"Khรดng gian rแปng, thoรกng, thรญch hแปฃp cho nhแปฏng bแปฏa tiแปc ฤรดng ngฦฐแปi.Quรกn ven biแปn, ฤฦฐแปng trung tรขm , giรก cแบฃ hแปฃp lรญ ."
"ฤn ngon , giรก hแปฃp lรฝ. Mรฌnh thรญch nhแบฅt mรณn Mai nฦฐแปng mแปก hรnh , vร tรดm hรนm nhแป"
"Phแปฅc vแปฅ tแปt, nhiแปt tรฌnh, chu ฤรกo. ฤแป hแบฃi sแบฃn ฤn khรก ฤฦฐแปฃc, mแปi tแปi hฦกi รญt lแปฑa chแปn. Giรก bรฌnh dรขn"
Phแปฅc vแปฅ kรฉm. Gแปi hรng cแบฃ tiแบฟng khรดng lรชn ฤแป. Mang cฦกm thiu cho khรกch ฤn
"Vแป trรญ ฤแบนp, giรก cao nhฦฐng chแบฅt lฦฐแปฃng tฦฐฦกng xแปฉng, mรณn ฤn chแบฅt lฦฐแปฃng, rแบฅt ฤรดng khรกch du lแปch."
"Chแป ngแปi ฤแบนp nhรฌn ra biแปn Qui nhฦกn, thแปฉc ฤn ngon, giรก cแบฃ oke"
"Nhร hรng tฦฐฦกng ฤแปi sแบกch sแบฝ, phแปฅc vแปฅ nhiแปt, giรก khรดng cao cลฉng khรดng rแบป."
Nhร hรng lแปn. Giรก khรก cao nhฦฐng mรณn ฤn khรดng xuแบฅt sแบฏc
"Haฬi saฬn tฦฐฦกi ngon, chรชฬ biรชฬn vฦฐฬa miรชฬฃng, giaฬ รดฬn, chuฬ dรชฬ thฦฐฦกng, hiรชฬu khaฬch!"
Giaฬ caฬ hฦกฬฃp lyฬ nguyรชn vรขฬฃt liรชฬฃu tฦฐฦกi ngon
"Hแบฃi sแบฃn khรก ngon, giรก cแบฃ chแบฅp nhแบญn ฤฦฐแปฃc, phuc vแปฅ tแบญn tรฌnh."
"Do view biแปn nรชn giรณ rแบฅt mรกt, vแปซa ฤn vแปซa ngแบฏm cแบฃnh biแปn trแปi xanh mรขy trแบฏng nแบฏng vรng"
"Nhร hรng view ฤแบนp. ฤแป ฤn ngon, giรก cแบฃ phรน hแปฃp"
"Khรดng gian thoรกng mรกt, hฦฐแปng nhรฌn ra biแปn ฤแบนp, mรณn ฤn vแปซa miแปng ฤn ngon"
"Mรณn ฤn bรฌnh thฦฐแปng. Cฦกm khรด, hรu nฦฐแปng bรฉ vร quแบฏt. Phแปฅc vแปฅ siรชu chแบญm."
"Quรกn giรก quรก cao, bia quรก mแบฏc so vแปi mแบทt bแบฑng chung vร cรกc quรกn gแบงn ฤรณ"
ฤแป ฤn hแบฃi sแบฃn khรก mแบฏc vร chแป mรณn rแบฅt rแบฅt lร lรขu
"Quรกn ฤn ngon ๐ด, sแบกch sแบฝ, thoรกng mรกt, giรก cแบฃ hแปฃp lรฝ"
"quรกn ngon, giรก hแปฃp lรฝ, mรณn mแบฏt cรก ngแปซ rแบฅt ok"
"Mรณn ฤn tuฦกi ngon, giรก cแบฃ bรฌnh dรขn, phแปฅc vแปฅ niรชฬm nแป"
"Ngon rแบป, thoรกng mรกt, phรน hแปฃp cho gia ฤรฌnh"
"Hแบฃi sแบฃn tฦฐฦกi, ngon, view ฤแบนp!Nรชn lแบฅy phรฒng nhรฌn ta biแปn."
"Nhiแปu khรดng gian lแปฑa chแปn, thแปฉc ฤn tฦฐฦกi ngon"
"Quรก tแป, ฤรฃ ฤแบทt trฦฐแปc buแปi chiแปu, tแปi ฤแบฟn nฦกi ฤแปฃi 1 tiแบฟng ฤแปng hแป ko mang ฤฦฐแปฃc nแปi lแบฉu lรชn"
ฤแป hแบฃi sแบฃn ngon. Cรก chรฌnh nฦฐแปng rแบฅt tuyแปt
Cแบฃ tiแบฟng mร ฤc cรณ 1 mรณn. Ngฦฐแปi vรo sau mร mรณn ra trฦฐแปc. @@
"Thแปฉc ฤn ngon, nhรขn viรชn phแปฅc vแปฅ nhiแปt tรฌnh"
"Khรดng gian thoรกng, mรณn ฤn ngon, giรก hแปฃp lรญ"
Sรกt bแป biแปn....mแปi ngon...bรกn ฤแบฟn sau 9h tแปi lร nghแป...
Quแบฃn lรฝ nhร hรng kรฉm.  Xua ฤuแปi xe ฤฦฐa ฤรณn khรกch.
"Bรชn cแบกnh bแป biแปn, buแปi tแปi ngแปi แป ฤรขy thแบญt mรกt mแบป..."
Ngแปi vแป hรจ lร nhแบฅt. ฤn ฤฦฐแปฃc giรก hฦกi chรกt
"ฤแปa ฤiแปm thuแบญn tiแปnThแปฉc ฤn ngon, phong phรบ..."
Cho ngoi ly tuong nhin ra bien tuyet dep bep nau ngon
Bแป biแปn 2tr5/kg vร nhiแปu ฤแบทc sแบฃn biแปn khรกc.
Tรดm hรนm chรกy tแปi ngon. Tรดm chแบฏc ngแปt thแปt
Nha hang sang trong nhรขn viรชn rแบฅt nhiแปt tinh
"Khรดng gian ฤฦฐa ta vแป nhแปฏng nฤm thแบญp niรชn 90. Cรกc mรณn ฤn dรขn gian ฤa dแบกng, ฤแบทc biแปt cรกc mรณn ฤn miแปn trung mang ฤแบฟn ฤแปi mแปi vแป giรกc cho bแปฏa cฦกm hรng ngรy cแปงa chรบng ta. Phแปฅc vแปฅ cแปi mแป nhiแปt tรฌnh."
"Cรกc mรณn แป ฤรขy khรก ngon, phแปฅc vแปฅ khรดng quรก nhanh. Khรดng gian quรก thoรกng mรกt, cรณ chแป ngแปi ngoรi trแปi"
"Hoรi niแปm mแปt khรดng gian xฦฐa,rแบฅt thรญch hแปฃp cho gia ฤรฌnh,bแบกn bรจ,gแบทp gแปก ฤแปi tรกc.mรณn ฤn rแบฅt ngon,phแปฅc vแปฅ rแบฅt chu ฤรกo vร chuyรชn nghiแปp"
"Khรดng gian lแบก mแบฏt, phแปฅc vแปฅ chแบญm, nhแบงm dแบซn ฤแบฟn phแบฃi ฤแปฃi rแบฅt lรขu, ฤแป ฤn khรดng thแปฑc sแปฑ ngon. Trแบฃi nghiแปm khรดng tแปt."
"Quรกn cฦกm Mแบญu dแปch, bรi trรญ theo phong cรกch thแปi bao cแบฅp, ฤแป ฤn ngon giรก phรน hแปฃp"
"Khรดng gian khรก trแบญt, รญt nhร vแป sinh, cแบงu thang lรชn lแบงu hแบนp, nhร hรng mang hฦกi hฦฐแปng cแป ฤiแปn vแปi tรดng vรng cam, ฤแป ฤn khรดng cรณ gรฌ ฤแบทc sแบฏc, thแปฉc ฤn bแป nhแบกt ai ฤn ฤแบญm ฤร cแบงn lฦฐu รฝ riรชng, sแปฉc chแปฉa แป ฤรขy vรo khoแบฃng 15 bang"
ฤแบฟn quรกn nรy lร 1 trแบฃi nghiแปm rแบฅt thรบ vแป khi ฤรฃ ฤn chรกn hแบฃi sแบฃn แป nhแปฏng nฦกi khรกc
ฤn uแปng bรฌnh thฦฐแปng. Quรกn ฤแบนp nhฦฐng vแบฏng nรชn nhรขn viรชn phแปฅc vแปฅ vแบซn cรฒn lแบญp cแบญp. Cฦกm viแปt nhฦฐng khรดng cรณ mรณn ฤแบญu phแปฅ.ฦฏu ฤiแปmNแบฑm ngay trung tรขmQuรกn ฤแบนpNhฦฐแปฃc ฤiแปmGiรก caoPhแปฅc vแปฅ chฦฐa chuyรชn nghiแปp
"Quรกn nแบฑm trong trung tรขm thรnh phแป Quy Nhฦกn, trang trรญ ฤแบทc sแบฏc vแปi mแบงu vรng ฤแป vร cรกc hรฌnh แบฃnh vแบฝ tฦฐแปng gแปฃi nhแป 1 thแปi xa xฦฐa chiแบฟn tranh Viแปt Nam. Cรกc ฤแป ฤn trung bรฌnh, nhฦฐng phแปฅc vแปฅ khรก chแบญm โฆ cรณ lแบฝ ฤรณ lร phong cรกch phแปฅc vแปฅ cแปงa ngฦฐแปi Bแบฏc"
"ฤแป ฤn ngon, giรก cแบฃ hแปฃp lรฝ. Quรกn khรก ฤรดng khรกch."
"Quรกn cรณ cรกch trang trรญ ฤแบนp, lรชn mรณn cลฉng khรดng nhanh nhฦฐng quรกn ฤรดng, cรณ thแป thรดng cแบฃm ฤฦฐแปฃc.ฤแป ฤn thรฌ khรก ฤแบฏt, vแปi lแบกi thรญch hแปฃp ฤi nhiแปu chแปฉ 2 ngฦฐแปi mร ฤn vรi mรณn thรดi lร dฦฐ ฤแป ฤn luรดn.Cรณ 1 mรณn lร dฦฐa muแปi mแบญu dแปch, mรฌnh khรดng gแปi nhฦฐng nhร hรng vแบซn ฤแป sแบตn trรชn bรn... Khรดng thรญch cรกch lรm nhฦฐ vแบญy"
Nhรขn viรชn thรกi ฤแป mแบฅt dแบกy. Nhแบญn ฤแบทt bรn qua ฤiแปn thoแบกi ฤแบฟn nฦกi chแปi bแบฃo khรดng nhแบญn kรจm thรกi ฤแป thรกch thแปฉc. Quรกn nรy chแปง khรดng quแบฃn lรฝ ฤฦฐแปฃc khi mแป thรชm cรกi thแปฉ 2. Sแปm muแปn dแบนp tiแปm
"ฤแป ฤn ngon, hแปฃp khแบฉu vแป vแปi cแบฃ 2 miแปn Bแบฏc Nam, nhรขn viรชn thรขn thiแปn, khรดng gian khรก thoรกng, mรกt mแบป, theo phong cรกch thแปi Mแบญu Dแปch. Giรก cแบฃ hแปฃp lรฝ."
"Mรณn ฤn cลฉng bรฌnh thฦฐแปng, giรก bรฌnh dรขn, nรณi chung ngรกn cรกc mรณn hแบฃi sแบฃn thรฌ tแปi ฤรขy ฤn. Cรณ mรณn cร sแปng chแบฅm ruแปt cรก rแบฅt lแบก. Nhรขn viรชn nhiแปt tรฌnh."
Mรณn ฤn ngon. Nhรขn viรชn phแปฅc vแปฅ chu ฤรกo nhiแปt tรฌnh. View ฤแบนp.Cแบงn ฤแบทt bรn gแปi mรณn trฦฐแปc ฤแป khรดng phแบฃi ฤแปฃi lรขu .
"Tรดi hoรn toรn thแบฅt vแปng vแป viแปc phแปฅc vแปฅ cแปงa quรกn, khรดng chuyรชn nghiแปp. Tรดi ฤแบทt bรn nhฦฐng ฤแบฟn thรฌ chฦฐa thแบฅy ฤรขu, hแปi thรฌ vแปi vรng tรฌm chแป ฤแป xแบฟp vแปi cho xong. ฤแบทt mรณn ฤn thรฌ bแบฃo phแบฃi tแปซ 45 phรบt mแปi cรณ. Kiแปu kinh doanh thแบฟ nรy thรฌ ai dรกm ฤแบฟn. Lแปก hแบฟt viแปc cแปงa khรกch. Mแปi ngฦฐแปi cแบงn xem thแบญt kแปน khi ฤแบฟn quรกn phแปฅc vแปฅ kiแปu nรy ฤแป ฤแปก bแปฉc xรบc."
"Khรดng gian kiแปu nรฉt xฦฐa nhฦฐ hรฌnh mรฌnh chแปฅp. Thแปฉc ฤn kiแปu cung ฤรฌnh รก cรกc bแบกn. Mรณn รญt รญt thรดi, khรดng nhiแปu nรชn mรฌnh cรณ thแป ฤn ฤฦฐแปฃc nhiแปu mรณn trong 1 lแบงn ฤn. Giรก cลฉng hแปฃp lรฝ.Cแบฃm giรกc phแปฅc vแปฅ ko ฤแปฑoc nhanh lแบฏm nรชn cรกc bแบกn nรชn ฤแบทt bรกn vร ฤแบทt mรณn trฦฐแปc"
"Quรกn gแปฃi cแบฃm giรกc vแป thแปi xฦฐa cลฉ tแปซ khรดng gian quรกn, bรกt, ฤฤฉa, muรดi canh, nแปi, phแบกn ฤแปฑng ฤแป ฤn. ฤแป ฤn ฤa dแบกng. ฤแป ฤn hฦกi nhiแปu dแบงu mแปก"
"Mรณn ko ngon lแบฏm, phแปฅc vแปฅ bรฌnh thฦฐแปng, giรก cao hฦกn mแบทt bแบฑng giรก cแปงa quรกn ฤn cรนng loแบกi tแบกi ฤแปa phฦฐฦกng."
"Menu quรกn ฤa dแบกng, nhฦฐng gia vแป hฦกi ngแปt. NV lฦก lร, gแปi vรi lแบงn mแปi nhแป. Khฤn bรn chแป mรฌnh ngแปi khรกch trฦฐแปc ฤแป nฦฐแปc mแบฏm nhฦฐng khรดng ฤฦฐแปฃc thay mร chแป set up chรฉn bรกt cho khรกch mแปi."
"ฤแป ฤn hแปฃp khแบฉu vแป, mรฌnh แบฅn tฦฐแปฃng view quรกn rแบฅt ฤแบนp, ฤแป ฤn ฤa dแบกng, nhรขn viรชn rแบฅt nhiแปt tรฌnh. cรณ dแปp quay lแบกi Quy Nhฦกn mรฌnh sแบฝ แปงng hแป tiแบฟp"
"quรกn dรnh cho khรกch du lแปch, ฤi รญt ngฦฐแปi phแปฅc vแปฅ rแบฅt lรขu, nแบฟu mแปi ngฦฐแปi muแปn ฤn lรบc giแปฏa trฦฐa thรฌ nรชn ฤi lรบc 10h ฤแป chแป"
Quรกn ฤn ngon. Rแบฅt ฤรดng khรกch nรชn mแปi ngฦฐแปi cแบงn ฤแบทt bรn trฦฐแปc khoแบฃng 1 ngรy.
