Review,giai_tri,luu_tru,nha_hang,an_uong,di_chuyen,mua_sam
"Lưu trú thuận tiện, check in tư động, tư vấn đầy đủ dich vụ, nv thân thiện",4,4,0,0,0,0
Rất nhiều thông tin và tốt đẹp để xem canh tác hữu cơ trong thực tế - nấm sò rất ngon và tôi không thể chờ đợi để thử chúng ở New Zealand - hy vọng tôi có thể tìm thấy nấm hàu ở đây,0,0,0,5,0,0
Siêu thị big c bán đồ còn rẻ hơn ở ngoài tạp hoá nữa. Hàng tươi ngon mà lại rất hợp lí so với mức sống chung ở người địa phương.,0,0,0,0,0,5
"Hải sản từ 4h chiều là lên tới chợ rồi nha, tươi ngon và giá hợp lý.",0,0,0,0,0,5
"Lại là món tủ của mình khi tới quán đây, Payaya Bowl, trưa đang đii ngoài sài gòn nắng nóng, vào đây ăn xong cái khoẻ ng lun á",0,0,0,4,0,0
Không được đi cáp treo nên mất cảm hứng khi ở resot. Vào khu vui chơi mất phí giống khách không lưu trú ( không có sự ưu đãi),1,0,0,0,0,0
"Ngoài hải sản, có thể gọi các món ăn với cơm như cá bớp kho tộ, sườn chiên mắm ăn rất ngon nhé, canh thì ăn canh cá bớp nấu chua hoặc rau cải nấu tôm :)) Giá cả phải chăng, mỗi người hết khoảng 120k-150k, nhân viên nhanh nhẹn, phục vụ nhiệt tình.",0,0,0,5,0,0
"Xe đẹp, đời mới, chất lượng, giá cả cạnh tranh Thái độ phục vụ tốt, tư vấn nhiệt tình Có hổ trợ mang xe giao tận nơi và khi trả xe đến tận nơi lấy, không thu phí phát sinh hay phụ thu Mình thuê từ 16h ngày 19/06 đến 16h ngày 21/06 chỉ tính 2 ngày. Tính thời gian rất lợi cho khách hàng. Vote 5 sao vì rất hài lòng với dịch vụ cho thuê xe máy của bạn Hoài Bảo",0,0,0,0,5,0
"Chất lượng dịch vụ tại fleur de lys oke, nhân viên thân thiện phòng ốc sạch sẽ đồ ăn ngon, nhưng ngày ở khách sạn gia đình được take rất tốt. mình thấy khách sạn ổn đáng để trải nghiệm so với tầm giá.
",0,5,0,0,0,0
"Quán này gần sát đường Xuân Diệu nè, do chính những người dân biển bán luôn nên ốc hay các loại hải sản ở đây là tuyệt vời nhé. Menu ốc thì đa dạng thôi rồi, đủ loại hết: ốc bươu, ốc hương, ốc nhảy, ốc trộn... Ngoài ốc thì còn sò lẹm, sò lông nướng, cháo hải sản... nữa nè. Ốc ngon, sò ngon là phải đi kèm với nước chấm ngon nè, có món thì chấm nước mắm nhưng có món thì chấm muối, có 2 loại muối dùng chấm là muối xanh với muối đỏ mà muối nào cũng ngon hết á. Giá cả thì cũng bình dân, từ 15k/1 dĩa. Vậy nên ai muốn ăn hải sản ngon mà rẻ thì lưu quán này vào rồi ghé ăn nha :))) Lưu ý là quán hết đồ sớm lắm nên tranh thủ đi trước 5h30 cho chắc nha ^^",0,0,0,5,0,0
"Tài xế taxi này rất không trung thực & hành động ngu ngốc. Anh hai lần chở chúng tôi đến một nơi khác mà chúng tôi sẽ đến. 
Hành động rất ngu ngốc để kiếm thêm một vài đô la. Chúng tôi sẽ đi bằng Grab từ bây giờ trở đi.",1,0,0,0,1,0
"Đi quy nhơn vào mùa có mưa rào, nên mình tới đây thời tiết không tốt, mưa rào nhẹ, không thể ngồi ngoài ngắm biển được. Quán được bày trí rất đẹp, phong cách tây hoá, menu đa dạng món nước. Mình uống yaua thập cẩm không thấy ngon lắm, nhưng trình bày đẹp. Tóm lại, mình thích cái không khí gió biển ở đây, thật lãng mạn và đẹp.",0,0,0,4,0,0
"Lái xe gọi hẹn giờ trước và đợi đón đúng giờ. Nên sử dụng dịch vụ xe đưa đón san bay Phù Cát của đơn vị này.
",0,0,0,0,4,0
"Đến Quy Nhơn du lịch cùng người yêu lần đầu tiên thật may vì tìm được chổ cho thuê xe máy nhiệt tình và chất lượng. Xe mới cứng, mình thuê 1 xe Air Blade loại đời mới nhất 2018 giá chỉ 180K/ ngày. Xe mới roda có 1000km thôi, mới leng keng và đi siêu sướng, êm ru luôn. Chưa thấy chổ nào cho thuê xe máy xịn như chổ này
",0,0,0,0,5,0
"chúng tôi đến đó chỉ vì bài đánh giá của Anthony Bourdain và lịch sử với Tổng thống Obama. phở ngon lạ thường. phần còn lại của các mặt hàng là ok. môi trường xung quanh bằng không. phòng tắm nằm ngay bên cạnh và nhìn ra nơi bạn ngồi. thực đơn không bao quát bởi bất kỳ trí tưởng tượng nào. Rất đông khách du lịch Mỹ gọi món chính xác trong thực đơn, đó là 'Obama Combo'. Tuy nhiên, nó lấp đầy sự tò mò của chúng tôi muốn xem nơi này mà Bourdain đã ngồi. chỉ vì lý do đó, nó là giá trị nó.",0,0,4,0,0,0
"Quán ăn nằm ở trung tâm gần Hồ Gươm, mình ở khách sạn ở Hàng Đào, đi taxi qua khoảng 30 nghìn. Đến đây vào khoảng 6h30 sáng thì quán đã đông lắm rồi, mình vào đến là bàn cuối cùng, có rất nhiều người xếp hàng bên ngoài. Mình gọi tô phở giá khoảng 60 nghìn. Về hương vị thì mình thấy cũng bình thường, quán có mùi bò rất thơm nhưng mình ngửi tô phở đang ăn thì mùi nhạt lắm. Với mình thì quán nêm hơi lạt, tương cũng không đặc biệt nên mình đánh giá đây là một quán phở bình thường.",0,0,0,3,0,0
"Bên cạnh là quán bán bánh, tiện thì mua về làm quà luôn.",0,0,0,0,0,0
"Lâu ngày muốn đổi vị 1 chút, mình ghé quán để thử món mới. Không gian rộng rãi, sạch sẽ, được trang trí ảo diệu, dễ dàng có được những tấm ảnh ưng ý. Các bàn đặt không quá sát nhau, có khoảng không gian riêng, đủ để mình tám xuyên không với con bạn mọi chuyện trên trời dưới đất mà không sợ ồn ào cho bàn bên cạnh. Đồ ăn ở quán tuy là món Âu nhưng cách chế biến lại hợp khẩu vị người Việt mình, rất dễ ăn. Nay giảm cân chỉ dám ăn gà cảm thấy hài lòng, hợp khẩu vị.",0,0,0,5,0,0
"Khách sạn sạch, đẹp, nhân viên nhiệt tình, vị trí thuận lợi, bữa sáng tạm ổn, phục vụ tận tình",0,5,0,0,0,0
"Bạn đến đây nếu bạn có ý định mua bất cứ thứ gì tại căntten. Tốt nhất bạn nên hỏi giá trước tất cả các món hàng. Hôm trước vừa mua 1ly nước với giá 20k. Nay tôi mua lại không hỏi giá trước lại có giá 50k. Thật sự giận dữ 😡😡😡👎👎👎
",0,0,0,0,0,1
"Ở qn thấy quán này là có menu ,cách pha chế khá riêng và đặc sắc hơn so với quán khác. Món mình hay uống là trà sữa bọt biển phô mai(hoặc muối biển cũng ngon, ít béo hơn phô mai 1 chút). Món này làm mình nhớ tới trà sữa ô long bọt biển của Gong Cha nhưng là phiên bản rẻ hơn, cũng vị trà hơi đắng nhẹ và lớp bọt sữa béo ngậy, tới viên chân trâu trắng cũng giống.quậy hết lên uống có vị ngọt thanh chứ ko béo gắt ngọt khé như trà sữa thông thường. Giá thành 1 ly này là 28k thôi (muối biển là 25k) ly to uống no luôn. Recommend món này nếu tới quán nhé.",0,0,0,5,0,0
"2. Quán biển Đông thật tuyệt, đến đây như thay đổi không khí hắn so với Quy nhơn, - Không khí trong lành - Được câu cá thoải mái. - Chủ quán nhiệt tình. - Các món ăn phong phú thỏai mái lựa chọn, ghẹ, cua đá, cá hấp, mựa hấp, ốc sò..bao la lại còn bơi tung tăng dưới nước.",0,0,0,5,0,0
Phòng cách âm không tốt. Tối ngủ nghe tiếng động của các phòng khác và tiếng máy giặt hơi ồn,0,2,0,0,0,0
Không cần phải nói rằng chúng tôi đang quay lại sử dụng Grab nơi đặt giá trước khi đi xe. . . hoặc không có gì bất ngờ!,0,0,0,0,1,0
"Gia đình tôi vừa có một trải nghiệm thật tệ với Phong Phú Limousine. Tôi đi 5 người loại vé 390k/người. Khi đến Đà Lạt bên nhà xe không chủ động giới thiệu khách có xe trung chuyển làm rất nhiều người phải đi tãi. Khi tôi đến hỏi xe trung chuyển lơ xe mới nói ""để em gọi"". Khi xe trung chuyển đến thì đậu quay đuôi xe vào chúng tôi nên chúng tôi và các nhóm còn đứng chờ không hề biết đây là xe trung chuyển và lơ xe cũng không hề đến nói với chúng tôi. Khi tôi thấy ấu lâu mới đến hỏi ""anh ơi xe đến chưa?"" Thì nhận lại giọng trách móc.",0,0,0,0,2,0
"Có rất nhiều món ăn, việt, trung, hàn, thái đều có cả Nhưng mà nhà hàng cho hơi nhiều dầu ăn, ăn rất ngán",0,0,0,2,0,0
"Chúng tôi đến chợ khoảng 1 giờ chiều và nơi này đông đúc bởi hầu hết khách du lịch. Tất cả các túi là giả và được bán với giá cao và chúng tôi đã phải đối phó với chúng. Chúng tôi đã thấy nhiều điểm bán thực phẩm địa phương nhưng có vẻ bẩn nên chúng tôi đã không thử. Nếu bạn không biết đi đâu, đây có thể là một lựa chọn.",0,0,0,0,2,0
"Nơi cho thuê xe đạp tuyệt vời với những chiếc xe đạp tốt, gần sân bay, mọi người rất thân thiện và hữu ích. Sẽ thuê lại ở đây. Cảm ơn 😊
",0,0,0,0,4,0
"Cảm ơn bạn đã ủng hộ dịch vụ bên mình. Khi nào bạn thuê nhiều ngày xin điện thoại đặt trước mình sẽ có giá ưu đãi cho bạn nhé. Hẹn gặp lại bạn.
",0,0,0,0,0,0
"Đồ ăn ngon rẻ,nhân viên vui vẻ nhiệt tình.có dịp sẽ quay lại",0,0,0,5,0,0
"vị trí tốt, nhân viên tốt, phòng tốt",0,5,0,0,0,0
"Gà rán ở đây ngon ơi là ngon, miếng gà thơm mà giòn tênh ăn mãi không ngán . View quán rộng rãi, đẹp, thoáng mát wifi thì cứ phải gọi là thoải mái nha, trưa nắng mà vô đây chắc là nhất rồi. Thích cách các Anh chị ở đây phục vụ gê gớm cứ phải gọi là nhiệt tình í, rất thân thiện, nói chuyện với khách rất nhẹ nhàng, vui vẻ. Khuyên các bạn nên ăn thử các phần combo nha rất là tiện, giá cả khá hợp lí mà còn được thưởng thức nhiều món hơn.",0,0,0,5,0,0
"Rủ thêm vài đứa bạn thân, chuẩn bị vài bộ áo quần đep rồi ra làng chài Nhơn Lý là có cả đống ảnh đẹp, đồ ăn ngon mà lại rẻ. Mấy cô chú ngư dân dễ thương mộc mạc lắm. Làm du lịch nhưng cảm giác như người nhà vậy, rất thích!
",5,0,0,0,0,0
"Không gian sạch sẽ, lịch sự. Nhân viên nhiệt tình, có tay nghề khá tốt và lễ phép. 2 vợ chồng mình ghé qua khá muộn nhưng nvien vẫn rất niềm nở tiếp đón. Địa điểm masage lành mạnh rất đáng để ghé qua",0,4,0,0,0,0
"Quán phục vụ hơi chậm vào nhưng lúc buổi trưa, hơi ồn ào xô bồ một tí, Cơm tậm chấp nhận với gia cả ở hiện tại",0,0,0,3,0,0
"Phòng sạch sẽ, đầy đủ tiện nghi cơ bản, nhân viên và chủ khách sạn rất vui vẻ thân thiện. Nhất định sẽ quay lại Arise hotel khi có dịp đến với TP biển Nha Trang",0,5,0,0,0,0
"Tầm nhìn tuyệt vời từ quán bar trên tầng thượng và dịch vụ tuyệt vời, không thể tin rằng chúng tôi có toàn bộ mái nhà cho chính mình. Các món ăn rất đáng yêu, rất khuyến khích.",5,0,0,0,0,0
"Ngon. Nước mắm chua ngọt bắt vị. Giá thì cũng ổn tầm 45-55k/ng là no. Sữa đậu nành ngon.
",0,0,0,5,0,0
"Lần đầu tiên mình rất ấn tượng với người dân ở sự đơn sơ mộc mạc rồi đến các địa điểm du lịch để chặt chém du khách, mình rất thích dịch vụ cho thuê xe máy của một người hoài cổ. duy nhất 27a hoàng hoa phát hiện xe này rất tốt, nhân viên và anh chủ rất nhiệt tình tư vấn cho chúng tôi những địa điểm đi chơi, ăn uống giá rẻ tại",0,0,0,0,5,0
"Nhà hàng Sisters với pizza, mì ý chuẩn kiểu tây, ngoài ra nhà hàng còn nhiều món khác như hamburger, bread, beef, và những món hấp dẫn khác, nhà hàng pizza mình thấy ngon nhất từ trước giờ được ăn ở quy nhơn, hương vị rất tây, nhà hàng có chú pet cực dễ thương Jymmy, không gian cũng rất lãng mạn cho những cặp đôi hẹn hì, nhà hàng còn nhận book tiệc như sinh nhật, Đặc biệt nhà hàng với dàn nhân viên trai xênh gái đẹp, phục vụ cực kì thân thiện, sẽ sẵn sàng tư vấn cho khách hàng nhiệt tình :))))",0,0,0,5,0,0
"Sân bay nội địa , không tránh khỏi sự thiếu thốn hơn sân bay Quốc tế
Nhưng góp phần lớn trong sự phát triển du lịch và kinh tế đất nước ",0,0,0,0,3,0
"Không gian quán rộng nhưng trang trí không đẹp, đồ uống bình thường không có gì đặc sắc ngoại trừ topping hạnh nhân béo béo khá ngon, nhân viên nhiệt tình",0,0,0,4,0,0
"Cà phê ở đây số 1 Quy Nhơn đó. Đúng là chỗ ngồi hơi hạn chế nhưng bù lại đồ uống đa dạng và ngon cực, đặc biệt là cà phê, rất thơm và đậm đà. Highly recommended",0,0,0,5,0,0
"Tôi nghe nhiều du khách nói gì đó về bánh pancake tôm giòn - bahn xeo. Đi lên cửa hàng ngay khi chúng tôi đến Quy Hưng. 
Họ đã mang nhiều thứ lên bàn và chúng tôi không biết làm thế nào để đối phó với quá nhiều thứ. May mắn thay, các nhân viên đã chú ý và chỉ cho chúng tôi cách cuộn nó trong bánh tráng sau đó thưởng thức với nước mắm. Thú vị & ngon miệng! Đó là một chút dầu nên chúng ta không thể ăn nhiều.",0,0,5,5,0,0
"Đi ngang thấy quán trưng mấy chai nước lạ lạ đẹp mắt nên ghé vô quán uống thử, thấy nước trái cây ở đây ngon mà rẻ, thấy chất lượng không pha nước loãng nhách như mấy quán khác, lần sau sẽ ghé thử thêm nhiều món nữa.",0,0,0,0,0,0
600 món có nghĩa là số lượng không chất lượng,0,0,0,1,0,0
Hơi khó tìm địa chỉ một chút,0,3,0,0,0,0
Phòng mình bố trí bồn rửa mặt ngay cửa ra vào rất dễ va chạm mấy thứ đĩa đựng đồ nho nhỏ. Mà vỡ cái đĩa sứ nhỏ xíu đền 80k. Quá đắt,0,2,0,0,0,0
"View đẹp. Nhân viên và quản lý rất nhiệt tình. Rất thích bạn Quý manager, chỉ mình mấy chỗ “sống ảo” cực đẹp ^^.",0,5,0,0,0,0
"Tụi mình thường tụ tập tới các quán trà sữa để thư giãn. Không chỉ để uống nước mà còn để chơi, học bài, làm việc nhóm . Quán cũng khá là ít khách, được chia làm 2 gian. 1 bên là ghế ngồi, còn 1 bên là ngồi trên sàn. Những lúc mình đi 1 mình thì mình ngồi ghế, còn có bạn bè thì mình ngồi trên sàn. View khá là đẹp, chủ quán lại thoải mái. Tụi mình chơi từ 9h tới 14h . Các chỉ nhân viên cũng rất vui vẻ . Thức uống cũng rất ngon .",0,0,0,5,0,0
"Mình ở ngay Mường Thanh. Cả nhà đói và mệt sau chặng bay từ Hà nội. Đi bộ vài bước mừng như bắt được vàng, nhà chỉ muốn ăn đơn giản
 nên gọi đĩa rau muống luộc, bát canh cá chua lèo tèo vài miếng vá bớp. Đĩa mực chiên khoảng hai chục miếng. Hai chai nước suối. Lúc đứng dậy hết 379k. Mình chưa nói đến giá, ngoài canh cá còn tạm được. Cơm cũ và nguội. Mực thì chiên quá lửa.... Sao có những người đánh giá tốt được ở nhà hàng này??? Hay tại mình là người Bắc??",0,0,1,1,0,0
Nơi tuyệt vời với một bầu không khí đẹp và trang trí! Món ngon Việt Nam. Ngoài ra các món ăn phương Tây có sẵn. Đội ngũ trẻ vô cùng thân thiện và hữu ích. Rất khuyến khích!,0,0,0,5,0,0
"Nhược điểm duy nhất là nó khá đắt. Có một khoản phí 15% tet mà chúng tôi biết nhưng trước đó, hóa đơn được áp dụng là 550 k, đây là khoản tiền lớn nhất chúng tôi đã trả cho một bữa ăn trong 6 tháng ở châu Á - bao gồm cả ở các thành phố lớn.",0,0,0,2,0,0
"Lối vào KS phía bên trái có quán cà phê vỉa hè, chiếm hết lối đi,phía bên phải của lối vào đã bị chiếm dụng làm nơi để xe gắn máy dẫn đến việc lối đi ra/vào rất hẹp (không an toàn trong trường hợp có hoả hoạn). Lối ra/ vào này được dùng chung cho 3 khách sạn khác nhau.",0,2,0,0,0,0
Cảnh quan đẹp và hùng vĩ đến đây thấy tâm trạng mình tốt hơn và thấy non sông gấm vóc của mình rất đẹp,4,0,0,0,0,0
"Khi bước vào quán này,mình khá choáng ngợp vì không gian quá sạch sẽ và quá sang trọng, cứ ngờ ngợ lạc vào chốn tây nào ấy chứ. Hehe. Nhân viên thì nhiệt tình thôi rồi luôn. Đồ ăn thì phục vụ nhanh lắm, một tí là có ngay, Vì bọn mình đi có 2 người nên chỉ gọi hai món thôi, cơ mà thật bất ngờ. Hai dĩa ú nụ, hai người ăn no cả bụng. Pizza ở đây vừa thơm,vừa ngon và không bị ngấy, cảm giác cứ như là đang tan trong miệng ấy còn món salab thì vừa miệng lắm luôn. Giá thì đối với người đi làm như mình thì cũng được, k đắt lắm. Lần sau lãnh lương phải chiến tiếp một bữa nữa mới được.",0,0,0,5,0,0
"Quán có các anh chị nhân viên toàn trai xinh gái đẹp 😍 và phục vụ rất nhiệt tình, đồ uống ngon mà chất lượng cao. Vị trí quán có view đẹp có thể ngồi tầng trên mà ngắm phố phường đông đúc nhộn nhịp. Ngoài ra còn có rất nhiều cảnh đẹp để có thể cùng bạn bè, người thân lưu lại những kỷ niệm đáng nhớ",0,0,0,5,0,0
"Noel này bạn đã đi đâu chưa, có đi đâu thì nhớ mặc đủ ấm trước khi ra đường nhé, Quy Nhơn nay lạnh lắm. Mình ghé lại quán lần 2, nay trang trí thêm làm mình hạo hức noel ghê, nay trang trí lại nên lung linh đi sớm sớm để coa chổ ngồi trong mìa noel này nhé! Như mình đã nói, nước ở đây khá ngon, không khá ngọt nhưng lại sớm, còn giá tiền thì mình thấy cũng ổn bình thường như những quán khác thôi. Có dịp mình ghé quán lại nữa nhé thử hết nốt menu hiha :))",0,0,0,5,0,0
"Phòng sạch sẽ, đầy đủ tiện nghi, mình book phòng tầm nhìn view đẹp, đáng tiền , nhân viên chu đáo và nhiệt tình",0,5,0,0,0,0
"Giao và nhận xe tại FLC Resort. Cám ơn anh Hoài Bảo vì nếu không có xe của anh thì cũng chẳng biết thuê ai. Alo và gửi mail nhiều nơi không tìm thấy đơn vị nào giao xe tại FLC Resort cả. Đọc đánh giá dịch vụ cho thuê xe số 1 Quy Nhơn và rồi alo cho anh Hoài Bảo. Tất cả diễn ra trên cả mong đợi. Bắt tay ký ngay 7 xe 3 ngày với anh, toàn xe và mới, chạy cực tốt. Mình gửi anh thêm ít phí giao dịch, vì mình hiểu resort cách tp 15km rất cực cho bên anh nhưng anh nhất quyết không nhận.  Làm việc rất chuyên nghiệp, máy chủ thái độ, vui vẻ và chiều khách hàng quá tuyệt vời. Chưa từng thuê máy ai mà nhiệt tình như vậy, giờ có 10 sao thì cũng cho anh 10 sao",0,0,0,0,5,0
"Lạnh lạnh như thế này mà đi quất kem thì khỏi phải bàn nhé, kem này khá là nổi tiếng ở Quy Nhơn vì ngon và giá cả cũng không mắc lắm. Ở đây menu có nhiều lựa chọn cho bạn từ kem đến nước uống, bật mí bạn thử ly cacao kem nhé ngon bá cháy luôn. Về view quán khá là dễ thương đẹp ấm cúng <3. Đều mình là sinh viên nên cũng ít khi lui tới đây để thưởng thức mấy món kem ngon. Có dịp và có tiền chắc chắn mình sẽ ghé lại quán nhiều nhiều <3 chúc quán năm mới mua may bán đắt nhé <3.",0,0,0,5,0,0
"Chỗ nghỉ ngay trung tâm thành phố, tiện đi lại, khách sạn sạch sẽ",0,5,0,0,0,0
Giá rẻ so với dịch vụ,4,4,4,4,4,4
"Nhà hàng rất tệ, nhân viên và chủ sở hữu thô lỗ!",0,0,1,0,0,0
"Dịch vụ tốt, lúc nào tôi tới Quy Nhơn tôi cũng thuê xe máy bên dịch vụ cho thuê xe máy quy nhơn Hoài Bảo. Xe tốt nhân viên nhiệt tình, tôi sẽ trở lại Quy Nhơn trong dịp tới và sẽ tiếp tục thuê xe bên bạn làm phương tiện đi lại cảm ơn bạn",0,0,0,0,4,0
"Siêu thị có nhiều hạng mục, phù hợp cho gia đình hoặc các bạn trẻ tới chơi, hoặc người nội trợ mua đồ tiêu dùng. Có buôn bán ăn uống, trang sức đắt tiền, quần áo. Có siêu thị hàng tiêu dùng. Có khu trò chơi giải trí phù hợp với nhiều đối tượng. Có rạp chiếu phim, chiếu nhưng bộ phim mới và hấp dẫn trên thị trường thế giới. Chúc các bạn vui vẻ.",5,0,0,0,0,5
"Đã đến Quy Nhơn rồi thì nhất định phải đi Cù Lao Xanh nhé mọi người 😍
Cảm ơn anh Nguyễn Đức Toàn và đội ngũ HDV siêu nhiệt tình và có tâm bên #CùLaoXanhTravel đã chụp cho nhóm em những bức ảnh tuyệt đẹp này 💯 Kết thúc một chuyến đi mĩ mãn hơn cả mong đợi. Tạm biệt Quy Nhơn và hẹn gặp lại vào một ngày không xa ❤️",5,0,0,0,0,0
Nhân viên nói chuyện với khách kiểu côn đồ. Lễ tân làm 1 giá lên nhân viên ép giá lên x4 minh k đồng ý thì làm khùng làm đien lên. Tiền mất tật mang,0,0,0,0,0,1
"Ngay từ lúc bước vào quầy lễ tân, nụ cười của cô em tiếp tân tại quầy đã đủ khiến các bạn gia tăng niềm phấn khởi. Ở đây có 2 loại vé cho các bạn lựa chọn, đó là vé loại thường và vé loại VIP . Vé thường chỉ có giá 100.000đ, vé VIP có giá 250.000đ tương ứng với 2 loại phòng là phòng thường và phòng VIP. Sau khi mua vé, các bạn sẽ được nhân viên đưa đến phòng chờ. Nói phòng chờ có cả ghế dựa, ghế nằm “cực xịn”, nhiều anh nằm cái là “phê” ngủ luôn trước khi được em nhân viên nữ xinh xinh phục vụ.
",5,0,0,0,0,0
"Vé xe cao hơn các nhà xe khác, ko ăn tối mà giá vé vẫn 300k. Thường các xe đi có 240k. Đặt trên văn phòng vé 280k tính luôn tiền ăn.",0,0,0,0,2,0
"Food: giá rất ổn và highly recommend mọi người thử burger nha, ngon lắmm",0,0,0,4,0,0
"Giá vé là công bằng và bằng mét. Ô tô điều hòa. Chuẩn bị sẵn bản đồ của bạn, nam sẽ dễ dàng hơn khi lái xe tìm vị trí của bạn.",0,0,0,0,4,0
"Jolly , kem tự chọn, với tha hồ các vị kem , các topping ăn kèm , kem ở đây rất ngon , mình thích vị dừa ở đây nhất , rất đặc trưng , thơm ngon , topping thì phong phú , nhân viên cũng thân thiện , lâu lâu mới có dịp ghé tiệm kem , ngồi tán gẫu với bạn bè những ngày rảnh rỗi là quá tuyệt rồi , tiệm có không gian cũng thoáng mát , quán hình như 10 đã đóng cửa rồi , . . . Nước uống ở đây cũng ngon lắm nha , Nói chung các bạn nên ăn kem thử ở đây 1 lần.",0,0,0,5,0,0
"Quán nhỏ ít món, ăn được, giá tương đối cao, điểm cộng là hải sản tươi. Món ốc nhảy tự nhiên, ăn dai dai ngọt ngọt. Đặt biệt có món ốc trộn theo như quảng cáo là ngon nhưng chưa thử.",0,0,0,4,0,0
"View thoáng đẹp, trước ks có cây phượng tím check in rất đẹp",0,4,0,0,0,0
"Về không gian và cả ẩm thực, rất thích hợp cho các “tín đồ” của đồ ăn phương Tây nhé. Món soup bí đỏ kem béo nguậy, làm lưu luyến dễ sợ. Không gian thì hơi nhỏ, ghé quán bữa trưa thì hơi ồn tí nhưng kiểu ấm cúng.",0,0,3,3,0,0
"Quá tệ hại. Đây là thứ 3 cũng là lần cuối cùng.
",1,0,0,0,0,0
Tôi đã thuê một chiếc xe máy ở đây cho một chuyến đi trong ngày bên ngoài thành phố và nhận được dịch vụ tốt nhất mà tôi có thể yêu cầu. Hoài Bão đã rất tận tình giải thích cho tôi các loại xe máy mà anh ấy đang gặp phải và loại nào phù hợp nhất với tôi. Tôi rất vui và chắc chắn sẽ giới thiệu bạn bè thuê xe máy của anh ấy.  Like dich vu cho thue xe may quy nhon Hoai Bao at 27a Hoang Hoa Tham quy nhon city,0,0,0,0,5,0
