Review,giai_tri,luu_tru,nha_hang,an_uong,di_chuyen,mua_sam
"Mình đến quán nhiều lần rồi nhưng chủ yếu là đi một mình nhưng lần này mình dẫn em gái mình theo. Em gái mình không thích ăn đồ sống nên khi mình rủ đi ăn thử hơi có định kiến nhưng lúc mới bước chân vào Pokesaigon nó bị hấp dẫn liền cái đầu tiên là được chọn toppings dập mặt (cỡ 15+ toppings, lâu lâu quán lại đổi topping of the week để đa dạng hoá). Sau đó trộn đều tô poke của nó với base là salad (nó đang ăn kiêng nên chọn salad, bạn còn có thể chọn cơm gạo Nhật/ gạo lứt) với sốt (nó chọn goma sesame vì là sốt dễ ăn nhất), proteins (2 muỗng cá gồm cá ngừ + cá hồi cay) và cả bầu trời toppings. Lạ là trộn đều hết lúc thưởng thức không bị lạ miệng hay các nguyên liệu vị nghịch nhau mà vị như hỗ trợ lẫn nhau ý làm tăng hương vị và át mùi cá. Em gái mình đổ đứ đừ luôn nên sau lần này Pokesaigon lại có thêm fan mới",0,0,0,5,0,0
"Phòng sạch sẽ, nhân viên dễ thương",0,4,0,0,0,0
"Không gian nhà hàng đẹp, rộng rãi thoáng mát. View nhìn ra biển đẹp và sạch. Thức ăn ở đây chế biến rất ngon và hợp khẩu vị của mình. Rau cải rất tươi, nước chấm pha ngon, cá chiên béo và giòn. Nhân viên phục vụ rất lịch sự và nhiệt tình, xin thêm gì là thấy đem lên rất nhanh. Nói chung đây là nhà hàng được nhất trong cả chuyến đi 3 ngày ở Quy Nhơn của công ty mình. Tuy nhiên không biết sao trên bàn mình có một hộp gì không biết. Mong nếu có dịp sẽ ghé để thưởng thức thêm các món ăn ở nhà hàng này nữa.",0,0,5,5,0,0
"Vừa rẻ vùa ngon. Hải sản tươi sống, cực chất lượng.",0,0,0,5,0,0
"Cách âm của khách sạn không tốt lắm, vẫn nghe được tiênga gõ của phòng bên và 1 ít âm thanh đường phố bên ngoài",0,2,0,0,0,0
"Phòng ốc mới, đẹp hơn rất nhiều so với giá tiền bỏ ra. Giá tốt so với các khách sạn lân cận",0,5,0,0,0,0
"Quán chè kết hợp với quán cafe nên decor khá đẹp, nhưng đông quá mình k lên lầu được. Quán có bảo vệ giữ xe, dắt xe hộ khá bài bản. Tụi mình gọi chè Thái sầu và không sầu, đợi 1 tí là có chè. Chè cũng bt, nhưng nước rất ngon ngọt. Thạch nhiều quá nên ăn ngán ngán>< Nên đi sớm vì tầm 9h tối quán bắt đầu đóng cửa.",0,0,0,4,0,0
Kinh nghiệm cho bản thân và cho bạn khi đến khu vực nhơn lý . sử dụng dịch vụ kì co eo gió. Ăn uống hải sản tại nhà hàng bên nhơn lý . mình thì đi nhiều nhà hàng . thấy bên bảo Nam có nhiều thứ để bạn tìm hiểu dịch vụ ăn uống bên này . Rất đáng đồng tiền bát gạo .,0,0,5,5,0,0
"Tôi thích view phòng ra biển, sự sạch sẽ, sự chu đáo nhiệt tình của nhân viên lễ tân, chú bảo vệ. Có dịp chắc chắn trở lại",2,0,0,0,0,0
1 điểm trừ nhỏ là buổi tối trong WC mùi cống bốc lên hơi khó chịu nhưng mở cửa sổ nhà WC ra thì mùi không còn nữa.,0,2,0,0,0,0
"Thức ăn là có thể qua được. Chúng tôi ăn tối ở đây bởi vì chúng tôi đang tìm kiếm một sự thay thế rẻ hơn, nhưng bạn có được những gì bạn phải trả cho. Về cơ bản, mọi nhà hàng khác trong làng Bai Xep đều bán thức ăn ngon hơn, nhưng nơi này phục vụ một nhóm khách hàng ít tiền. Hầu hết các nhà hàng trong làng đều bán hải sản tuyệt vời, nhưng hải sản đắt tiền bất kể bạn ở quốc gia nào. Ở đây bạn có một bữa ăn tiêu chuẩn mà bạn sẽ nhận được trong bất kỳ bẫy du lịch nào ở bất cứ nơi nào ở Việt Nam với giá cả hợp lý. Nó là hoàn toàn không đáng kể.",0,0,4,3,0,0
Chè đậu xanh ở đây cực kì ngon. 10k 1 ly thôi mà chất lượng. Bánh bèo thì so ra quy nhơn nhiều chỗ khác ngon hơn.ở đây được cái báng bèo nóng nhưng mước mắm không đậm đà cho lắm. Chắc tại mình ăn cay và mặn hêhhee. Mấy anh phục vụ ăn nói nhỏ nhẹ rất chuyên nghiệp mặc dù chỉ là quán lề đường.,0,0,0,5,0,0
"Phòng sạch sẽ, nội thất còn mới và hiện đại. Dịch vụ nước ép tận phòng siêu rẻ và chất lượng",0,4,0,4,0,0
"Công viên nhỏ xíu xiu nhưng vị trí sát biển cực kì đẹp, đối diện với trường ĐH Quy Nhơn nên các hoạt động thể thao đá banh, bóng chuyền, bóng rổ,... trong công viên và sát bờ biển cũng rất sinh động. Có lẽ đây là nơi thể hiện rõ nhất sức trẻ của thanh niên Quy Nhơn, đặc biệt là vào sáng sớm và chiều. Ở đây tắm biển rất thích. Trên bờ có các quầy hàng rong nhỏ với mực rim, bánh tráng dừa nướng, cóc ổi xoài cũng khá ngon và siêu rẻ. Mình mua một miếng xoài to hay bánh tráng nướng chỉ có 3k :o~~~.
Tuy nhiên, người dân ở khu vực này còn hay xả rác nên nhiều lúc khiến bãi biển nhìn hơi dơ. Mong chính quyền có biện pháp khắc phục.",0,0,0,0,0,0
"Xe sân bay chạy đúng giờ
nhưng cẩn thận với dịch vụ cò xe ô tô con trước cổng.",0,0,0,0,3,0
"Thoải mãi,nhân viên nhiệt tình.phòng sạch sẽ.giá hợp lý",0,5,0,0,0,0
"Mình có ghé quán 1 lần khi mình ở Quy Nhơn. Theo mình cảm nhận thì sữa tươi trân châu đường đen có phần hơi béo,trân châu dẻo rất ngon, còn trà sữa truyền thống thì khá là ok. Điểm cộng là view đẹp và nhân viên phục vụ nhiệt tình toàn trai xinh gái đẹp :)) Giá cả cũng hợp lý nữa, mình thấy khá là ok.",0,0,0,5,0,0
"Bạn mình đi quy nhơn về và giới thiệu chổ cho thuê xe máy này cho mình. Khen chổ này cho thuê xe mới lắm, chạy tốt và rất nhiệt tình. Mình đã trải nghiệm và thấy đúng là như vậy, còn 1 điều mình ấn tượng nữa là cho 2 mũ bảo hiểm cặp hình gấu đúng đáng yêu luôn. Vừa phù hợp với mình và người yêu đi chơi, cảm ơn nhé",0,0,0,0,4,0
Bạn nhân viên Quân rất là nhiệt tình và chu đáo,5,0,0,0,0,0
Trong lúc tụi mình chờ check-in đã được nhân viên mời 1 đĩa nho rất tươi ngon,0,4,0,0,0,0
"Bên khách sạn đã xác nhận đặt phòng của mình nhưng khi mình gọi điện cho bên khách sạn để hỏi về vấn đề mình thấy ghi ""hồ bơi đang ngừng hoạt động"" thì bên Arise có chị nào bắt mát kêu thì là hết phòng rồi đó em. Mình có hỏi tại sao hết phòng mà vẫn xác nhận đặt phòng của mình thì chị đó kêu do Booking nó tự nhảy lên thôi.",0,3,0,0,0,0
Chúng tôi đã ăn ở đây một vài lần trong 5 tuần của chúng tôi ở Quy Nhơn,0,0,0,5,0,0
"Mình chuyên viết bài review cho các địa điểm du lịch và các cửa hàng làm dịch vụ du lịch. Mình đã trải nghiêm và thuê xe máy ở đây, dịch vụ thật sự rất tốt, xe mới, mũ bảo hiểm đẹp và thái độ phục vụ rất ân cần. Mình chỉ thuê có một buổi tối để đi dạo đêm thành phố quy nhơn nhưng vẫn được giao xe tận nơi nha các bạn",0,0,0,0,4,0
"Chúng tôi đã sắp xếp một chuyến tham quan riêng đến địa đạo Củ Chi vì thời gian của chúng tôi ngắn và 
chúng tôi phải bắt chuyến bay vào buổi tối, khó có thể phù hợp với một chuyến tham quan thông thường.",0,0,0,0,0,0
"Mình ăn ở đây cũng kha khá lần, đáng tiếc lần nào cũng thất vọng. Món ăn món thì nhạt nhẽo, món thì mặn như muối. Góp ý với nhân viên thì bị liếc xéo, thái độ này nọ. Mình thấy cả quản lý cũng mặc kệ nhân viên, ko biết quản lý nên nhân viên nào làm cũng bất cần. Haiz, nói chung đây là lần cuối ăn ở San Fu Lou nha.",0,0,0,2,0,0
"Nơi luôn rất đông đúc. Vì điều này và sự giới thiệu của một hướng dẫn viên du lịch, chúng tôi đã đến đó để ăn tối. Dịch vụ rất tệ. Gần như không có tiếng Anh (điều đó là tốt cho một nhà bếp trên phố viatnemese nhưng không phải là một nơi như thế này). Ngoài ra, đồ uống của chúng tôi (bia) đã được phục vụ cho những người hàng xóm của chúng tôi. Sau khi yêu cầu đồ uống, mất khoảng 10 phút để lấy lại.",0,0,0,2,0,0
"Tối thứ 7 ra bờ biển chill cùng người yêu tìm đến quán này khá ok, chúng ta đừng kì vọng đồ uống nha, bỏ tiền mua chỗ và view thôi. 
Mình gọi sữa chua hoa quả nhưng toàn dứa thôi, quán nên bổ sung menu cho phù hợp với khách du lịch",0,0,0,5,0,0
"Phong độ quán vẫn rất ổn định. Nêm nếm ngon, vừa vặn. Ốc xào dừa ở đây vẫn ngon nhất trong các quán mình từng ăn. Các món ốc xào lên nhanh, ngoài ra các món khác thường hay phải đợi lâu vì quán khá đông. Điểm trừ nhỏ là ở đây ghẹ rất bé, ăn không thật sự đã.",0,0,0,4,0,0
"Mình mới cùng gia đình nghỉ dưỡng ở FLC Quy Nhơn. Được nhân viên lễ tân giới thiệu nên tới thử. Nhà hàng nấu ăn ngon, hải sản tươi sống đa dạng, giá cả niêm yết rất hợp lý. Đặc biệt cân kí chính xác bằng cân điện tử luôn nha. Không gian thoáng, nhân viên phục vụ rất nhiệt tình, có đưa đón từ FLC nữa. Gia đình mình rất hài lòng. Cám ơn nhà hàng rất nhìu",0,0,5,5,0,0
"Tôi vào một chiếc Vinasun 7 chỗ với số xe 5435. Tôi nói với anh ấy nơi tôi cần đến và vào. Trong vòng 100 mét lái xe, và chưa ra khỏi sân bay, tài xế quay sang tôi và yêu cầu 150, 000 đồng, khoảng 7 USD. Tôi hỏi anh ta tại sao anh ta không tính tiền cho tôi. 
Anh ấy nói bạn sống quá gần, tôi sẽ không kiếm được tiền. Khi tôi chuẩn bị ra sân bay anh ấy 2 ngày trước trên một chiếc taxi Vinasun, 
nó khoảng 100 k, vì vậy anh ấy sẽ làm một cái gì đó. Bất kể, các tài xế không thể chỉ quyết định khách hàng nào sẽ nhận và trả tiền sau khi họ thấy họ sẽ kiếm được bao nhiêu.",1,0,0,0,1,0
"Tôi chỉ vào nơi tôi đang đi trên bản đồ giấy cộng với điện thoại của tôi nhưng tôi vẫn bị đưa đến sai địa điểm. 
Ngay cả khi chúng tôi đi qua Nhà thờ Đức Bà của Sài Gòn, người lái xe vẫn không dừng lại và nói với tôi rằng tôi muốn đi đến một nơi khác. Willn thậm chí dừng xe cho đến khi chúng tôi đến đó. Tài xế đã SANG. Cảm ơn vì đã đưa tôi đến sai địa điểm và phải đi bộ gần hết mức có thể nếu tôi đã bắt taxi ngay từ đầu. LỪA ĐẢO!",1,0,0,0,1,0
"Chúng tôi đã đến thăm quán bar thể thao Quy Nhơn vài lần và rất thích thú. Có một thực đơn tốt với nhiều loại bao gồm cả rau như chúng tôi. Cà ri chay, bánh burger chay & bánh pizza đều ngon - cà ri rất tuyệt. Sạch sẽ và chạy rất tốt - nơi này xứng đáng để làm tốt. Lựa chọn tuyệt vời của các loại bia và khu vực quầy bar / nhà hàng trên tầng 4 là giá trị nỗ lực lên cầu thang. Nếu bạn đang tìm kiếm một break từ mì vv và một chút nấu ăn phương Tây nơi này là lý tưởng, và nó có giá trị một chuyến thăm nếu bạn muốn dính vào thức ăn địa phương là tốt.",5,0,0,5,0,0
Khó tìm đường và lễ tân chưa rõ booking,0,2,0,0,0,0
"Nhân viên vui vẻ, phòng phim sạch sẽ. Nhưng vẫn không xử lý được các trường hợp dùng điện thoại làm ồn trong lúc xem phim.
Nói chuyện gây mất trật tự ảnh hưởng đến người xem.
Không tạo nên ý thức người xem phim văn minh mà toàn đá ghế người khác.",1,0,0,0,0,0
Quá tệ. Giường đôi.Hư cổng sạc. Clip review video khác 1 trời 1 vực ở ngoài. Đắn đo giữa Nguyễn Kim vs  Phong Phú mà trải nghiệm quá tệ. Xe trung chuyển cũng đợi cả tiếng mới có. Ko có lần sau với Phong Phú.,0,0,0,0,1,0
"Pepa Quán ăn hàn quốc tuy nhỏ nhưng mình thấy quán có menu phong phú, nhiều món ngon, với giá rất rẻ so với thị trường, mỳ cay ở quán không có cấp độ, mình không ăn được cay nên hay gọi cấp độ thấp nhất , nhưng vị cay của quán cũng không quá cay lắm nên các bạn nào như mình thì vẫn có thể ăn được , đặc biệt quán này có món lẩu mỳ cay giá rất rẻ giành cho 2 người ăn, lâu lâu cuối tuần tụ tập bạn bè đến đây ăn món hàn là tuyệt nhất rồi, , ^^",0,0,0,5,0,0
Nha hàng thoáng mát cực kỳ. Mấy bạn phục vụ dễ thương làm sao ! Món ăn thì super ngon . Vì Chỉ muốn chia sẽ cho các bạn nhưng viết ko hay mất thời gian đọc. Vậy các bạn đến đi rồi sẽ cảm nhân. Thôi mình uống nốt lon bia rồi ngủ đây.bii bi thân ái,0,0,5,5,0,0
"Nhà hàng sân vườn , view bao đẹp , thoáng mát , rất thích hợp cho khách đoàn hoặc khách lẻ , hải sản phong phú , dễ dàng lựa chọn những món ăn thích hợp cho khẩu vị từng người và vùng miền , nhân viên nhiệt tình và lễ phép ,",0,0,5,5,0,0
"Đủ loại đặc sản Quy Nhơn, Bình Định. Từ bánh tráng, cá mực khô đến bánh kẹo, hoa quả sấy...
",0,0,0,0,0,4
Thái độ nhân viên quá tệ,0,2,0,0,0,0
"Nhân viên rất nhiệt tình, là khách hàng khi thấy nhân viên như vậy quả thật cảm thấy rất được tôn trọng. Cảm ơn đội ngũ nhân viên rất nhiều.
",0,0,5,0,0,0
Phòng mình dầu gội và sữa tắm bị hết trước khi mình vào,0,3,0,0,0,0
ko quẹt thanh toán bằng thẻ tín dụng được,0,0,0,0,0,2
"Thái độ nhân viên phục vụ quá tệ, nhân viên tám chuyện, đùa giỡn to tiếng, quăng ly, đồ đạc ầm ầm, nghe như tát vào mặt.",0,0,0,2,0,0
"Sau khi di chuyển trong 18 giờ, thật nhẹ nhõm khi nhìn thấy tấm biển có tên của chúng tôi trên đó tại sân bay Hồ Chí Minh rất đông đúc. 
Sau khi tìm thấy nhau, tài xế của chúng tôi lên lấy xe và chúng tôi đi. Mọi thứ đều trả trước. Không có căng thẳng kết thúc một ngày dài.",0,0,0,0,0,0
"Khách sạn gần biển ở Quy Nhơn, vị trí đẹp phòng mình ở có view biển rất tiện cho việc sống ả",0,5,0,0,0,0
"Giá thấp và thức ăn ngon, ngay cả khi kích cỡ phần hơi nhỏ - điển hình cho Việt Nam tho. Các nhân viên ở đây rất YÊU THÍCH
 và cố gắng hết sức để giúp đỡ bất cứ điều gì họ có thể. Lần thứ hai chúng tôi đến đó, họ đã phải đối mặt với 2 nhóm khách hàng khủng khiếp (một gia đình có trẻ lớn ném vỏ bánh pizza và thức ăn thừa trên sàn nhà, và một người đàn ông Mỹ lớn tuổi khác đã cho họ một thời gian khó khăn để nói tiếng Anh tối thiểu - mặc dù anh ta không nói tiếng Việt nào!) Vì vậy, hãy tin tưởng họ vì đã xử lý một cách bình tĩnh như vậy. Một nơi tuyệt vời nếu bạn thèm đồ ăn phương Tây trong số những món ăn đường phố Quy Hưng.",4,0,0,4,0,0
"Chủ xe rất vui vẻ nè, mà vị trí thuê ngay bên xe quy nhơn,đi bộ là tới, sẽ rất tiện lợi cho ai đi xe ra qn.",0,0,0,0,4,0
"Quán nhỏ nhỏ, decor khá ổn, không có máy lạnh nên hơi nóng. Pizza khá ngon, có thể so sánh với các tiệm trong SG, hơn hẳn pizza hut, domino. Pasta ăn cũng ok, sốt béo, thơm. Khá là hài lòng với chất lượng món ăn ở đây.",0,0,0,4,0,0
"Đã sử dụng Indochina Charm Travel để đưa đón sân bay của tôi ở Hồ Chí Minh đến và đi từ sân bay. 
Dịch vụ tuyệt vời đã sẵn sàng khi tôi đến và rất nhanh chóng đưa tôi đến khách sạn và sân bay. Muốn giới thiệu",5,5,0,0,5,0
"Lại có dịp ghé tuyến đường Ngọc Hân Công Chúa để thoả sự thèm ốc của mình. Thấy foody review quán ốc Hảo Hảo ổn, nên mình ghé ăn thử. Thường thì mình thích ăn quán nào quen thôi, mà hôm nay thử ghé xem sao. Quán ốc này cô chủ quán khá nhiệt tình, đi ngang qua là kêu lại liền, để xe rồi có người dắt. Quán cũng có khá đầy đủ món, tới gọi món là bưng ra liền. Quán bỏ gia vị cho ốc khá đậm đà, mình thích như vậy, vì đậm đà của nước ốc ăn rồi húp cực thích. Nhưng món gỏi xoài của quán không thíh lắm, quán dùng xoài chính quá làm cho gỏi mình ăn bị sàu xuống, không thấy ngon.",0,0,0,3,0,0
"Mua cải bó sôi k có, nhiều loại rau để lên bảng nhưng k có",0,0,0,0,0,3
"Lần đầu tiên được lái môtô nước là ở đây nè, trong một ngày hè nắng chang chang, cảm giác phê lòi luôn. Làng chài khá vắng và yên bình (lúc này khách du lịch chưa biết đến nhiều). Hải sản thì tươi ngon cực kỳ, ai đến đây nhất định phải thử món bánh xèo mực nha, mực tươi giòn ngọt hết ý (tiếc là lúc đó ham ăn quá chưa chụp đc ảnh 😑)
",5,0,0,5,0,0
"Những bạn tiếp tân rất nhiệt tình tư vấn chỗ thuê xe và chỗ ăn uống, phòng ốc sạch sẽ, tiện lợi. Khách sạn ở đối diện biển và trung tâm nên rất tiện cho việc mua sắm và vui chơi. Rất đáng để thử, cám ơn Regalia !",5,5,0,0,0,0
"Nhân viên thân thiện, trung đẹp trai, phát dễ thương, thảo and nhân buong phòng master",0,4,0,0,0,0
"Siêu thị lớn nhất tỉnh này, có cả rạp chiếu phim và khu ẩm thực",4,0,0,4,0,5
"Thân thiện, nhiệt tình vui vẻ, phục vụ ko tiếp xúc rất ok rất tốt, cskh nhanh, view đẹp ",0,5,0,0,0,0
"Đường nhỏ, ko có chỗ đậu xe 16 chỗ",0,0,0,0,2,0
"Chúng tôi đến rất nhiều thời gian. Khoản phí khoảng 10 đô la, chúng tôi đã đưa ra một khoản tiền lớn khi xem xét các 
điều kiện và tài xế chỉ mất chưa đến 50 phút để đưa chúng tôi đến đó.",0,0,0,0,4,0
"Chợ tháp đôi là chợ nhỏ của phường đống đa nhưng các mặt hàng đầy đủ để mua rất thuận lợi
",0,0,0,0,0,4
Đông đúc và ồn ào. Thời gian chờ đợi để trả phòng lâu.,0,3,0,0,0,0
Các món ăn chính nó là ok nhưng không phải là rất ngon. Đó là trải nghiệm Đồ ăn tồi tệ nhất trong toàn bộ chuyến đi của chúng tôi (3 tuần rưỡi).,0,0,0,3,0,0
"Đồng thời trên booking.com, đây là phòng 4 sao, nhưng có vẻ 4 sao này là tiêu chí đánh giá của booking, chưa phản ánh đúng tiện nghi và dịch vụ của khách sạn này. Mình đi du lịch khá nhiều, và với mình khách sạn này chỉ tầm 2 sao.",5,0,0,0,0,0
Cho thuê đang cho sv giá 50k khi tới thue lấy xe thì lấy 120k. Hoảng. Xe chạy thì phải đạp mới nổ. Hết chỗ nói luôn. Từ nay không chơi anh trưởng.,0,0,0,0,2,0
"Tôi rất thất vọng về thái độ phục vụ của tài xế của cả 2 chuyến xe trưa nay. 
Tôi đã dự định sẽ thanh toán chi phí nhiều hơn đồng hồ báo vì tôi đi quãng đường ngắn và vì hôm nay là Tết Dương Lịch, 
nhưng khi đến nơi thì tôi thay đổi suy nghĩ của mình vì không việc gì tôi phải trả nhiều hơn cho 1 dịch vụ mà tôi không hài lòng.",0,0,0,0,1,0
"Đúng là chất :))), với cái tên để mang lại thương hiệu. Quán này view dễ thương lắm nè, sống ảo đẹp cực ảo luôn, với không gian nhẹ nhàng không quá màu mè. Về nước ở đây thì có 1 số đứa bạn bị fan nước ở đây, mình cũng thấy vậy, nước ở đây khá là ngon. Chắc dắt người yêu đi quán này miết quá trời ạ. Giá cả ở đây mình thấy cũng bình thường chứ không quá mắc, phù hợp cho sinh viên học sinh. Mình có thể mua ở đây để mang đi được nhé. Chúc quán thành công.",0,0,0,5,0,0
"Chợ đông đúc,hải sản tươi sống.Hiện tại khi ra vào chợ phải khai báo,sát khuẩn và kiểm tra thân nhiệt.
",0,0,0,0,0,5
"2 anh chị lễ tân vui vẻ, nhiệt tình. Hai anh chị thấy mình đi một mình nên rủ vào ăn uống chung nói chuyện rất vui. Nếu được mình sẽ trở lại một lần nữa.",0,5,0,0,0,0
"Quán này mở lâu lắm òi. Mình đã được mẹ dẫn đi ăn từ những ngày còn nhỏ xíu. Nhưng mà bây giờ chất lượng ko còn như trc. Nước ít đậm đà hơn, loãng quá nhiều. Ít đậu và sườn cũng ko to như trước :))). 30k/suất. Nói chung dở hơn hồi nhỏ mình ăn.",0,0,0,3,0,0
"Tự check in - check out rất tiện lợi, thoải mái như ở nhà, hỗ trợ online nhanh chóng nên không khó khăn, bãi giữ xe máy rộng rãi, địa điểm dễ tìm, khá gần trung tâm",0,4,0,0,0,0
"phòng sạch sẽ, ks tiện nghi, gần biển.",0,4,0,0,0,0
"Tôi không khuyên bạn nên đi bằng thuyền, nhưng tôi tình cờ đi bằng thuyền, vì vậy tôi đã lên. Đường đến bãi biển khó quá ... vẫn đáng để bạn ghé thăm",0,0,0,0,3,0
"Rượu rất là ngon và đậm đà. Nhất định sẽ ủng hộ lâu dài
",0,0,0,5,0,0
"Trong khu này không thiếu các quán dessert kiểu như thế này, bọn mình chọn quán này là bởi vì được nhắc từ trước. Kêu quán này đồ ăn tráng miệng ngon, đặc biệt bát bingsu vừa nhiều vừa ngon 30k. Ấy vậy mà đặt mông xuống ngồi vô quán thì quán kêu hết bingsu 😩 tiếc quá nên chuyển sang mấy thứ khác. Đồ ăn vặt kiểu chè các thứ vô cùng đa dạng phong phú. Mình thì chọn mì trái cây kem lạnh 20k 1 bát. Bát to, nhiều loại trái cây ở trong, thạch sợi giống mì, ăn bằng đũa cũng được á :)) rất ngon luôn, ngoài mong đợi với số tiền 20k :)) rất ưng, chờ đồ hơi lâu chút thôi.",0,0,0,4,0,0
"Shop này làm ăn mất dạy lắm nha mọi người nên né ra mua hàng kiêu Ck trước xong rồi hàng lỗi thì chế độ đổi trả ko có
",0,0,0,0,0,1
"Nhà hàng này đã giảm giá mỗi khi tôi đến đây. 5 năm trước thức ăn ở mức trung bình. Lần này đồ ăn quá cơ bản và dưới mức trung bình, thịt dai và không ăn được, khẩu phần ăn nhỏ và giá quá cao. Hơn hết, dịch vụ chăm sóc khách hàng thật tồi tệ, nhân viên không ngoan, suốt ngày mơ mộng và không nhiệt tình giúp đỡ, hoặc nhận đơn đặt hàng mặc dù ở đây không có nhiều khách hàng. Chúng tôi đã yêu cầu thêm bánh phồng tôm vì Chúa và họ không thể làm được! Nhà vệ sinh thật kinh tởm. Nền móng của nơi này từng là một nơi đáng yêu nhưng thật kinh khủng khi đi và chỉ có danh tiếng cũ của nó mà nó không thể theo kịp.",0,0,1,1,0,0
"Giá cả, dịch vụ chất lượng rất hài lòng. Tuy khách có hơi trong hẻm chút nhưng đáp ứng đi bãi đỗ ô to tại chỗ nên cũng rất ok.",0,4,0,0,0,0
"Người lái xe thân thiện và chiếc xe buýt nhỏ mà chúng tôi lái rất đẹp, sạch sẽ, AC chắc chắn và WiFi như một phần thưởng bổ sung.",5,0,0,0,5,0
"Chỗ này rất sáng sủa, thoáng mát, sạch sẽ, máy lạnh mát rượi, nhiều quán ăn ngon,",4,0,0,0,0,0
"Nhân viên nhiệt tình, phòng view hướng biển nhìn thoải mái, gần biển và trung tâm tp nên di chuyển tiện.",0,5,0,0,0,0
"Vâng, tôi không phải là một người hút thuốc. Đôi khi tôi hút thuốc khi có bạn bè đi cùng. Chủ nhà hàng này bị sao vậy? Đây là thái độ phục vụ không thể chấp nhận được.",1,0,0,0,0,0
"Quán bình dân. Menu có 3 loại bánh xèo với tôm, mực, bò. Bánh xèo tôm là ngon nhất, bò có xả ăn ổn, mực bị mặn quá. Bánh xèo chiên giòn rụm. Nước chấm đậu phộng hơi lạ vị. Bánh nhiều dầu
Chỗ ngồi rộng rãi, hơi nóng.
Cô chủ quán thân thiện, phục vụ nhanh",0,0,0,4,0,0
"Các bạn du lịch từ Hà Nội vào Quy Nhơn như mình nên đến chợ Khu 2.mua đồ hải sản có rất nhiều và tươi vào buổi chiều nhé.tuy là 1 chợ dân sinh nhưng hải sản có tương đối nhiều và quan trọng nhất là giá cả hợp lý.không bị ""chặt chém"" vì là khách du lịch",0,0,0,0,0,5
