Review,giai_tri,luu_tru,nha_hang,an_uong,di_chuyen,mua_sam
"Ngày 1: Thuê xe máy của anh hoài Bảo Đi quanh tp và ra Sunfbar 2h có mặt tại sbay Quy Nhơn bắt xe về ksan 30p. Và pn mk nhận phòng lúc 2h30. Nằm nghỉ 1 lúc rồi đi lượn ăn ltinh quanh thành phố - Sunfbar : Nên đi vào buổi chiều tầm 5-6h vì 6h30 bắt đầu nên đèn trời vẫn còn sáng nên chụp hình sẽ rất đẹp. Ngoaig ra lúc đó ngoài biển cũng đông ng tắm nên rất nhộn nhịp Ngày 2: Kì Co - Eo Gió - Trung lương 7h sáng cmk bắt đầu lên đường. Chỗ này cách thành phố tầm 25-30km. - Kì Co mk mua theo tour 350k/1ng . Bao gồm: Cano đi 2 chiều ,Tắm biển , Lặn ngắm san hô. Khi về nhà hàng dc ăn hải sản 7 món . Về ăn uống nghỉ ngơi thoải mái rồi ra Eo gió - Eo Gió là eo biển lớn và đẹp nhất Việt Nam. Chụp ảnh sống ảo ở đây thỳ miễn chê luôn ạ. Vé vào 25k thôi nhé Vì vẫn còn sớm nên pn mk đi sag Khu dã ngoại Trung Lương - Khu dã ngoại này k quá rộng. Phía dưới có quán Cafe sát biển tone màu xah trắng cực xih vs những chiếc lều vintage. Từ trên quán cf nhìn xuống nc biển xah ngắt mà tiếc k mag đồ tắm xuống Ngày 3: Phú Yên Từ QN sang PY cách nhau khoảng 100km nhưng vì nghe nói cảh 2 bên đường khá đẹp nên cmk đã chọn đi bằng xe máy. Nghĩ lại mà thấy 2 đứa khoẻ thật 🤣 Cban có thể bắt xe buyt hoặc taxi nhé =))) - Bãi Xép - Phim trường “Hoa vàng cỏ xanh” vé vào cổng 20k . Ở đây đẹp như thiên đường luôn. Đứng từ trên nhìn xuống đẹp dã man luôn. Thyk nhất biển chỗ này luôn. - Gành đá đĩa : mãi hơn 3h cmk mới sag đây. Vé vào cổng 20k tiện đương đi về tp QN luôn Ngày 4: Hòn Khô - Tháp đôi - Gềnh Ráng - Hòn khô: Đi cano ra 100k ở đây có mỗi c cầu. Gần giống như Kì Co ( không nên đi vì ở đây nta đag thi côngnên bị cấm r ạ và cũng k dc đẹp như ở kì co) - Tháp đôi vé vào 20k - Ghềnh ráng mk cũng chỉ ra bãi đá trứng chụp ảnh rồi về Ngày 5: Lượn quanh tp đi mua quà và ra sunfbar Ở trong này rất nhiều quán cafe đẹp nên tối nào ăn uống xog cmk cũng đi cafe Tính ra mỗi người hết tầm 7tr5-8tr =)))",4,0,0,4,0,0
"Nói, sin chow (xin chào), khi bạn vào và nói, hãy tiếp tục (cảm ơn bạn), khi bạn đã hoàn thành. 
Xe taxi thường chỉ có một vài đô la vì vậy làm tròn số dễ dàng và chỉ tốn của bạn khoảng 26 xu nhiều hơn.",0,0,0,0,3,0
Ngắm bình minh tuyệt vời.,5,0,0,0,0,0
"Mình ko thích pizza lắm, lớp vỏ bánh quá dày Tuy nhiên, với giá cả này thì chất lượng vậy là ổn Phục vụ lâu, chờ hơn nửa tiếng mới ra món😔😔😔 Ko gian quán hẹp",0,0,0,2,0,0
"Thị trường Mẹ và Bé Quy Nhơn về mặt chung shop này bán giá cả rẻ hơn các shop khác, tư vấn tận tâm, duyệt.
",0,0,0,0,0,5
"Âm thanh hay ấm cúng, cuộc vui luôn được tiếp diễn không đứt quảng. Phục vụ nhiệt tình chỉ cần gọi là có. Năm sao
",5,0,0,0,0,0
"Chú cho Thuê xe nhiệt tình, giao xe ngay sân bay rất tiện đi lại và trả xe không phải tốn tiền taxi lên xuống tp Quy Nhơn.
",0,0,0,0,4,0
"Quán ốc vỉa hè cô xí nhưng đầy chất lượng , ăn ở đây đúng đáng đồng tiền , đồ ăn cực ngon, mới đi ăn nãy giờ nghĩ lại lại thèm , quán với đủ các loại ốc các loại , ghẹ cua , có cả cháo và trộn , giá cả lại phải chăng, không đắt lắm nên các bạn có dịp nên ghé ăn thử , không gian cũng khá sạch sẽ , ăn xong có nước rửa tay , cháo mọi bữa mình ăn thấy ngon lắm nhưng hôm nay thấy vị không được như ngày xưa mình ăn nữa, không biết là sao, nhưng dù sao đồ ăn ở đây vẫn rất ngon,",0,0,0,4,0,0
"Hơi tệ, nhân viên nhiệt tình nhưng có lần ko biết giá nước, phim gắn 16+ thì tại sao lại có những đứa u10 vào ồn ào, mất trật tự.",2,0,0,0,0,0
"Đa phần mình hay vào đây xem phim & ăn uống, giá rất ok, ko quá mắc lại rất sang & đẳng cấp 👍",2,0,0,0,0,0
"Đúng nghĩa với cái tên của quán, kem ý! Phong cách làm việc phong cách của quán và thức ăn rất tây và ngon ạ. Quán có kem bánh nước, rất ngon đúng với đồng tiền mình bỏ ra.view đẹp sang trọng không gian ko chật ko rộng nhưng ấm cúng. Với tầm giá tiền đó thì rất hợp lý cho các bạn sinh viên hay gia đình nhé. Đã ăn là muốn ăn nữa :))) mình đã thưởng thức và sẽ đến để tiếp tục thưởng thức thêm nhưng món ngon tiếp theo. Very good.",0,0,0,5,0,0
"Đồ ăn khá ngon, thực đơn phong phú, cách phục vụ khá chuyên nghiệp.",0,0,0,5,0,0
Nước hồ bơi cảm giác không sạch lắm.,2,0,0,0,0,0
"Là một quán nhậu, với cách nấu và bài trí bình thường, tôi đã làm birtbday cho con gái ở đây, được nhà hàng trang trí và có 2 chú gấu đón tiệc rất dễ thương, tôi thích nhất món cá chình nướng muối ớt của nhà hàng",0,0,3,4,0,0
"Tụi mình rất hài lòng về chuyến xe này. Có trung chuyển từ khách sạn ra bến xe. Tiện ích trên xe thì ok, chỗ nằm dài thoải mái, lại còn mỗi khách được một hộp sữa uống lót dạ nữa, trước khi xuống xe còn được phát khăn lạnh để lau mặt cho mát mẻ tỉnh táo sau chuyến đi dài. Lại còn bật bài hát riêng của xe nữa. Nói chung là hài lòng lắm.",0,0,0,0,5,0
Có  ship  hàng hóa  thì  nhớ  thứ  ngày  đi nói  đợi  4 tiếng  là  có  hàng về  cho anh chị  mà  chờ  hoài  ko có  đành phải lên chở  về  mất  uy tín quá,0,0,0,0,0,2
"Quán gần biển nên ngồi ngoài trời thoáng mát hơn. Giá quá tốt, cá mú đen 500k/kg. Tôm sú biển 20 con/kg 620k/kg. 10nguoi ăn hết 3tr no căng bụng. Có xe đưa đón miễn phí, gọi trước 10p - +84 90 287 10 80.",0,0,0,5,5,0
"Xe thuê 100k/ngày. Xe mới, không phát sinh phí. Ông chủ nhiệt tình. Like.",0,0,0,0,4,0
Thức ăn không tươi + không ngon + phục vụ siêu chậm như không muốn tiếp khách. Never come back và cũng ko giới thiệu bạn bè,0,0,1,1,0,0
"Ông chủ nhiệt tình, xe đi rất tốt, giá cả bình dân... Lần sau mk có quay lại Quy Nhơn sẽ quay lại đây thuê xe.",0,0,0,0,4,0
"Giá cả chuẩn, phục vụ nhiệt tình, nhiều đặc sản địa phương, nên mua tại đây vì được nhiều cô chú địa phương giới thiệu.
",0,0,0,0,0,5
"Mình đi 4 người gọi phần 4 người thì quán mang ra 1 phần như ảnh. Tất nhiên dĩa rau như vậy sẽ khôg bao giờ đủ cho 4 người. Mình ăn hết rau và xin thêm dĩa nữa, lúc sau tiếp tục xin thêm 1 dĩa rau và bánh tráng cuốn. Sẽ không có chuyện gì nếu như lúc tính tiền quán bảo xin 2 lần rau và 1 lần bánh tráng nên tính thêm tiền 10k 😅😅😅😅😅. Nói chung 10k cũng ko là vấn đề nhưng vấn đề ở đây là ở Quy Nhơn ăn thêm rau cũng tính tiền hả mng ơi ?? Điều này ko hề xảy ra ở địa phương mình (Đà Nẵng) nên đây là một sự bỡ ngỡ ko hề nhẹ :)))) mng đi du lịch ăn quán này nhớ hỏi trước khi ăn nhé ạ !!",0,0,0,2,0,0
"Phòng gần thang máy, cách âm không tốt nên thang máy chạy là nghe tiếng.",0,3,0,0,0,0
"Gần trung tâm nhưng phòng có ban công, lan can ra ngoài ngắm xung quanh rất đẹp",0,5,0,0,0,0
"Sân bay Quy Nhơn không dùng vào mục đích như tên gọi từ khoảng năm 1995-2000 trở đi rồi, thời đó mình chưa tới 10 tuổi, giữa Lê Duẩn và Diên Hồng là các bãi đất trống, vị trí đậu máy bay trực thăng ở ngay Ngân hàng VIetcombank bây giờ, mỗi lần có máy bay đáp là mấy đứa nhỏ từ khắp xóm xung quanh, từ các con hẻm chạy ùa ra để xem, cánh quạt máy bay trực thăng gần đụng vào vị trí đứng xem của lũ nhóc bọn mình. Quy Nhơn ngày ấy đất rộng, bình yên, không bao giờ gọi là TP du lịch như bây giờ. Sau năm 2000 thì bắt đầu quy hoạch xây dựng ngân hàng ở khu này, mình đá banh từ năm 2000 đến năm 2008 đến lúc học ĐH thì bãi đất ở Vietcombank là bãi đất cuối cùng còn xót lại đã được xây lên, riêng vị trí công viên bãi cỏ cột cờ như bây giờ từ khi không dùng làm sân bay thì nổi lên là điểm thả diều vào dịp hè, thời gian gần đây tỉnh nhà phát triển du lịch, ốp đá, tạo không gian đi bộ văn minh và sạch đẹp, tuy nhiên vẫn còn nhiều người không ý thức vứt rác bừa bãi, chỉ có đi tuần tra, bắt xử phạt mới nâng cao ý thức được thôi, còn cứ bỏ đó thì vẫn cứ xả bừa bãi.",3,0,0,0,0,0
Nhân viên làm thủ tục nhận phòng muốn thu thêm tiền trẻ em 12 tuổi. Trong khi trên boking đã ghi rõ số lượng người lưu trú và tuổi các cháu.,0,1,0,0,0,0
"Đi tháng 10 biển động mạnh không qua hòn khô được, biển dân sinh tự khai thác đường khá xấu và cực kỳ nhiều rác
",2,0,0,0,0,0
Điều mình hơi tiếc là nhìn từ ngoài quán hơi nhỏ nhưng được cái vào rồi mới thấy quán còn kéo dài ra sau nữa. Chị chủ quán ở đây zễ thương mà mến khách cực luôn <3. Có dịp chắc chắn mình sẽ ghé lại quán nữa nhé quá tuyệt <3!,0,0,0,5,0,0
Nếu có 10*+ thì mình cũng rate luôn á và giá phòng ở đây khá rẻ các b đi theo nhóm hay gia đình cũng đều được vì có nhiều phòng rộng nữa. Nếu b nào đi honey moon thì khách sạn cũng decor phòng honey moon nữa nè.,0,5,0,0,0,0
"Phòng có view nhìn ra biển đẹp, Trang trí nhìn hài hòa, cân đối",0,5,0,0,0,0
"Hỗ trợ nhận phòng không tiếp xúc rất hay, các bạn hỗ trợ nhiệt tình qua zalo, xe máy mới. Vị trí thuận tiện đi lại.",0,4,0,0,0,0
Quán phục vụ nhanh và thân thiện. Dễ tìm và rộng rãi. Đồ ăn ngon và giá cả phải chăng. Sẽ quay lại 👌,0,0,4,4,0,0
"Phòng sạch sẽ, cơ sở vật chất tốt.",0,4,0,0,0,0
Ks 4* ăn sáng quá nghèo làn. Ở 3 ngày mà cả 3 ngày cũng chỉ có vài món giống y nhau ko khác. Cửa ko cách âm. Nói chuyện ở hành lang là trong phòng nghe hết.,0,1,0,1,0,0
"Mình là khách hàng thân thiện lẫn thân thuộc ở đây :))) nói chung mình hài lòng về Lotteria. Sẽ ủng hộ dài dài. Mong mấy bạn cũng đến ủng hộ và ăn thử cho biết nhé. Gà ở đây rất ngon, giá hơi cao một tí so với mấy quán khác nhưng đáng tiền lắm ạ ! Gà không bị bở cũng không giống gà kfc hay jolibe nha. Tuyệt ! 👍 .",0,0,0,5,0,0
Giá bình thường như mọi quán. Thức ăn hơi thừa muối.,0,0,0,2,0,0
"Khu resort này gần xịt khu dã ngoại Trung Lương luôn. Nói chung là vô cùng sang chảnh đẳng cấp. Tiền nào của nấy, phòng ở siêu đẹp, đồ ăn thì khỏi bàn. Đẹp mắt mà ngon nữa, ăn cứ phải nhỏ nhẹ thỏ thẻ cho hợp với cái không khí hic hic. Nghe bảo noel này có tổ chức party hoành tráng lắm. Muốn đi thì nên book trước từ bây giờ k là cháy phòng",0,5,0,0,0,0
"Quà của shop rất đẹp , gói quà đẹp , nhân viên tư vấn nhiệt tình  giao hàng nhanh . Sẽ ủng hộ shop lâu dài.
",0,0,0,0,0,5
"Ban đầu định thuê oto nhưng hỏi ra thấy chi phí cao mà trong nhóm lại có mấy bạn bị say xe không đi được nên nhóm quyết định chuyển qua thuê xe máy. Hỏi bên khách sạn thì khách sạn giới thiệu gọi cho dịch vụ cho thuê xe máy quy nhơn 27a Hoàng Hoa Thám. Mình nghe nói đây là địa điểm cho thuê xe máy số 1 ở đây, lúc đầu cũng hơi ngờ vực nhưng khi bạn chủ cho người mang xe đến thì nhóm mình quá ư à hài lòng luôn.
",0,0,0,0,5,0
"Quán chỉ bán buổi sáng, gần đường vào chợ đầm. Giá cả hợp lí nên lúc nào khách cũng đông nghìn nghịt. Một suất ăn bao gồm một dĩa bánh hỏi rắc hẹ xinh xinh, phía trên phủ đầy lòng heo còn nóng hôi hổi, thêm chút hạt tiêu thơm nồng. Bên cạnh là dĩa rau sống tươi ngon, một chén cháo, bánh tráng và nước mắm ớt tỏi hoặc nước mắm nhĩ nguyên chất. Bánh hỏi sợi mềm, lòng được làm sach sẽ, vừa ngon vừa giòn. Dĩa đầy đặn. nhiều loại tuy nhiên nước mắm pha hơi đậm. Nhân viên phục vụ nhanh nhẹn. thân thiện",0,0,0,5,0,0
Chả giò không ngon và khá nhiều dầu mỡ. Phở rất ngon và đồ uống rẻ.,0,0,0,3,0,0
"Mình có người quen giới thiệu,ăn nhưng khi đến đây mình quá thất vọng,NV xem thường khách,đồ ăn thì toàn leo teo ko ra ra gì hết,toàn đồ đông lạnh,mà giá bán quá cao,so với những nhà hàng khu đó.thất vọng",0,0,0,1,0,0
"Quán chuyên bán các loại hản sản như ốc các loại, sò , nghêu, xìa, vẹm xanh, hàu, tôm, ghẹ hấp, nướng. Ngoài ra còn có bán cả trứng tan, nem nướng, chả ram, kem plan, rượu nếp, bia rượu và nước giải khát các loại. Không gian hơi nhỏ và khá ít bàn ghế , nhìn sơ qua không mấy ưng ý cho lắm . Giá cả ở đây nói chung là cao hơn so với mặt bằng chung. Giá tầm 15k- 30k, một số món theo thời giá. Ốc trộn không ngon cho lắm . Càng cúm núm 40k một phần ngon nhưng hơi ít .",0,0,0,3,0,0
"Mình biết quán phải đầu tư cho mặt bằng lắm. Nhưng điều đó không đồng nghĩa là nước uống bị giảm chất lượng lại. Một ly khá nhỏ ít nhất cũng 27k mà nó bình thường quá, trà hoa hồng thì cũng không quá ngon để tới 45k 1 ly lận. Giá hơi chát. Nhưng phải công nhận là quán có không gian rộng rãi,thoải mái và dễ thương có sự đầu tư và trang trí. Trà sữa uống vào cũng đậm vị trà mà hình như hơi nhạt. Được cái mấy em nhân viên dễ thương và lễ phép cực kỳ.",0,0,0,4,0,0
"Chả hiểu cái mạng tại BigC sao mà quẹt PC covid k thèm ra mã luôn, mọi thứ còn lại khi đi siêu thị tạm ổn, ah, mình muốn mua lẻ chuối thì k bán lẻ như coopmart (1 nải nhiều quá mình ăn k hết lại hư uổng)
",0,0,0,0,0,3
"50k vé vào cổng và .... chỉ có tham quan. Khu vực rất rộng và rỗng, không có quá nhiều hoạt động vui chơi hay thăm thú, ít trò chơi, ít khu ngắm cảnh, ít chỗ chụp hình. Vé chơi trò chơi cũng khá mắc.
Cảm nhận chung nếu đi teambuiding mua vé trọn gói trò chơi thì chắc sẽ đỡ chán hơn. Còn tham quan, ngắm cảnh, mong chờ giống Đầm Sen hay Suối Tiên thì ... thôiiii.",4,0,0,0,0,0
"Hải sản tươi ngon, giá cả theo mình đối với khu du lịch thì cũng vừa phải. Bạn nhân viên nữ phục vụ hơi thiếu chuyên nghiệp.",0,0,0,4,0,0
"Quán đặt tại vị trí lý tưởng, vừa nhâm nhi ly cafe vừa ngắm biển, quán không quá đông đúc ồn ào, mọi người nên đến đây vào lúc chiều tà, 
để đón ánh hoàng hôn. Mình đã đến Quy Nhơn 2 lần và lần nào cũng ghé nơi đây đầu tiên, giá cả menu nước rất phải chăng!!",5,0,0,5,0,0
"Mình đi vào buổi tối. Vị trí khá dễ tìm. Quán cũng khá vắng vẻ nhưng nhìn rất sạch sẽ và chủ quán cũng thoải mái. Mình gọi 2 nem cuốn, 1 bún khô và 1 mẹt bánh hỏi. Giá thì ko cao nhưng cũng ko phải là rẻ. . . Nhìn chung thì 3 món ko có gì khác nhau về nguyên liệu, giống như 1 món ăn với bánh tráng, 1 món ăn với bánh hỏi còn 1 món ăn với bún vậy nên khuyến khích các bạn nếu có ăn 3 món này thì gọi 1 trong 3 là được. Tuy nhiên vị thì rất ngon nha, nguyên liệu nhìn cũng có vẻ tươi ngon, nói chung là cảm giác rất ổn, món bún nếu đậm đà hơn 1 chút nữa thì món ăn phải gọi là 10/10. À, nem cuối hơi dai chút xíu nên nhai cũng hơi mỏi.
",0,0,0,5,0,0
"Có món mì cay ngon nhắm nè, trà trái cây thì hết sẩy , mình thik ngồi tầng trên để nhìn phố và uống nước , hôm mình đi có cặp vc chụp ảnh cưới, xinh lăm , nếu có cơ hội nhất định tới",0,0,0,5,0,0
"Quán này nằm ngay góc đường vũ bảo vs cuối đường nguyễn lữ, không gian quán nhỏ và hơi bị chật hẹp nên về mùa hè thì ăn đồ nướng rất nóng nhé. nay quán có mở thêm không gian đối diện thấy hay tổ chức tiệc sinh nhật, tiệc tùng. Quán khá đa dạng về món ăn nướng, nếu chịu nóng để vào ăn quán ngon và giả cả rẻ như thế cũng đáng :))). Quán bắt đầu mở từ 6h tối và đóng cửa cũng khá muộn nên vô tư ăn uống <3 :). Ở đây nướng ngói nên thức ăn không bị cháy yên tâm ăn nhé. quán rất ok",0,0,0,5,0,0
"dịch vụ rất tốt, nhân viên lịch sự. Giá rẻ, 300k cho 90p massage hoặc facial. Dịch vụ xong còn có một hủ sữa chua homemade rất ngon.",5,0,0,5,0,0
"Không có nhà hàng riêng, không có minibar, không phục vụ đồ ăn đồ uống, có hồ bơi trên tầng cao nhất.",0,4,0,0,0,0
"Nghỉ ở khách sạn thì buổi sáng mỗi người được 1 phần buffet sáng ở tầng trệt.
Không gian rộng rãi, thức ăn bày trí thoáng, cặp sát tường và uốn vòng giữa sảnh nên dễ lựa chọn. Xem ra tương đối nhiều món, các món thiên về ẩm thực Việt nhiều, có cả bánh chưng, cháo cá - chà bông,  cơm tấm...
Thường thì buffet sáng chế biến các món ăn đơn giản nên k để lại ấn tượng j với mình.
Nhân viên dọn dẹp lẹ quá, hễ đi lấy đồ ăn xíu quay lại là muỗng nĩa dẹp hết trơn.",0,4,0,4,0,0
Chúng tôi đến thăm quán rượu Sisters và có bữa ăn kiểu phương Tây đầu tiên trong một tuần. Chúng tôi đã có bánh pizza và tôi phải nói rằng nó là rất tốt xem xét chúng tôi đang ở đâu. Nó được điều hành bởi một anh chàng Úc và vợ Việt Nam của mình và họ có một thực đơn thức ăn và đồ uống phong phú cho phù hợp với khẩu vị của bất kỳ ai.,0,0,0,5,0,0
"Resort tự dán mác 5 sao, giá thì 5 sao nhưng chất lượng chỉ đáng 3 sao, phần xây dựng, tiện tích chỉ 2 sao.
Phần xây dựng xuống cấp, trần hành lang bong tróc từng miếng, nước chảy thấm thành vệt hở hoác, tường lem nhem lồi lõm rất xấu, sơn bạc màu hết k thây sửa chữa, cửa phòng cả cửa chính và cửa trong phòng mốc ố đen bẩn, cửa ra lô gia kéo gãy tay mới được, phòng wc thì ổ cắm chỉ dành cho dao cạo râu, k sấy tóc được, sàn dùng nhựa đi chân đất cảm giác rất bẩn, thiết kế nội thất k sang trọng. Hành lang nối từ lễ tân sang khu nhà hàng bị cắt điều hòa đi nóng khó chịu.
Buffet sáng thì siêu tệ, đồ ít, ở 5 ngày thì 90% món là giống nhau, chỉ ngày đầu + cuối có đổi 1 món. Resort biển nhưng chỉ có 1 ngày đầu có 1 món cá là đồ biển, còn lại toàn đồ ăn nhanh như ở thành phố.
Bể bơi tiếp tục là điểm trừ, nước đục nhờ nhờ chắc phải 1 tháng chưa thay nước, phòng wc giữa bể bơi nhìn bên ngoài bẩn thỉu k được dọn dẹp, cửa dán decal lung tung, đèn k có, chỉ dẫn k có nên cũng k dám vào bên trong.
Ở quá xa Quy Nhơn nên nếu đi lại tpho chơi thì hơi tốn tiền taxi.
Biển nằm cạnh làng chài nên k sạch lắm, đi tắm vớt dc 1 đống vỏ gói mì tôm.",1,1,0,1,0,0
"Vợ chồng tôi vừa thuê xe 5 ngày ở đây. Xe rất mới, sạch sẽ, các bạn giao xe rất ân cần và nhiệt tình. Giá cả phải chăng, lần sau nếu có trở lại Quy Nhơn nhất định tôi cũng sẽ gọi các bạn để thuê xe máy",0,0,0,0,4,0
Giá rẻ và chất lượng hơn hẳn một số khách sạn khác. Vị trí nằm gần biển! Highly recommend,0,5,0,0,0,0
"Mình với bạn mình đã có chuyến du lịch tại Nha Trang và Apus là nơi đầu tiên mình lựa chọn ở lại. Là du khách lần đầu trải nghiệm tại đây nhưng nhưng nhân viên luôn luôn hỗ trợ mình rất nhiều, giới thiệu nhiều địa điểm đẹp. Không có lí do gì mình không quay trở lại Apus Hotel trong thời gian sau.",0,1,0,0,0,0
"Mình mới tới Quy Nhơn lần đầu, được anh hướng dẫn viên giới thiệu quán cafe này. Quán nằm đối diện quảng trường, bên bờ biển, không gian rất rộng với 2 không gian riêng biệt, ngoài trời và phòng máy lạnh, mình đi buổi tối nên ngồi ngoài trời, mát lạnh luôn. Buổi tối đèn lung linh nhìn không gian lãng mạng, tối chủ nhật nên có hát aucostic nữa. Nhân viên quán khá nhanh nhẹn và thân thiện. Mình uống sữa chua việt quốc, 45k, giá khá hợp lí, vị vừa miệng.",0,0,0,5,0,0
"Team mình vừa thuê bên bạn 3 chiếc xe, xe các bạn giao đến còn khá mới, xe tốt và mình thích nhất là cách tư vấn của a chủ, a ấy rất nhiệt tình vui vẻ hướng dẫn cho team mình rất nhiều điểm chơi và ăn uống khá rẻ tại Đà Nẵng. Qua đây team mình cảm ơn a ấy rất nhiều.",0,0,0,0,5,0
"Quán xinh, kiểu vintage. Không gian yên tĩnh. Thích chi nhánh ở NLB hơn HD vì ấm cúng, ko bị loãng. Nước uống ngon. Nhân viên vui vẻ lịch sự. Wifi ổn. Chỉ có 1 điểm là chả hiểu sao lúc đang ngồi tầm 10h khách chưa về mà thấy tắt máy lạnh, nóng nên về luôn :|",0,0,0,4,0,0
Vừa bị lừa từ một chiếc taxi đã đổi 500000 của tôi thành 20000 đừng nhảy lên một chiếc taxi từ phố vui. Tổng cướp. Một chiếc taxi 2 chỉ tốn 22,1,0,0,0,1,0
Chắc chắn mình sẽ quay trở lại vào dịp ghé đến Nha Trang lần tới.,0,0,0,0,0,0
Các nhân viên là rất thân thiện và nói tiếng Anh tốt (một cái gì đó bạn không nhìn thấy trong lĩnh vực này) và chủ sở hữu thực sự hữu ích nếu bạn có bất kỳ câu hỏi nào. Đặt hàng Pizza Diavola và ức gà giòn! Hứa với bạn một bữa ăn rất ngon.,0,0,0,5,0,0
"Âm thanh quá dỡ, nhân viên phục vụ không chuyên nghiệp
",2,0,0,0,0,0
"Rẻ hơn mỗi món so với các cửa hàng ở góc phố của bạn, bia có giá khoảng 8k một lon. ",0,0,0,4,0,0
"Khách sạn đẹp, nhân viên phục vụ rất nhiệt tình, tận tâm.
Ks có view vịnh biển Tp Quy Nhon tuyet voi. Thích hợp nghĩ dưỡng, công tác, đánh golf.
Ngay trung tâm tp Quy Nhon nên di chuyển vào trung tâm rất tiện",0,5,0,0,0,0
"Vị trí quá đẹp, gần biển, gần quảng trường. Chất lượng khách sạn kém, nhà vệ sinh, máy lạnh có vấn đề. Có cảm giác như nhà trọ.",0,3,0,0,0,0
Nay mới có dịp viết review cho các bạn hôm mình đã thuê xe máy của bác Hoài Bão ở đường Hoàng Hoa Thám công nhận dịch vụ của bác rất tốt. Nhân viên tư vấn rất nhiệt tình chỉ cho mình những địa điểm ăn uống ngon và những địa điểm du lịch đi chơi rất uy tín và chất lượng mình sẽ giới thiệu cho bạn bè khi có dịp.,0,0,0,0,5,0
"Nhân viên nhiệt tình, bể bơi view biển đẹp, phòng sạch sẽ",0,4,0,0,0,0
"Rất tốt !!!! Xe ngon, rẻ, chủ vs nhân viên rất nhiệt tình.",0,0,0,0,5,0
"Hàng hoá đa dạng , giá cả hợp lý , nhân viên tư vấn rất nhiệt tình và đặc biệt dịch vụ Vinmart có dịch vụ đi chợ hộ rất tiện cho khách hàng trong mùa dịch này luôn 🙂",0,0,0,0,0,5
đáng tin cậy và được đề nghị bởi hầu hết các hướng dẫn khách sạn tại Sài Gòn. đã sử dụng dịch vụ và dễ dàng chỉ đạo và tìm kiếm sự trợ giúp,0,0,0,0,4,0
"Nhân viên lịch sự mà khi xuống xe để đi trung chuyển trong nội thành thì xe trung chuyển bắt khách chờ 30’ (ai vội thì tự bắt xe khác đi?)
",0,0,0,0,2,0
