Review,giai_tri,luu_tru,nha_hang,an_uong,di_chuyen,mua_sam
Giรก ฤแบฏt hฦกn so vแปi chแบฅt lฦฐแปฃng sแบฃn phแบฉm! Vแปi tแบงm giรก ฤรณ cรณ thแป mua ฤฦฐแปฃc 1 cรกi รกo cรณ ฤฦฐแปng may tแปt hฦกn.,0,0,0,0,0,0
Sรกng nay mรฌnh ghรฉ shop Cแปฉ nghฤฉ shop cรณ mแบฅy hแป thแปng cรณ thฦฐฦกng hiแปu khรก thแบฅy vแปng khi mua ฤแป tแบกi shop phแปฅc vแปฅ kรฉm thรกi ฤแป ra mแบทt mแปi ngฦฐแปi cแบฉn thแบญn vรด phแบฃi mua chแปฉ ko mua coi chแปซng bแป chฦฐแปi nha nรณi chung ฤแป ko ฤแบนp mร thรกi ฤแป phแปฅc vแปฅ cรฒn tแป hฦกn,0,0,0,0,0,0
"hรng kรฉm chแบฅt lฦฐแปฃng, nhรขn viรชn thรฌ hแปn lรกo, thรกi ฤแป rแบฅt tแป mแปi ngฦฐแปi nรชn nรฉ shop nรy ra",0,0,0,0,0,0
"Nhรขn viรชn thรกi ฤแป lแปi lแปm. Hรng nhiแปu quรก thรฌ thuรช nhรขn viรชn thรชm nha. Chแปฉ ฤแปซng bแบฃo vแปi khรกch lร "" Shop sแบฏp chแบฟt rแปi nha"".",0,0,0,0,0,0
Shop toรn tแบกo nick giแบฃ ฤรกnh giรก 5 sao thรดi.Hรng kรฉm chแบฏc lฦฐแปฃng giรก cแบฃ cao,0,0,0,0,0,0
"ฤแป ฤแบนp giแปng nhฦฐ hรฌnh, shop bรกn nhiแปu loแบกi trong ฤรณ thแบฟ mแบกnh lร hรng thu ฤรดng. รo khoรกc dแบก แป shop rแบฅt ฤแบนp, hoแบก tiแบฟt dแป thฦฐฦกng. Mรฌnh ฤรฃ mua ฤฦฐแปฃc nhiแปu mแบซu รกo khoรกc dแบก cรนng phแปฅ kiแปn mลฉ len, bao tay, giรy ฤi tuyแบฟt cho chuyแบฟn du lแปch nฦฐแปc ngoรi.",0,0,0,0,0,0
Mรฌnh khรดng biแบฟt mแปi ngฦฐแปi mua hรng thแบฟ nรo nhฦฐng mรฌnh mua vแปซa ฤแบฏt mร lแบกi khรดng ฤแบนp nแปฏa.ฤรฃ trแบฃ hรng cho shop mร mรฃi vแบซn chฦฐa nhแบญn ฤฦฐแปฃc tiแปn hoรn.Shop phแบฃn hแปi chแบญm,0,0,0,0,0,0
"Sakura luรดn lร lแปฑa chแปn ฤแบงu tiรชn mแปi khi mรฌnh muแปn mua ฤแป ฤรดng ฤi du lแปch. Shop rแบฅt ฤa dแบกng mแบซu mรฃ tแปซ รกo len, รกo khoรกc dแบก, รกo khoรกc phao... mแบซu nรo cลฉng ฤแบนp, chแบฅt vแบฃi dรy dแบทn. Sแบฝ luรดn แปงng hแป shop.",0,0,0,0,0,0
"2 ngฦฐแปi chแป mรฌnh bแบฏt grab ฤแบฟn shop, 1 ngฦฐแปi thรฌ ฤang bแปฅng mang dแบก chแปญa cลฉng rรกng ngแปi xe 1 tiแบฟng ฤแบฟn mua ฤแป vแบญy mร gแบงn tแปi thรฌ nv nhแบฏn tin bแบฃo ฤรณi bแปฅng quรก ฤรณng cแปญa sแปm ฤแป ฤi ฤn, gแปi ฤiแปn thoแบกi ฤแป nฤn nแป chแป thรชm 5p thรฌ khรดng thรจm bแบฏt mรกy. ฤแบฟn nฦกi ฤแปฉng 10p thรฌ chแป mรฌnh bแบงu bรฌ nแบทng nแป khรดng chแปu nแปi nรชn bแบฏt xe vแป, vแป dc 1 ฤoแบกn thรฌ nv nhแบฏn tin lแบกi bแบฃo ฤn xong rแปi chแป tแปi ฤi. Trแปi ฤแบฅt ฦกi, ฤi mua hรng mร lรm nhฦฐ ฤi xin tiแปn, ฤi nhแบญn tแปซ thiแปn, lรm viแปc thรฌ lรm ฦกn cรณ tรขm xรญu thรฌ mแปi phรกt triแปn ฤฦฐแปฃc, bรกn hรng kiแปu vฤn nghแป kiแปu nรy thรฌ cรณ lแบงn ฤแบงu khรดng cรณ lแบงn sau. Mn mua online thแบฟ nรo thรฌ mรฌnh khรดng dรกm nรณi, nhฦฐng ai tรญnh ฤแบฟn tแบญn shop thรฌ cแบฉn thแบญn nhรฉ, kiแปu mแบฅt cรดng mแบฅt sแปฉc cรฒn รดm cแปฅc tแปฉc vรo ngฦฐแปi",0,0,0,0,0,0
"Giรก cแบฃ cao, hรng kรฉm chแบฅt lฦฐแปฃng khรดng nhฦฐ quแบฃng cรกo. Thรกi ฤแป nhรขn viรชn rแบฅt kรฉm",0,0,0,0,0,0
"Mรฌnh ฤรฃ mua 2 รกo khoรกc vร 1 รกo hoodie cแปงa shop - hรi lรฒng vแปi mแบซu mรฃ, ฤฦฐแปng may, vร chแบฅt liแปu รกo - giรก cแบฃ hแปฃp lรฝ so vแปi chแบฅt lฦฐแปฃng - anh chแปง nhiแปt tรฌnh, vui vแบป :) Sแบฝ tiแบฟp tแปฅc แปงng hแป shop khi cรณ nhu cแบงu",0,0,0,0,0,0
"Vแป trรญ shop hฦกi khรณ tรฌm, nhฦฐng anh chแปง khรก nhiแปt tรฌnh..ฤแป nhiแปu mแบซu ฤแบนp vร giรก cลฉng hแปฃp lรฝ. Mรฌnh cรณ mua cho bแบกn 1 รกo khoรกc แป ฤรขy gแบงn 1 nฤm.. ฤแบฟn giแป รกo vแบซn ฤแบนp vร rแบฅt trendy.",0,0,0,0,0,0
"Shop cรณ nhiแปu mแบซu รกo khoรกc thu ฤรดng ฤแบนp, nhiแปu mแบซu รกo khoรกc dแบก, รกo khoรกc kaki thu ฤรดng dแป thฦฐฦกng phรน hแปฃp vแปi tuแปi teen. Mรฌnh hay ฤi du lแปch nรชn thฦฐแปng mua ฤแป ฤรดng, nรชn 1 nฤm lแบกi ghรฉ shop vรi lแบงn. Tuy nhiรชn ฤแป mรนa hรจ cแปงa shop cรฒn hแบกn chแบฟ,  mong shop nhแบญp thรชm vรกy ฤแบงm,  รกo thun... phรน hแปฃp thแปi tiแบฟt sรi gรฒn.",0,0,0,0,0,0
"รo khoรกc แป shop rแบฅt ฤแบนp, ฤแบทc biแปt lร รกo khoรกc thu ฤรดng rแบฅt nhiแปu mแบซu mรฃ dแป thฦฐฦกng phรน hแปฃp vแปi tuแปi teen. รo hoodie แป shop cลฉng ฤแบนp vร chแบฅt.",0,0,0,0,0,0
"Sakurafashion.vn shop thแปi trang phong cรกch Nhแบญt Bแบฃn hรng ฤแบงu Viแปt Nam. Uy tรญn, chแบฅt lฦฐแปฃng, chuyรชn nghiแปp, giรก tแปt nhแบฅt. Quแบงn รกo Mori girl style,",0,0,0,0,0,0
"Shop toรn lรm nick giแบฃ ฤรกnh giรก cho shop 5 sao khรดng thรดi ko cรณ cรกi nรo lร thแบญt hแบฟt,tรดi ฤแบทt cรกi รกo cแปงa shop online vแป giรก thรฌ cแบฏt cแป,chแบฅt lฦฐแปฃng nhฦฐ hรng ngoรi chแปฃ,mแปi mang ฤฦฐแปฃc vรi tuแบงn bแป sแปn rรกch chแป,ฤiแปn thoแบกi nรณi chuyแปn thรฌ thแบฑng chแปง khรดng nhแบฅc mรกy nhแบฏn tin ko trแบฃ lแปi,nแบฟu google cรณ รขm sao tรดi cลฉng cho shop nรy ฤแป hแป hรnh xแปญ vฤn minh hฦกn",0,0,0,0,0,0
"hรng kรฉm chแบฅt lฦฐแปฃng, nhรขn viรชn thรฌ hแปn lรกo, thรกi ฤแป khรดng tแปt",0,0,0,0,0,0
"Nhรขn viรชn  gแปญi xรกc nhแบญn ฤฦกn hรng nhฦฐng mรฌnh khรดng nhแบญn ฤฦฐแปฃc, mรฌnh yรชu cแบงu gแปญi lแบกi thรฌ bแบกn nhรขn viรชn bแบฃo "" vแบญy thรฌ hแปงy ฤฦกn hรng"" rแปi cรบp mรกy, mรฌnh gแปi lแบกi thรฌ nhแบญn ฤฦฐแปฃc hแปp thฦฐ thoแบกi, thแบญt lแบก?",0,0,0,0,0,0
"hรng ฤแบนp, ฤรบng nhฦฐ hรฌnh, chแบฅt vแบฃi ฤแบนp khแปi chรช, แปงng hแป shop dรi dรi",0,0,0,0,0,0
"Miฬnh thฦฐฦกฬng mua online ฦกฬ sakurafashion, shop rรขฬt uy tiฬn, tฦฐ vรขฬn chรขn thรขฬฃt, haฬng giรดฬng hiฬnh, nhaฬn maฬc trรชn hiฬnh cuฬng giรดฬng saฬn phรขฬm ฦกฬ ngoaฬi.",0,0,0,0,0,0
"Mรฌnh ฤรฃ mua 2 รกo len ฤi du lแปch nฦฐแปc ngoรi, chแบฅt vแบฃi mแปm mแปn.",0,0,0,0,0,0
Hรng ฤแบนp chแบฅt lฦฐแปฃng nhฦฐ hรฌnh nhฦฐng ฤแปฃi shop phแบฃn hแปi lรขu quรก shop ฦกi :(((,0,0,0,0,0,0
Shop rแบฅt uy tรญn. Mรฌnh cแบฃm thแบฅy an tรขm vแป chแบฅt lฦฐแปฃng sp khi mua hรng แป ฤรขy.,0,0,0,0,0,0
"Vแปซa mua แป ฤรขy anh chแปง rแบฅt vui tรญnh dแป thฦฐฦกng,  รกo khoรกc ฤแบนp.",0,0,0,0,0,0
"Mรฌnh mua mแปt รกo khoรกc, hai nรณn len, mแปt khฤn choรng ฤแป ฤi du lแปch ฤร lแบกt",0,0,0,0,0,0
"Hรng ฤแบนp, รกo bao dแป thฦฐฦกng, anh chแปง nhiแปt tรฌnh :v",0,0,0,0,0,0
"Quแบงn รกo ""so kawaii"" ๐. ฤแบทt hรng online lร chuแบฉn nhแบฅt.",0,0,0,0,0,0
Mรฌnh ฤรฃ chแปn ฤฦฐแปฃc รกo khoรกc ฦฐng รฝ cho chuyแบฟn du lแปch sapa.,0,0,0,0,0,0
"hang dep chat luong nhu hinh. ao khoac thu dong day dan am ap, rat phu hop mac di nuoc ngoai.",0,0,0,0,0,0
"Shop quแบงn รกo ฤแบนp... mร thiแบฟu รกo khoรกc dรi...,",0,0,0,0,0,0
Mรฌnh thแปฑc sแปฑ rแบฅt thรญch sแบฃn phแบฉm cแปงa Sakura Fashion,0,0,0,0,0,0
"ฤรฃ tแปซng trแบฃi nghiแปm tแบกi Shop, thรฌ thiแปt lร cรณ dรด coi thรดi chแปฉ khรดng cรณ thแปญ vร nhรฌn khรดng ฦฐng nรชn khรดng cรณ mua thรฌ thรกi ฤแป nhรขn viรชn xem thฦฐแปng thแบญt sแปฑ :))) chแบฃ thรจm vรo lแบงn hai.",0,0,0,0,0,0
ฤแปชNG GHร SHOP ฤแป KIแบพM TIแปN CHO CON CHแปฆ Vร HแปC THแปจC.LรM ฤN SAU DแปCH KHร KHฤN Mร CON CHแปฆ Nร TฦฏแปNG Cร รT TIแปN Lร Nร MUแปN NรI AI THร NรI.RA ฤแปI LรM ฤN Lร PHแบขI NHรN MแบถT.MรY ฤแปคNG TRรNG GIA ฤรNH THแปจ Dแปฎ RแปI.TแปT NHแบคT ฤรNG SHOP RแปI ฤแปขI Mแป แป NHร.CHแปจ BUรN BรN NแปฎA Cร NGรY CรI Mแป TREO CรNH CรY.CHแปฌI NHแบฆM NGฦฏแปI RรIIIIII,0,0,0,0,0,0
"Shop mแบฅt dแบกy vรด hแปc, ba mแบน khรดng biแบฟt dแบกy con",0,0,0,0,0,0
"ฤแป hแปฃp gu vแปi giแปi trแบป, giรก แปn ko quรก cao, phรน hแปฃp vแปi sinh viรชn, quแบงn รกo cลฉng khรก ฤแบนp, nรชn ghรฉ qua",0,0,0,0,0,0
"NaBi rแบฅt nhiแปu ฤแป xinh แบก, 5 sao rแบฅt xแปฉng ฤรกng nha",0,0,0,0,0,0
Tรดi vร ngฦฐแปi yรชu giแบญn nhau hฦกn 1 tuแบงn rแปi. sau ฤรณ tรดi ฤc 1 ngฦฐแปi bแบกn giแปi thiแปu quแบงn รกo แป ฤรขy ฤแบนp lแบฏm. Nรชn tรดi quyแบฟt ฤแปnh mua 1 chiแบฟc vรกy tแบทng ny ฤแป lรm hรฒa. kแบฟt quแบฃ lร chรบng tรดi ฤi nhร nghแป ngay sau ฤรณ.,0,0,0,0,0,0
"Cแปญa hรng trang trรญ ฤแบนp mแบฏt.Hรng hรณa ฤa dแบกng, phong phรบ, chแบฅt lฦฐแปฃng khแปi phแบฃi bรn luรดn phรน hแปฃp lแปฉa tuแปi teen vร sinh viรชn.ฤแบทt biแปt giรก cแบฃ hแปฃp lรฝ vแปซa tรบi tiแปn vแปi hแปc sinh vร sinh viรชn.Chแปง Shop vร nhรขn viรชn cแปฑc kรฌ dแป thฦฐฦกng, tฦฐ vแบฅn nhiแปt tรฌnh.....",0,0,0,0,0,0
"Shop bรกn ฤแป ฤแบนp, giรก cแบฃ lแบกi rแบฅt phรน hแปฃp. ฤแบทc biแปt thรญch nhแบฅt lร chแป shop rep ib nhanh mร lแบกi rแบฅt dแป thฦฐฦกng, tฦฐ vแบฅn nhiแปt tรฌnh. Mรฌnh sแบฝ mua ฤแป cแปงa shop dรi dรi",0,0,0,0,0,0
"Shop bรกn hรng ฦฐng cแปฑc kรฌ , tฦฐ vแบฅn nhiแปt tรฌnh cho khรกch hรng , rแบฅt chu ฤรกo khi mua hรng cรฒn ฤฦฐแปฃc tแบทng kรจm vรi mรณn quร rแบฅt dรช thฦฐฦกng ๐ Chแบฅt liแปu quแบงn รกo rแบฅt tแปt ๐ giao hรng ฤรบng thแปi hแบกn nแปฏa แบก โค C shop nรณi chuyแปn  rแบฅt ฤรกng yรชu ๐",0,0,0,0,0,0
"Quแบงn baggy jeans bรชn shop vรฃi cแปฑc xแปn vร xinh luรดn รฝ,  รกo khoรกc vรฃi dรน mแบทc nhแบน thรญch lแบฏm แบก. Mua ฤแป ฤฦฐแปฃc tแบทng kรจm quร siรชu siรชu siรชu ฦฐng luรดn รฝ",0,0,0,0,0,0
"ฦฏng cรกi bแปฅng khi mua hรng แป ฤรขy ghรช รก, cรกc chแป tฦฐ vแบฅn nhiแปt tรฌnh vร dแป thฦฐฦกng, lแบงn nรo mua hรng cลฉng cรณ quร, ฤแป rแบป, chแบฅt lแบกi ฤแบนp nแปฏa. Mแบทc dรน mua nhiแปu lแบงn แป ฤรขy rแปi nhฦฐng chแบฃ cรณ cรกi แบฃnh nรo nรชn hแปn ฤแป fb cho cรณ tรขm cแบฃ. Nhฦฐng tแปi nay lแบกi mua thรชm 1 mรณn nแปฏa, vร chแป tฦฐ vแบฅn vแบซn quรก ฦฐ ฤรกng yรชu nรชn vรo vote cho shop, mong shop vแบซn mรฃi giแปฏ ฤฦฐแปฃc sแปฑ tรขm huyแบฟt nhฦฐ nรy, vร vแบซn theo dรตi ฤแป แปงng hแป shop dรi dรi ^^ <3",0,0,0,0,0,0
"Shop bรกn hรng chแบฅt lฦฐแปฃng lแบฏm แบก, giรก cแบฃ hแปฃp lรฝ. Gรณi hรng kแปน lฦฐแปกng, nhรขn viรชn nhiแปt tรฌnh, cรฒn cรณ quร tแบทng dแป thฦฐฦกng nแปฏa.",0,0,0,0,0,0
"Shop bรกn hรng tแปt lแบฏm แบก..nhรขn viรชn nhiแปt tรฌnh lแปch sแปฑ, hรng gรณi kฤฉ cรng, ฤแบนp vร vแบฃi chแบฅt lฦฐแปฃng tแปt nhฦฐ hรฌnh..chรบc sh lรm ฤn may mแบฏn แบก",0,0,0,0,0,0
Quแบงn xinh phรน hแปฃp vแปi giรก tiแปn. Ship nhanh mร nhรขn viรชn tฦฐ vแบฅn nhiแปt tรฌnh nแปฏa แบก๐๐.Sแบฝ แปงng hแป shop dรi dรi.Hi,0,0,0,0,0,0
Shop bรกn hรng chแบฅt lฦฐแปฃng giรก cแบฃ hแปฃp lรญ . Cรฒn thรชm chแป chแปง shop dแป thฦฐฦกng tฦฐ vแบฅn nhiแปt tรฌnh โค,0,0,0,0,0,0
"ร uhm mรฌnh khรดng thรญch mua ฤแป แป ฤรขy lแบฏm. vรฌ ฤแป ฤแบนp mua nhiแปu sแบฝ tแปn nhiแปu tรฌn ๐ญ.chแป tฦฐ vแบฅn thรฌ nhiแปt tรฌnh vรฃi luรดn, mรฌnh ib mua quแบงn thรดi mร tฦฐ vแบซn kฤฉ thแบฅy แปn luรดn hร, nรณi chung lร ฤแป ฤแบนp, rแบป mร chแบฅt lฦฐแปฃng nแปฏa mnn ฦกiiiiiiii ๐",0,0,0,0,0,0
Mรฌnh ฤรฃ mua tรบi vร รกo แป shop. Mรฌnh rแบฅt ฦฐng รฝ vแป chแบฅt lฦฐแปฃng sแบฃn phแบฉm vร shop tฦฐ vแบฅn cลฉng rแบฅt nhiแปt tรฌnh thรขn thiแปn.๐๐๐๐๐๐ป๐๐ป,0,0,0,0,0,0
Mรฌnh khรก thรญch ฤแปa ฤiแปm nรy ฤแป แป ฤรขy giรก tแบงm vแปซa nhแบฅt lร phรน hแปฃp vs ฤแปi tฦฐแปฃng sinh viรชn nhฦฐ mรฌnh. Khรดng gian sแบกch sแบฝ thoรกng mรกt,0,0,0,0,0,0
"Shop bรกn ฤแป cแปฑc xinh, giรก cแบฃ hแปฃp tรบi tiแปn chแป chแปง vร nhรขn viรชn nhiแปt tรฌnh thรขn thiแปn...",0,0,0,0,0,0
Shop bรกn hรng ฦฐng cแปฑc kรฌ แบก. ฤแป bรกn thแบญt sแปฑ rแบฅt ฤแบนp แบก. Sแบฝ tiแบฟp tแปฅc แปงng hแป ๐ค,0,0,0,0,0,0
"Chแปง shop vร nhรขn viรชn rแบฅt gแบงn gลฉi, hiแบฟu khรกch. ฤแบงm vรกy dแป thฦฐฦกng, giรก แปn.",0,0,0,0,0,0
ฤแป vแปซa xinh giรก tiแปn phแบฃi chฤng shop cx nhiแปt tรฌnh ๐ฅฐsแบฝ tt แปงng hแป shop,0,0,0,0,0,0
"Shop bรกn hรng ฦฐng cแปฑc kรฌ , tฦฐ vแบฅn nhiแปt tรฌnh cho khรกch hรng , rแบฅt chu ฤรกo khi mua hรng cรฒn ฤฦฐแปฃc tแบทng kรจm vรi mรณn quร rแบฅt dรช thฦฐฦกng ๐ Chแบฅt liแปu quแบงn รกo rแบฅt tแปt ๐ giao hรng ฤรบng thแปi hแบกn nแปฏa แบก โค C shop nรณi chuyแปn  rแบฅt ฤรกng yรชu ๐",0,0,0,0,0,0
"ฤแป แป shop ฤแบนp lแบฏm แบก. Giao hรng lแบกi nhanh, shop inbox tฦฐ vแบฅn nhiแปt tรฌnh lแบฏm...๐๐",0,0,0,0,0,0
"ฤแป xinh, giรก cแบฃ phแบฃi chฤng, chแป chแปง vร nhรขn viรชn ฤแปu thรขn thiแปn dแป thฦฐฦกng",0,0,0,0,0,0
"รo thun, quแบงn baggy vร รกo khoรกc แป ฤรขy lร sแปฑ lแปฑa chแปn khรก แปn",0,0,0,0,0,0
Giao hรng nhanh ฤแป siรชu xinh nhฦฐ hรฌnh vแบฃi ok tuyแปt vแปi,0,0,0,0,0,0
Mua 1 lแบงn mua thรชm lแบงn thแปฉ hai khรดng chรช chแป nรo ๐,0,0,0,0,0,0
Quแบงn รกo trแบป trung. Quy hoแบกch lแบกi nรชn k lแปn xแปn nhฦฐ trc. Cรณ km รกo thun. Giรก cแบฃ hแปฃp lรฝ.,0,0,0,0,0,0
ฤแป rแบป ..chแบฅt lฦฐแปฃng vแปซa phแบฃi.Khรดng cรณ chแป ฤแป xe รดtรด.,0,0,0,0,0,0
"Nhรขn viรชn khรดng hแป nรณi vแปi mรฌnh lร cรณ khu vแปฑc hแบกn chแบฟ ฤแบญu, ฤแป xe theo ngรy ฤแป mรฌnh di chuyแปn xe ฤi, khiแบฟn mรฌnh nhแบญn biรชn bแบฃng phแบกt trong khi ฤรณ cรณ rแบฅt nhiแปu nhรขn viรชn แป trฦฐแปc cแปงa hรng, tuy nhiรชn cรกc bแบกn nhรขn viรชn rแบฅt hแปฏng hแป vร vรด tรขm khi thแบฅy nhฦฐ vแบญy. Mรฌnh rแบฅt k hรi lรฒng vแปi phฦฐฦกng thแปฉc lรm viแปc cแปงa hแป thแปng. Mแปi ngฦฐแปi nรชn cรขn nhแบฏc khi cรณ รฝ ฤแปnh mua sแบฏm แป ฤรขy.",0,0,0,0,0,0
"Khรดng gian mua sแบฏm ฤแบนp thoรกng, dแปch vแปฅ tแปt, nhรขn viรชn tฦฐ vแบฅn nhiแปt tรฌnh, nhiแปu chฦฐฦกng trรฌnh sale khแปงng. Tuy nhiรชn cแบงn bแป sung thรชm nhiแปu loแบกi size quแบงn รกo hฦกn.",0,0,0,0,0,0
"Giรก cแบฃ hแปฃp lรฝ, nhรขn viรชn nhiแปt tรฌnh, sแบฝ ghรฉ lแบกi trong thแปi gian tแปi.",0,0,0,0,0,0
Cรณ 2 nhรขn viรชn nam ฤแปฉng trฦฐแปc cแปญa hรng nhฦฐng khรดng nhแบฏc nhแป khรกch khu vแปฑc cแบฅm ฤแบญu xe,0,0,0,0,0,0
"Giรก cแบฃ khรก hแปฃp lรญ, rแบฅt nhiแปu ฤแป ฤแป lแปฑa chแปn.",0,0,0,0,0,0
"Mรฌnh rแบฅt thรญch mua ฤแป แป ฤรขy, chแบฅt lฦฐแปฃng vร giรก cแบฃ khรก hแปฃp lรฝ vแปi nhแปฏng bแบกn sinh viรชn nhฦฐ mรฌnh.ฤแบทc biแปt lร bแบกn cรณ thแป tแปฑ do chแปn ฤแป vร thแปญ ฤแป mร khรดng cรณ ai kรจ kรจ bรชn bแบกn. Cแบฃm giรกc rแบฅt thoแบฃi mรกi",0,0,0,0,0,0
"Khรดng nรชn mua แป ฤรขy, ฤแบฏt vร rรกch khรก nhanh vร bแบฅt ngแป...hiaz",0,0,0,0,0,0
"Nhรขn viรชn vui vแบป , nhiแปt tรฌnh! Nhiแปu mแบซu giรy dรฉp nam, nแปฏ, trแบป em.",0,0,0,0,0,0
"Cแปญa hรng mแบทt bแบฑng hฦกi nhแป vรฌ vแบญy kแป bแป trรญ quรก sรกt nhau. Ngฦฐแปi ฤแปฉng chแปn mแบฉu thรฌ ngฦฐแปi khรกc rแบฅt khรณ ฤi. Hรดm nรo thฦฐa thรฌ khรดng nรณi, ฤรดng thรฌ phแบฃi nรณi rแบฅt khรณ chแปu. Mแบฉu mรฃ cแปงng khรดng ฤแปง do khรดng ฤแปง khรดng gian ฤแป trฦฐng bรy. Vรฌ kho nhแป nรชn khรดng ฤแปง size. ฤรฃ tแปi rแบฅt nhiแปu lแบงn thแบฅy nhรขn viรชn nhiแปt tรฌnh, thแปnh thoแบฃng cแปงng cรณ nhรขn viรชn khรดng nhiแปt tรฌnh lแบฏm, giแปฏ xe thรฌ ngรy thฦฐแปng cแปงng nhiแปt tรฌnh, gแบทp hรดm ฤรดng khรกch thรฌ bแบฃo vแป ฤแป tแปฑ khรกch hรng tแปฑ xแบฟp xe luรดn chแบฏc do mแปt quรก thรฌ phแบฃi. Chฦฐa bแบฃo hรnh lแบงn nรo nรชn chฦฐa biแบฟt dแปch vแปฅ bแบฃo hรnh cรณ tแปt khรดng nแปฏa. ฤแปi trแบฃ hรng theo quy ฤแปnh, mรฌnh thแบฅy vแปฅ nรy แปn.",0,0,0,0,0,0
"Bแป sung (vแป mรฌnh kiแปm tra: mรฌnh mua vแปi Hฤ 790k, thรฌ fi dc tแบทng Nรณn Bแบฃo Hiแปm chแปฉ, vแบญy mร NV ฤฦฐa mรฌnh kai nรณn Vแบฃi, mรฌnh khรดng ฤแป รฝ chฦฐฦกng trรฌnh, vแป nghe Bแบกn nรณi mแปi biแบฟt) kรจm theo Thรกi ฤแป NV cแปงa Bitis nรชn mรฌnh ฤรกnh giรก 1 sao...Tรดi rแบฅt thรญch sแบฃn phแบฉm cแปงa Bitis..Nhรขn Viรชn thiแบฟu chuyรชn nghiแปp, khรดng tฦฐ vแบฅn khรกch, Size hแปi thรฌ khรดng cรณ..Bแบกn NV tรญnh tiแปn thรฌ khรณ chแปu: Tรดi tรญnh tiแปn, Bแบกn แบฅy khรดng hแปi thแบป thรnh viรชn, tรดi nรณi mรฌnh cรณ mua SP แป Bitis vร cรณ DKy thรnh viรชn rแปi. Bแบกn แบฅy check SDT thรฌ khรดng ra, vร nรณi lแบกi tรดi โLแบงn sau a nรณi thรnh Viรชn sแปm ฤiโ. Tรดi sao biแบฟt quy trรฌnh tรญnh tiแปn bรชn Bitis thแบฟ nรo, NV fai chแปง ฤแปng hแปi chแปฉ. แป Coopmax ngฦฐแปi tรญnh tiแปn cแบฃ trฤm, nghรฌn ngฦฐแปi nhฦฐng Nv hแป luรดn hแปi, cรฒn Bitis cรณ vรi ngฦฐแปi tรญnh tiแปn mร cรฒn khรณ chแปu...Tรดi แปงng hแป hรng viแปt, nhฦฐng NV Bitis thรกi ฤแป khรดng tแปt.",0,0,0,0,0,0
